query,region,title,excerpt,date,source,link
semiconductor,china,Hong Kong says no personal data shared in vaccine deal with ...,"HONG KONG, July 14 - Hong Kong's agreement to buy BioNTech Covid-19 vaccines from Chinese sales agent Shanghai Fosun Pharmaceutical Group Co Ltd did not include clauses for Fosun or other third parties to collect personal data, the territory's government said.
Reuters reported this week that Fosun had sent over a template, based on a contract signed with Chinese-run Hong Kong, in talks with two Taiwanese tech firms for the vaccine in which Fosun sought access to Taiwanese medical records.
Fosun is BioNTech SE's sales agent for mainland China, Hong Kong, Macau and Taiwan.
Hong Kong's government has always attached great importance to personal data privacy, and in the city's vaccination programme there are clear and strict guidelines and procedures for the collection and use of personal information, it added.
ALSO READ: Politics, health collided in Taiwan's tortured BioNTech Covid-19 vaccine talks",2021-08-31,AsiaOne,https://www.asiaone.com/china/hong-kong-says-no-personal-data-shared-vaccine-deal-fosun
semiconductor,china,Radiofrequency transistors based on high-purity carbon nanotube arrays,"Two of the semiconductors most widely used to fabricate radiofrequency devices are silicon complementary metal-oxide-semiconductor (CMOS) field-effect transistors (FETs) and transistors based on III-V compound semiconductors, particularly GaAs.
Researchers at Peking University in China have recently fabricated new RF transistors based on aligned CNT arrays.
""We obtained CNT arrays for radiofrequency application through a double-dispersion and binary liquid interface-confined self-assembly (BLIS) procedure and realized the fabrication of highly performing radiofrequency devices and amplifiers based on CNT arrays,"" Peng said.
Notably, the CNT-based RF transistors developed by this team of researchers fall into the category of metal-oxide-semiconductor (MOS) field-effect transistors (FETs).
Explore further Researchers create a hybrid technology that combines III-V tunnel FETs and MOSFETsMore information: Radiofrequency transistors based on aligned carbon nanotube arrays",2021-08-31,Tech Xplore,https://techxplore.com/news/2021-07-radiofrequency-transistors-based-high-purity-carbon.html
semiconductor,china,"Global and China Lidar Market Report, 2021-2025: Demand ...","DUBLIN, July 12, 2021 /PRNewswire/ -- The ""Global and China Lidar Market Insight Report, 2021-2025"" report has been added to ResearchAndMarkets.com's offering.
Intelligentization includes three links: sensing, decision-making and control, and lidar is the core sensor at the sensing level.
Market spaceUnder the hardware embedded strategy, lidar will accelerate loading at L3 and above.
Key Topics Covered:1 Overview: The core sensing component of intelligent driving is driven by both supply and demand1.1 What is lidar?
Discussion on technical trend: laser radar is essential, and semi-solid and solid are the trends3.1 Dimension of technical scheme: Do you use laser radar?",2021-08-31,PR Newswire,https://www.prnewswire.com/news-releases/global-and-china-lidar-market-report-2021-2025-demand-drag-supply-innovation-and-high-level-intelligent-driving-to-accelerate-penetration-301331745.html
semiconductor,china,China’s Crackdown on Bitcoin Miners Could Be Huge for DAPP,"Until recently, more than half the world's Bitcoin miners were located China, but Beijing has clamped down on that activity, sending dozens of miners of largest digital currency offline.
While some may seek refuge in other locations, including the U.S., China's Bitcoin crackdown is sending miners scurrying.
According to prior estimates, 65% to 75% of global Bitcoin mining occurred in China.
“The world has known for months that more than half the world’s bitcoin miners would be going dark as China cracked down on mining.
That's the result of so many Chinese miners going dark",2021-08-31,Nasdaq,https://www.nasdaq.com/articles/chinas-crackdown-on-bitcoin-miners-could-be-huge-for-dapp-2021-07-08
semiconductor,china,ICYMI: We spend some time with Apple's iOS 15 beta,"Apple’s iOS 15 is slated for release this fall, and this week we’ve got a hands-on with its public beta.
As most of the changes are already available, it’s perhaps not surprising that the beta is fairly complete.
And because it now features an octa-core processor and a 13-megapixel wide-angle camera, the Echo Show 8 is now more useful for video calls.
The camera also has digital panning and zooming technology so it can follow you during video calls, although in Nicole’s experience, this took a few seconds to kick in.
Overall, Cherlynn calls the Luxe well-made and capable, but best for those looking for a petite tracker",2021-08-31,Yahoo Finance,https://finance.yahoo.com/news/icymi-we-spend-some-time-with-the-apple-ios-15-beta-160009850.html
semiconductor,china,Samsung TV Plus now streaming on the web," market trackers cut 2021 India outlook due to import curbs in China ... 
Still, the semiconductor shortage could start to ease by the end of the 
year as ",2021-08-31,ET Telecom,https://telecom.economictimes.indiatimes.com/news/samsung-tv-plus-now-streaming-on-the-web/84312581
semiconductor,china,China's tech giant crackdown is about much more than data ...,"China wants to curb the influence of major tech players and ensure that innovation – and data – stay at home.
It may hurt business growth, but it will not slow R&D",2021-08-31,IAM Media,https://www.iam-media.com/law-policy/chinas-tech-giant-crackdown-about-much-more-data-control
semiconductor,china,"Dow Futures Slide Amid Delta Variant Growth Worries; Taiwan Semi Supports 
Tech","Growth concerns are outpacing inflation worries Thursday as Delta-variant infections accelerate in major economies around the world.
The Thursday Market MinuteGlobal stocks continue to retreat from records highs as growth concerns overtake inflation worries amid the dovish messaging from Fed Chair Jerome Powell.
China Q2 GDP slows to 7.9%, but underlying data indicates solid, although not spectacular, growth metrics.
Taiwan Semiconductor posts record June quarter revenues, and sees September quarter sales rising 20% from last year on stronger handset and chip demand.
Softer oil prices, however, are holding down gains for the Dow Jones Industrial Average, where futures are indicating a 160 opening bell decline",2021-08-31,TheStreet,https://www.thestreet.com/investing/dow-futures-dip-as-powell-tweaks-growth-concern-tech-stocks-gain
semiconductor,china,Chinese Electronic Components Firm BOE Technology ...,"BOE, a Beijing-based provider of semiconductor display technology, products and services, on Tuesday evening released its semi-annual performance forecast, predicting a sharp improvement for the first half of the year.
The company expects net profits attributable to shareholders of listed companies to rise to between 12.5 and 12.7 billion yuan in the first half of 2021 – up by 1001% – 1018% year-on-year.
Besides, its market share of flexible display products ranked first in the domestic industry and second in the world.
In the field of smart finance, BOE has secured strategic cooperation with China Minsheng Banking Corp, Industrial and Commercial Bank of China, China Construction Bank, Ping An Bank Co., Ltd. and many other banks.
In January 2001, BOE successfully listed on the A-share market – since then, it has set off a series of fundraising frenzies",2021-08-31,Pandaily,https://pandaily.com/chinese-electronic-components-firm-boe-technology-achieves-record-profits-in-first-half-of-2021/
semiconductor,china,"Tencent to put AI to work exploring space – not ways to extend its 
monopolies","Chinese tech giant Tencent has joined forces with the nation’s National Astronomical Observatories to journey into AI space exploration, CEO Pony Ma told the 2021 World Artificial Intelligence Conference in Shanghai on Thursday.
The forward-looking announcement came during a tough week for Chinese tech companies, as Beijing tightened data security and antitrust regulations.
Tencent is best known for its WeChat messaging service and very healthy gaming arm, but also operates a decent cloud and increasingly invests in AI through its in-house AI research division YouTu Lab.
Tencent CEO Pony Ma, who has not been seen publicly since March, spoke remotely at the conference – albeit over a voice link.
The story of CEO Pony Ma vanishing from the public eye amid a government tightening on his company echoes the story of another Ma: Alibaba co-founder and former executive chairman Jack Ma",2021-08-31,The Register,https://www.theregister.com/2021/07/09/tencent_space_research/
semiconductor,china,China’s STAR Market Set to Shine with Syngenta IPO,"Syngenta’s IPO could also be a major boost for the Shanghai STAR market at a time when China is cracking down on overseas investments.
Syngenta IPO to Make Waves Amidst CrackdownCreated in 2019, the STAR market offers a home to some of the biggest innovators within China’s tech and science sectors.
The exchange serves a way to fast-track smaller, private science and tech companies toward IPO, as compared to China’s other markets.
Syngenta is slightly different than many companies that go the IPO route on the STAR market in that it is a Chinese state-owned enterprise but also a global company.
Increased regulations have put a damper on the STAR market as it has been forced to pivot away from fintech companies in favor of biotech and semiconductor listings",2021-08-31,ETF Trends,https://www.etftrends.com/china-insights-channel/chinas-star-market-set-to-shine-with-syngenta-ipo/
semiconductor,china,Opinion | The Trumpian Roots of the Chip Crisis,"A quick summary might be “booming with bottlenecks.”And some of those bottlenecks reflect the mess created by Donald Trump’s trade policy.
Where we are now: Employment is growing at a rate we haven’t seen since 1984.
So, probably, is gross domestic product, although we don’t yet have an official estimate for the second quarter.
We are, however, suffering from shortages of many items, which are crimping production in some areas and leading to sharp price increases in others.
And there’s another bottleneck that may be an even bigger deal than the container shortage: a global shortage of semiconductor chips",2021-08-31,The New York Times,https://www.nytimes.com/2021/07/08/opinion/trump-trade-chips.html
semiconductor,china,"ExaWind Prepares for New Architectures, Bigger Simulations","“I would argue that for any system like this, only when we can really model it well can we optimize that system,” Sprague said.
“If you think about wind farm flow dynamics and coupled turbine structural dynamics, it is truly a very complex system,” Sprague explained.
On the right, the resulting simulations, complete with turbulent atmospheric flow, as resolved by the CPUs of NREL’s Eagle supercomputer.
ExaWind, he said, is open-source and multi-fidelity, and can be run on anything from laptops to next-gen supercomputers.
Looming on the horizon for ExaWind is the next frontier: offshore wind",2021-08-31,HPCwire,https://www.hpcwire.com/2021/07/10/exawind-prepares-for-new-architectures-bigger-simulations/
semiconductor,china,SMC Corporation: To Continue Growing Global Market Share,"Manufacturing is 70% based in Japan and 30% in China to serve that local 
market. ... and we believe semiconductor demand has been a major driver",2021-08-31,Seeking Alpha,https://seekingalpha.com/article/4438668-smc-stock-to-continue-growing-global-market-share
semiconductor,china,Supply Chain Economics: Car Chip Shortage,"The simple story is that before the pandemic, semiconductor manufacturers 
were ... problems at Intel and U.S. restrictions on Chinese manufacturers' 
sales",2021-08-31,Forbes,https://www.forbes.com/sites/billconerly/2021/07/13/supply-chain-economics-car-chip-shortage/
semiconductor,china,"'Microsoft is on the right side of history' says CEO Satya Nadella about 
Big Tech antitrust talks","Major tech companies have been under increasing scrutiny in recent years, though Microsoft has seemingly walked between the raindrops compared to competitors such as Google and Apple.
That was the question Emily Chang posed to Microsoft CEO Satya Nadella during the pair's Bloomberg Television interview.
Nadella then said that Microsoft invests in privacy, security, AI ethics, internet safety, and related topics.
He also highlighted that competitors are putting a lot of money into beating Microsoft, seemingly insinuating that if Microsoft was attempting to stifle competition, said competitors wouldn't be doing what they're doing.
Still, it's worth watching the full Bloomberg Television interview to see how Nadella says the things he does",2021-08-31,Windows Central,https://www.windowscentral.com/microsoft-right-side-history-says-ceo-satya-nadella
semiconductor,china,"Cramer: Chip Sector's Contradictions – AMD, Nvidia, Intel","With the chip shortage, these stocks are making investors nervous, but keep them on your radar, Cramer says.
The semiconductor industry is a “ball of confusion” to investors, just when market mavens crave some stability from chip makers.
One big chip maker stands out in that regard, Cramer said.
Cramer said that, fortunately, Marvell didn't fall flat this time but that's the first time he's seen it hold.
That’s not happening right now and it’s vexing to investors who otherwise may be sector buyers, Cramer noted",2021-08-31,TheStreet,https://www.thestreet.com/jim-cramer/cramer-chip-sectors-contradictions-amd-nvidia-intel
semiconductor,china,Microsoft Teams now has an option to lock or unlock meetings,"Microsoft Teams meeting organizers can now lock and unlock meetings.
Before the new option became available, meeting organizers had to manually accept or deny people who tried to enter a meeting.
To lock a meeting:Start a meeting within Microsoft Teams.
Select Lock.
To unlock the meeting, you can just follow the same steps but select ""Unlock.""",2021-08-31,Windows Central,https://www.windowscentral.com/you-can-now-easily-lock-microsoft-teams-meetings
semiconductor,china,"Stock Markets Today: Booster shots, banking dividends, US ...","Why did this happen?
Please make sure your browser supports JavaScript and cookies and that you are not blocking them from loading.
For more information you can review our Terms of Service and Cookie Policy",2021-08-31,Bloomberg.com,https://www.bloomberg.com/news/newsletters/2021-07-13/stock-markets-today-booster-shots-banking-dividends-u-s-june-inflation
semiconductor,china,Record US Sales Reflect Japanese Carmakers' Resilience to ...,,2021-08-31,Fitch Ratings,https://www.fitchratings.com/research/corporate-finance/record-us-sales-reflect-japanese-carmakers-resilience-to-chip-shortage-08-07-2021
semiconductor,china,"EUA precisam se aliar a Japão e Coreia do Sul para continuar à frente da 
China em tecnologia","EUA precisam se aliar a Japão e Coreia do Sul para continuar à frente da China em tecnologiaÉ o que acredita Eric Schmidt, ex-executivo-chefe do Google e atualmente presidente da Comissão de Segurança Nacional sobre Inteligência Artificial, que faz recomendações de política pública para a área de IA ao presidente dos EUA",2021-08-31,Valor Econômico,https://valor.globo.com/mundo/noticia/2021/07/10/eua-precisam-se-aliar-a-japao-e-coreia-do-sul-para-continuar-a-frente-da-china-em-tecnologia.ghtml
semiconductor,china,French Minister Rules Out New Strict Lockdown as Delta ...,"(Bloomberg) --France must “live with the virus” rather than count on a new lockdown to contain the spread of a new variant of Covid-19, a key ally of President Emmanuel Macron said ahead of a presidential address.
The country could reintroduce limits on the number of people allowed in bars, restaurants in others venue and extend the use of the so-called “health pass,” junior minister for European affairs Clement Beaune said on Europe 1 radio Sunday.
In his speech on Monday evening, Macron is expected to ring the alarm about the rapid spread of the more contagious delta variant in France.
He’s also expected to outline his priorities for the rest of his mandate, including whether he’ll go ahead with his controversial pension reform proposal before his term ends in May 2022.
Macron Weighs Pension Reform Before Bastille Day (1)Delaying an overhaul of pensions by six months “wouldn’t be such a big deal,” Beaune said",2021-08-31,BNN,http://www.bnnbloomberg.ca/french-minister-rules-out-new-strict-lockdown-as-delta-spreads-1.1627625
semiconductor,china,High performance polarization sensitive photodetectors on 2D ...,"They have potential applications in polarization sensitive photodetectors, polarization ultrafast lasers, polarization field effect transistors and polarization sensors.
In addition, the anisotropic optical and electronic properties of 2D layered InSe have already been demonstrated in 2019.
The experimental results (a-b) are in good agreement with the theoretical calculations (c-d) that there are strong anisotropic transport and polarization-sensitive photoresponse in 2D layered β-InSe flakes.
The photocurrent anisotropic ratio of the β-InSe photodetector reaches 0.70, which is ranking high among the single 2D material based PSPDs.
The strong anisotropic Raman, transport and photoresponse properties of the β-InSe enable its great application potential in filter-free polarization sensitive photodetectors",2021-08-31,EurekAlert!,https://www.eurekalert.org/pub_releases/2021-07/scp-hpp071321.php
semiconductor,china,Man who killed COVID-19 control volunteer in NE China ...,"Volunteers sanitize a car at a checkpoint in Taiping Village of Pidu District in Chengdu, southwest China's Sichuan Province, Dec. 9, 2020.
(Xinhua/Shen Bohan)A court in Harbin, Northeast China's Heilongjiang Province, announced on Thursday that the man who killed a COVID-19 control volunteer in February, which at the time caused much sensation and anger among the public in China, was sentenced to death for intentional homicide.The man, Chen Chenglong, stabbed the 42-year-old volunteer, surnamed Zhang, with a knife in the stomach, chest and arms after Zhang stopped him from leaving the community due to epidemic prevention and control regulations on February 3.Zhang died of excessive blood loss.
Chen was arrested at his home on the same day.Chen was also fined with 656,500 yuan ($101,600).The Harbin Intermediate People's Court decided that Chen's serious crime of murdering the volunteer after refusing to obey epidemic control measures should be severely punished according to law.The case has received more than 10 million views as of press time on China's social media platform Sina Weibo, with most netizens agreeing to Chen's death sentence.In a separate case, a man in Southwest China's Yunnan Province, was also sentenced to death in March 2020 for killing two epidemic control staff in February and was executed in July, 2020",2021-08-31,Global Times,https://www.globaltimes.cn/page/202107/1228737.shtml
semiconductor,china,"Jiuzi Holdings, Inc. Signs Letter of Intent with China Petrol ...","JZXN and CPT will also start working on the reforming of CPT's existing gas station network and build trial battery swap stations within the Company's sales network.
With the rapidly increasing number of EVs and limited parking space, transition to a centralized fast charging or battery swap station network becomes paramount.""
""A battery swap station with 25 batteries can generate over RMB 5 million revenue per year with only half of its utilization capacity.
We believe the cooperation with JZXN will both be complementary to our existing gas station network and serve as a perfect opportunity for us to explore transition of our existing gas station to green, low-carbon services.""
About China Petrol Technology (Shenzhen) LimitedChina Petrol Technology operates one of the first innovative internet + energy industry chain platforms ""Didi Gas Station"" in China",2021-08-31,PR Newswire,https://www.prnewswire.com/news-releases/jiuzi-holdings-inc-signs-letter-of-intent-with-china-petrol-technology-on-the-development-of-electric-vehicle-battery-swap-station-network-301333458.html
semiconductor,china,Look For NIO Stock to Rise As Chinese EV Makers Continue Delivery Beats,Look For NIO Stock to Rise As Chinese EV Makers Continue Delivery Beats,2021-08-31,InvestorPlace,https://investorplace.com/2021/07/look-for-nio-stock-to-rise-as-chinese-ev-makers-continue-delivery-beats/
semiconductor,china,Samsung aims to start manufacturing 3nm chips in 2022,"The company was expected to start manufacturing chips using its 3nm technology later this year.
However, the plan seems to have been delayed by one year, and the company now expects to start the mass production of 3nm chips in late 2022.
Samsung Foundry, the South Korean chaebol’s semiconductor chip manufacturing arm, showcased that 5LPP and 4LPP processes will be used to mass-produce chips in high volumes 2021 and 2022, respectively.
Samsung could launch a 3nm Exynos processor in late 2022The 3GAE (3nm Gate-All-Around Early) technology, an early iteration of Samsung’s 3nm process, will only be used by System LSI that makes Exynos processors.
The company had announced that it expected to use the 3nm technology to make chips in 2021, but that has now been delayed to late 2022",2021-08-31,SamMobile,https://www.sammobile.com/news/samsung-start-manufacturing-3nm-chips-2022/
semiconductor,china,"MPs call for ban on import of solar products from Xinjiang to tackle human 
rights abuses","The UK’s Foreign Affairs Committee has called for a ban on the import of solar panels from Xinjiang Province, China, to tackle forced labour in the supply chain.
This includes a number of boycotts and sanctions of products produced in the region, with solar in particular flagged alongside cotton.
Concerns around the use of forced labour in the solar supply chain have been growing, with the Foreign Affairs Committee noting that the evidence of serious human rights abuses —endorsed by the Chinese government's central leadership — is irrefutable.
A report from The Guardian in April found that 40% of UK solar panels include materials sourced from Xinjiang.
“The evidence of severe human rights abuses and crimes against the Uyghur people is already overwhelming and indisputable, and Parliament has called it as genocide,” said chair of the Foreign Affairs Committee, Tom Tugendhat MP",2021-08-31,Solar Power Portal,https://www.solarpowerportal.co.uk/news/mps_call_for_ban_on_import_of_solar_products_from_xinjiang_to_tackle_human
semiconductor,china,"Jio tops 4G chart with 21.9 mbps download speed in June, Vodafone Idea 
fastest in upload: Trai","Accept the updated privacy & cookie policyDear user,ET Telecom privacy and cookie policy has been updated to align with the new data regulations in European Union.
Please review and accept these changes below to continue using the website.
You can see our privacy policy & our cookie policy.
We use cookies to ensure the best experience for you on our website.
If you choose to ignore this message, we'll assume that you are happy to receive all cookies on ET Telecom",2021-08-31,ET Telecom,https://telecom.economictimes.indiatimes.com/news/jio-tops-4g-chart-with-21-9-mbps-download-speed-in-jun-vodafone-idea-fastest-in-upload-trai/84268463
semiconductor,china,"State of Texas: ‘All options on the table’ for Democrats and Speaker Dade 
Phelan in special session","“Many are eager to get back to work,” said Speaker of the House Dade Phelan (R-Beaumont) of the members in the House.
Phelan acknowledged the challenge of balancing the priorities of Democrats in the chamber and the governor’s agenda for the special session.
Phelan suggested he will take a tougher approach if Democrats try to break quorum during this special session.
State Sen. Jane Nelson (R-Flower Mound), who has served in the Texas Senate since 1993, announced she will retire in 2023 after her term is complete.
“It has been a great honor to represent our community in the Texas Senate",2021-08-31,KXAN Austin,https://www.kxan.com/state-of-texas/state-of-texas-all-options-on-the-table-for-democrats-and-speaker-dade-phelan-in-special-session/
semiconductor,china,A Slow Start to Seafarer Vaccines Risks More Shipping Delays,"Why did this happen?
Please make sure your browser supports JavaScript and cookies and that you are not blocking them from loading.
For more information you can review our Terms of Service and Cookie Policy",2021-08-31,Bloomberg.com,https://www.bloomberg.com/news/newsletters/2021-07-13/supply-chain-latest-slow-start-to-seafarer-vaccines-risks-more-ship-delays
semiconductor,china,Apple reportedly eyeing 90 million units of new iPhone,"(AP photo)TAIPEI (Taiwan News) — Apple wants its suppliers to increase production of its upcoming iPhone 13 by 20% this year, Bloomberg reported on Wednesday (July 14).
In recent years, the company has kept a rather consistent production level of roughly 75 million units from its initial iPhone launches to the end of the year, sources told Bloomberg.
Apple is reportedly asking suppliers to have around 90 million devices ready for this year’s launch.
Apple is expected to keep the same size lineup as the 12 series with a 5.4-inch mini, 6.1-inch regular, 6.1-inch Pro, and 6.7-inch Pro models.
Taiwan electronics manufacturer Pegatron will be handling all the mini models and 32% of the 6.1-inch Pro devices, while Chinese manufacturer Luxshare Precision will assemble 40% of the 6.1-inch Pro phones",2021-08-31,Taiwan News,https://www.taiwannews.com.tw/en/news/4249209
