query,region,title,excerpt,date,source,link
semiconductor,china,Trump vs Fauci; UK bans Huawei; South China Sea pushback,"We have updated our Privacy Policy and Terms of Use for Eurasia Group and its affiliates, including GZERO Media, to clarify the types of data we collect, how we collect it, how we use data and with whom we share data.
This website uses cookies.
By using our website you consent to our Terms and Conditions and Privacy Policy, including the transfer of your personal data to the United States from your country of residence (if different), and our use of cookies as described in our Cookie Policy",2020-7-14,GZERO Media,https://www.gzeromedia.com/trump-vs-fauci-uk-bans-huawei-south-china-sea-pushback
semiconductor,china,Scientists in China say US government crackdown is harming ...,"Most research collaborations start from face to face meetings, she says, but researchers need to travel for those to happen.
That would allow research collaborations to flourish while also guarding against genuine threats to security or intellectual property.
Looking elsewhereEarlier this year, Guan says, he started increasing his connections with scientists in Europe and elsewhere outside the United States.
And Wessner understands why some researchers in China might fear being investigated and so reduce their collaborations with the United States.
Data trendsOn paper, collaborations between US and Chinese scientists seem as strong as ever",2020-7-8,Nature,https://www.nature.com/articles/d41586-020-02015-y
semiconductor,china,U.N. Rules Require Cybersecurity Guarantees for Connected Cars,"and the Global Semiconductor Alliance, a Texas-based lobby group for 
semiconductor and technology companies. “The car industry is becoming an 
increasingly ",2020-7-9,The Wall Street Journal,https://www.wsj.com/articles/u-n-rules-require-cybersecurity-guarantees-for-connected-cars-11594287001
semiconductor,china,GaAs RF Revenue to drop by 3.8 percent in 2020 - News,"Lowered demand for telecommunications end-devices in 2020 is also expected to lead to a bearish market for GaAs RF front end as well.
GaAs RF front end revenue is projected to reach US$5.793 billion this year, a 3.8 percent decline YoY.
TrendForce analyst John Wang indicates that RF front end components can be classified according to their applications in various telecommunication devices.
Nonetheless, China still depends on US-based IDMs for PA components and RF modules due to its insufficient R&D competencies for RF front end components.
The overall GaAs foundry revenue was likewise disrupted by the US-China trade war in 1H19",2020-7-13,Compound Semiconductor,https://compoundsemiconductor.net/article/111591/GaAs_RF_Revenue_To_Drop_By_38_Percent_In_2020%7BfeatureExtra%7D
semiconductor,china,Three Gorges Dam scared Taiwan's Delta off investing in Wuhan,"TAIPEI (Taiwan News) — Taiwan’s Delta Electronics, Inc. did not accept invitations to invest in the Chinese city of Wuhan because it was worried about the safety of the Three Gorges Dam, according to the company founder.
Large parts of China have been battered by torrential rain and widespread flooding, leading to Chinese experts questioning whether the dam, once hailed as the world’s largest engineering project, would be able to withstand the onslaught of extreme weather.
Speaking at a forum in Taiwan recently, Delta founder Bruce Cheng (鄭崇華) said he has been following developments in China recently.
While his company has repeatedly been asked to invest in the Wuhan region, it has always refused, and one of the reasons was concern over the stability of the dam, the Liberty Times reported.
It might have been designed the right way for the situation at the time, but climate change has made extreme weather more common, he said, adding that there are doubts about whether the dam could withstand extreme weather caused by global warming",2020-7-10,Taiwan News,https://www.taiwannews.com.tw/en/news/3964142
semiconductor,china,When Will the Semiconductor Industry Bounce Back? Market ...,"Some segments of the electronics and semiconductor industry have suffered 
more ... many companies who previously ordered most of their parts from 
China are ",2020-7-15,All About Circuits,https://www.allaboutcircuits.com/news/when-will-the-semiconductor-industry-bounce-back-market-experts-weight-in/
semiconductor,china,Huawei Beats the Odds With First-Half Revenue Up 13%,"For the six months through June, revenues grew by 13.1% to 454 billion yuan ($64.8 billion) with a net profit margin of 9.2%, Huawei said in a statement Monday.
About 56% of that revenue – or 255.8 billion yuan – came from selling smartphones.
But based on its previous report for the first quarter, the second quarter’s sales would amount to 271.8 billion yuan.
The most striking of these is the U.K., which is reportedly set to announce a complete ban on the Chinese company.
In the Monday statement, Huawei did not address how the latest U.S. sanctions would affect the company",2020-7-14,Caixin Global,https://www.caixinglobal.com/2020-07-14/huawei-beats-the-odds-with-first-half-revenue-up-13-101579785.html
semiconductor,china,Delphi Technologies awarded new power electronics ...,"""Our pioneering approach to the development of propulsion systems technology continues to be recognized and rewarded by our customers,"" said Richard F. Dauch, CEO, Delphi Technologies.
Delphi Technologies built and launched a new manufacturing site in Suzhou, China, less than 18 months ago.
Delphi Technologies' leadership in electrification and electronics is globally recognized by OEMs and perfectly aligns with the company's vision and strategy – to be the pioneers in propulsion technologies, solutions and services.
About Delphi TechnologiesDelphi Technologies is a global provider of propulsion technologies that make vehicles drive cleaner, better and further.
Delphi Technologies builds on its Original Equipment expertise to provide leading service solutions for the aftermarket",2020-7-8,PR Newswire,https://www.prnewswire.com/news-releases/delphi-technologies-awarded-new-power-electronics-business-in-china-301089771.html
semiconductor,china,NTT Docomo to offer low-priced 5G smartphones,"TOKYO --- Japanese mobile operator NTT Docomo will introduce a new line of low-priced 5G smartphones by the end of the year as it tries to attract more subscribers, a top company official revealed Thursday.
NTT Docomo President and CEO Kazuhiro Yoshizawa disclosed the plan for the new smartphones in an interview with Nikkei.
For NTT Docomo to cover its investment costs and generate a profit, it must lift subscriber numbers.
NTT Docomo is falling behind rivals at the low end of the market and faces an uphill battle for subscribers.
NTT Docomo had 70.89 million contracts, including those for smartphones, as of the end of March, slightly down from a year earlier",2020-7-9,Nikkei Asia,https://asia.nikkei.com/Business/Telecommunication/NTT-Docomo-to-offer-low-priced-5G-smartphones
semiconductor,china,EETimes - SMIC: Advanced Process Technologies and Gov't ...,"It offers the most sophisticated process technologies in the country and is expected to be instrumental to the government’s Made in China 2025 plan.
Modern process technologies cost billions of US dollars to develop and while SMIC uses various ways to optimize its expenditures, rising costs require additional funds.
The foundry’s management fully understands that SMIC is going to need larger fabs for more advanced process technologies.
SMIC’s technologiesWhen it comes to implementation of new process technologies, SMIC’s progress has been quite impressive.
To further minimize risks, SMIC asked some of those employees to provide it TSMC’s trade secrets along with process technologies, process flows, recipes, and other necessary things to implement these technologies",2020-7-13,EE Times,https://www.eetimes.com/smic-advanced-process-technologies-and-govt-funding/
semiconductor,china,Entegris Acquires Global Measurement Technologies Inc.,"BILLERICA, Mass.--(BUSINESS WIRE)--Entegris, Inc. (Nasdaq: ENTG) announced today it has acquired Global Measurement Technologies Inc. (GMTI), an analytical instrument provider for critical processes in semiconductor production, and its manufacturing partner Clean Room Plastics, Inc.
Located in Chandler, Arizona, GMTI is now part of the Advanced Materials Handling (AMH) Division of Entegris.
“The acquisition of GMTI enhances Entegris’ position as the premier supplier for yield enhancement solutions for the semiconductor market.
The combined portfolio, global infrastructure and operational resources will allow us to deliver significant value to our customers.,” said Bryan LaFlam, President of Global Measurement Technologies Inc.Entegris acquired Global Measurement Technologies Inc. for an aggregate amount of approximately $36 million in cash, subject to customary post-closing adjustments.
Entegris assumes no obligation to update any forward-looking statements or information, which speak as of their respective dates",2020-7-10,Business Wire,https://www.businesswire.com/news/home/20200710005260/en/Entegris-Acquires-Global-Measurement-Technologies-Inc.
semiconductor,china,"Intel announces September 2 event, likely teasing 11th Gen Tiger Lake CPU 
launch","Intel has ""something big to share"" on September 2, according to an invitation sent to the press today.
The company will hold a virtual event, where we're expecting it'll likely launch its 11th Gen CPU lineup.
The 11th Gen CPUs are expected to be the ""Tiger Lake"" chips that Intel teased at CES 2020.
The company didn't share many details at the time, but it did show off a processing-heavy game being run on a Tiger Lake chip in a thin-and-light laptop.
Tiger Lake chips will be built on Intel's Xe architecture, which is expected to bring much more power and graphics processing prowess to sub-25W PCs",2020-7-15,Windows Central,https://www.windowscentral.com/intel-announces-september-2-event-likely-teasing-11th-gen-tiger-lake-cpu-launch
semiconductor,china,"TSMC 2nm SoC breakthrough, mass-production in 2023","The latest report is that it is expected to enter mass production by 2023.
TSMC is already leading the industry with SoC based on 5nm and 3nm process.
If reports are true, TSMC will be unstoppable by 2023 to 2024 as it begins the 2nm production.
TSMC 2nm: GAA-FET vs Fin-FETTalking about GAA-FET and Fin-FET, they denote the Gate-all-around and Fin Field-effect Transistor models.
Leading the way for Silicon developmentIf we recall, the company officially announced the world’s first R&D centres at Hsinchu, Taiwan for 2nm process last year",2020-7-14,Gizchina.com,https://www.gizchina.com/2020/07/14/tsmc-2nm-soc-breakthrough-mass-production-in-2023/
semiconductor,china,Video shows Shanghai Tower spring massive leak,"TAIPEI (Taiwan News) — Videos surfaced on Monday (July 6) after tenants from the 9th to 60th floors of Shanghai Tower, the tallest building in China, found themselves drenched with leaking water.
According to local Chinese media reports, the leaks inside the massive tower started on Monday.
The water leaks were so severe that many videos show ""rain"" and ""waterfalls"" dropping down from the ceilings, ruining office equipment and electronic devices.
On its official Weibo page, Shanghai Tower stated that the water leaks were caused by an equipment failure within the building.
Shanghai Tower is 121 stories tall and climbs to a height of 632 meters, making it the tallest building in China and the second-tallest in the world, behind only the 828-meter tall Burj Khalifa",2020-7-9,Taiwan News,https://www.taiwannews.com.tw/en/news/3963406
semiconductor,china,Week in charts Still segregated and still struggling,"IN THE LATE 1960s, after 250 years of slavery and Jim Crow laws, African-American households earned around 60% of what white households did.
Policing and the criminal-justice systems may be the most obvious example: witness the protests since the killing of George Floyd.
But the chief factor underlying the economic disadvantages facing African-Americans is the concentrated poverty in largely segregated black communities.
The chief reason is America’s huge fiscal stimulus, including direct payments to households and a temporary rise in unemployment insurance (UI).
Because of another pandemic, covid-19, it was held in cyberspace instead",2020-7-10,The Economist,https://www.economist.com/graphic-detail/2020/07/10/still-segregated-and-still-struggling
semiconductor,china,"Smaller Nodes, Much Bigger Problems","China would continue to use as much as can from their “lower end” chips, to 
stay in the game, while developing the newest",2020-7-15,Semiconductor Engineering,https://semiengineering.com/smaller-nodes-much-bigger-problems/
semiconductor,china,2 Semiconductor ETFs To Drive Long-Term Portfolio Gains,"During the bull run of the past decade, semiconductor stocks have been essential drivers of the broader technology sector's upside.
Therefore in this post we'll consider what long-term investors might expect from the semiconductor industry in the coming months.
Semiconductor stocks are cyclicalSemiconductors are the brains inside electronic devices.
As a result, shares of semiconductor companies usually act as a bellwether for the technology sector as a whole.
With that in mind, here are two semiconductor ETFs that could be appropriate for long-term portfolios:1. iShares PHLX Semiconductor ETFCurrent Price: $276.3852-week range: $167.79-$288.05Current Dividend Yield: 1.1%Expense ratio: 0.46% per year, or $46 on a $10,000 investmentAs one of the largest semiconductor ETFs, the iShares PHLX Semiconductor ETF (NASDAQ: ) is a cap-weighted fund, tilting toward the largest semiconductor stocks",2020-7-14,Investing.com,https://www.investing.com/analysis/2-semiconductor-etfs-to-drive-longterm-portfolio-gains-200530605
semiconductor,china,"SMOORE, VAPORESSO's Parent, Is the First Vaping ...","As the world's largest manufacturer of vaping equipment, SMOORE constantly aims to improve the status quo and is committed to bringing a unified and complete standard to the entire vaping industry.
The listing in Hong Kong has provided SMOORE with a strong supporting role in setting the industry benchmark.
As one of the sub-brands, VAPORESSO has inherited SMOORE's spirit and incorporated it into its own mission to be Beyond the Ordinary.
VAPORESSO's products - such as VECO, ZERO, LUXE and the GEN family - cover the full range of open-system vapes and fulfil the various needs from the vapers.
So far, along with SMOORE, VAPORESSO's business has spread to more than 60 countries and regions around the world and has established a substantial brand influence in Europe, America, and emerging markets",2020-7-15,PR Newswire,https://www.prnewswire.com/news-releases/smoore-vaporessos-parent-is-the-first-vaping-company-listed-in-hong-kong-301093681.html
semiconductor,china,The upside of a new cold war with China,"Today, many of the strongest warnings against a new cold war with China have a similar ring.
That fear is reasonable: The Cold War showed that great democracies are not immune to committing self-harm in the name of security.
As the Cold War showed, this danger is not imaginary.
Tying all this together was McCarthyism, which revealed Cold War politics at their worst.
More broadly, Cold War military spending provided semi-permanent stimulus and millions of good jobs for those in the armed forces and the defense industry",2020-7-14,The Japan Times,https://www.japantimes.co.jp/opinion/2020/07/14/commentary/world-commentary/upside-new-cold-war-china/
semiconductor,china,Video shows Chinese man swept away by floodwaters within ...,"TAIPEI (Taiwan News) — As torrential rain and massive flooding continues to ravage much of southern China, video surfaced on Thursday (July 9) showing a Chinese man being swept away by churning floodwaters as he tries to cling to a fishnet.
A man in Zhangjiajie City, Hunan Province, was seen on Wednesday (July 8) tossing his net to catch fish into a flood-engorged river.
Within just six seconds, the man was jerked into the rapids and quickly disappeared from sight.
In the video, the man can be seen struggling to pull his net back in and being jerked by the powerful current.
The poster of the video cited another source as saying the man was a security guard dispatched by a labor staffing company based in Zhangjiajie",2020-7-10,Taiwan News,https://www.taiwannews.com.tw/en/news/3964052
semiconductor,china,7 Drone Stocks to Consider as the Technology Soars,"Here are seven drone stocks to watch.
Parrot (PAOTF)This French drone maker announced its latest drone, the ANAFI USA, in June.
Plymouth Rock Technologies (PLRTF)Another drone company that could benefit from the tension between the U.S. and China — which has included U.S government agencies banning DJI and other Chinese drone purchases and use — is Plymouth Rock Technologies.
For a purer play, Tim Bain, president of Spark Asset Management Group, points to AeroVironment as one of the top drone stocks to watch.
Seven drone stocks to watch:— EHang Holdings (EH)— Parrot (PAOTF)— Plymouth Rock Technologies (PLRTF)— Nvidia Corp. (NVDA)— Ambarella (AMBA)— AeroVironment (AVAV)— Boeing (BA)More from U.S. News10 Robinhood Stocks Investors Are Buying in JulyThe Complete Berkshire Hathaway Portfolio2020’s Dividend Aristocrats List: All 66 Stocks7 Drone Stocks to Consider as the Technology Soars originally appeared on usnews.com",2020-7-14,WTOP,https://wtop.com/news/2020/07/7-drone-stocks-to-consider-as-the-technology-soars/
semiconductor,china,China Rapid Finance Announces Change of its NYSE Ticker ...,"About China Rapid Finance LimitedChina Rapid Finance Limited (NYSE: XRF) is a holding company operating primarily in the emergency rescue services business.
Its products include SOS Medical Rescue Card, SOS Auto Rescue Card, SOS Financial Rescue Card, and SOS Life Rescue Card.
Forward-Looking StatementsCertain statements made herein are ""forward-looking statements"" within the meaning of the ""safe harbor"" provisions of the Private Securities Litigation Reform Act of 1995.
These forward-looking statements reflect the current analysis of existing information and are subject to various risks and uncertainties.
XRF disclaims any obligation to update the forward-looking statements, whether as a result of new information, future events or otherwise",2020-7-10,PR Newswire,https://www.prnewswire.com/news-releases/china-rapid-finance-announces-change-of-its-nyse-ticker-symbol-to-sos-to-highlight-emergency-rescue-services-business-301091455.html
semiconductor,china,TikTok launches new ad platform as scrutiny increases,"TikTok is launched a new self-serve ad platform aimed at small businesses which could lure advertisers from Facebook and othersFast-growing video-sharing app TikTok on Wednesday launched a self-serve ad platform, underscoring its ambition to compete with rival social platforms even as it faces new scrutiny in the US and elsewhere.
""TikTok's immersive, short-form videos give businesses a platform to participate and engage with a community known for its creativity, ingenuity, and joy,"" said vice president Blake Chandlee in a statement.
The move could ramp up efforts by TikTok to compete with platforms like Facebook, YouTube and Twitter, but comes after the app was banned in India and with US authorities studying actions against the platform.
The research firm eMarketer estimates TikTok has more than 52 million US users, having gained some 12 million since the outbreak of the coronavirus pandemic.
TikTok's move comes amid a growing ad boycott of Facebook, led by activists claiming the world's biggest social network has failed to curb hateful and vitriolic content",2020-7-8,Tech Xplore,https://techxplore.com/news/2020-07-tiktok-ad-platform-scrutiny.html
semiconductor,china,Canon launches new semiconductor lithography system,"Canon has launched the FPA-8000iW, which it describes as the first Canon semiconductor lithography system to support manufacturing using large panels that are common in back-end processing.
Future PLP requirements include cost reduction and further shrinking of semiconductor packaging that protects delicate internal semiconductor circuity from outside environments and electrically connects to external components.
In response to packaging processes that use panel substrates, Canon developed a new stepper platform capable of handling large 515 x 510 mm panel substrates.
Severe warpage is also common in large panel substrates and the new platform and panel-feeding system can overcome up to 10 mm of panel warpage.
Canon’s original projection optical system supports a wide 52 x 68 mm exposure field while achieving 1.0 µm resolution",2020-7-13,Robotics &amp; Automation News,https://roboticsandautomationnews.com/2020/07/13/canon-launches-new-semiconductor-lithography-system/34001/
semiconductor,china,NVIDIA Beats Intel to Secure Largest US Chip Maker Crown,"For the first time, GPU manufacturer NVIDIA is worth more than Intel and has now surpassed the CPU giant as the largest US chip maker based on NASDAQ market capitalization.
NVIDIA hit the milestone on Wednesday after a recent surge saw shares rise 3.5% at $408.64 to give NVIDIA a market cap of $251.31 billion.
NVIDIA has now secured the coveted title as the biggest chip maker in the US, and by extension, the third worldwide.
Miners flocked to purchase NVIDIA GPUs for their mining capabilities, causing widespread shortages and price increases.
While NVIDIA may have trumped Intel as the biggest US chip maker, it still trails in terms of sales",2020-7-9,WePC,https://www.wepc.com/news/nvidia-beats-intel-to-secure-largest-us-chip-maker-crown/
semiconductor,china,Investors pull green levers to reshape energy sector,"They predict that traditional energy companies will return less and be riskier investments in a future where the onus is on transitioning to cleaner forms of energy.
These businesses will be better positioned in a lower-carbon future.”There are less obvious ways of investing in the energy transition than buying renewable energy companies.
Various investment houses are now offering mutual funds that specialise in clean energy or the energy transition.
Schroders last year launched a Global Energy Transition fund that it said would aim to capture the “vast” opportunity in this area.
Pictet has a long-established Clean Energy Fund that invests in Spanish utility company Iberdrola, US clean energy company NextEra Energy and NXP Semiconductors, which uses semiconductor technology to make various industrial processes and transportation more efficient",2020-7-14,Financial Times,https://www.ft.com/content/90e7e8d5-8f33-48f7-9b6b-eff7100b1fd4
semiconductor,china,How Chip-Equipment Maker ASML Is Powering Past the Pandemic,"Dutch semiconductor-equipment maker ASML Holding saw its shares fall from 
... One area of uncertainty: one of ASML's customers sells chips to China's 
Huawei ",2020-7-10,Barron's,https://www.barrons.com/articles/how-chip-equipment-maker-asml-is-powering-past-the-pandemic-51594382400
semiconductor,china,Why Shares of Synopsys Gained 40.1% During the First Half of 2020,"What happenedShares of semiconductor software company Synopsys (NASDAQ:SNPS) rose 40.1% in the first half of the year, according to data from S&P Global Market Intelligence.
Synopsys serves technology businesses, helping them design complex semiconductors.
Revenue rose 3% to $861.3 million, and adjusted (non-GAAP) earnings per share rose to $1.22.
Finally, management raised its full-year outlook for earnings per share and operating cash flow, while maintaining its revenue outlook.
Apparently, the company is able to maintain its revenue outlook while keeping costs in check",2020-7-8,The Motley Fool,https://www.fool.com/investing/2020/07/08/why-shares-of-synopsys-gained-401-during-the-first.aspx
semiconductor,china,Intel And Micron Are Two Likely Winners From Technology Stimulus,"Micron and Intel will likely be the two foremost beneficiaries. China's 
ambitions in the semiconductor industry have weighed heavily against US 
companies in ",2020-7-13,Seeking Alpha,https://seekingalpha.com/article/4357983-intel-and-micron-are-two-likely-winners-from-technology-stimulus
semiconductor,china,Where did it all go wrong for Intel?,"Make informed decisions with the FTKeep abreast of significant corporate, financial and political developments around the world.
Stay informed and spot emerging risks and opportunities with independent global reporting, expert commentary and analysis you can trust",2020-7-9,Financial Times,https://www.ft.com/content/fb2ee190-b1ec-44c0-b10f-8eb185d0fcf1
semiconductor,china,"This Under-the-Radar Chip Stock Is Up 350% This Year. Here's Why It Could 
Go Even Higher.","The company makes single-wafer wet cleaning equipment for semiconductor manufacturers, and it's one of the best-performing under-the-radar stocks this year.
Still, this stock is covered by only a handful of Wall Street analysts and gets almost no attention in the financial media.
For example, unlike many of the high-flying software-as-a-service (SaaS) stocks today, ACM's stock performance looks justified from its fundamentals.
Revenue jumped 44.1% to $107.5 million last year, and the stock trades at a reasonable price-to-sale ratio of 15.
There are also high switching costs, as chipmakers generally stick with the cleaning equipment providers they started using unless their equipment performs poorly",2020-7-14,The Motley Fool,https://www.fool.com/investing/2020/07/14/this-under-the-radar-chip-stock-is-up-350-this-yea.aspx
