query,region,title,excerpt,date,source,link
semiconductor,china,"Mphasis gets US Patent for AI-driven application and infrastructure 
management solution","IT firm Mphasis on Tuesday said it has been awarded a US patent for its AI-driven application and infrastructure management solution.
""The indispensable technology ecosystems of today have made it crucial for enterprises to stay ahead in terms of their IT investments and frameworks.
The solution harnesses the power of AI-driven predictive analysis to improve application and infrastructure efficiency and enables enterprises to automate decision-making for a healthy technological environment,"" Mphasis Senior Vice President Global Head - Solutions Srikumar Ramanathan said.The core functionalities of the solution include Complex Interdependence Analytics to identify error dependencies between components, and Root Cause Analysis to identify the reason for the breakdown and take corrective actions at the earliest.
It also includes functionalities like Storage/Capacity Management to predict the demand and make recommendations as to when enterprises need to go on the cloud or extend or reduce the virtual capacity, and Incident Management through ticket and resource prediction, analysis, and resolution.
""Technology applications and infrastructure have become all-pervasive and the Mphasis solution empowers decision-makers to identify dependencies between components and predict system anomalies,"" Jai Ganesh, Senior Vice President, Head - Mphasis NEXT Labs, said.The benefits include early warning of system anomalies, optimisation of enterprise application and infrastructure landscape, and elimination of system downtime, he added",2021-08-31,ET Telecom,https://telecom.economictimes.indiatimes.com/news/mphasis-gets-us-patent-for-ai-driven-application-and-infrastructure-management-solution/84379593
semiconductor,china,UPDATE 1-WHO panel advises against COVID-19 vaccination proof for travel,"(Adds background)July 15 (Reuters) - The World Health Organization's Emergency Committee on Thursday maintained its stance that proof of COVID-19 vaccination should not be required for international travel, amid a growing debate on blocking the entry of travelers if they are unvaccinated.
The independent experts said that vaccinations should not be the only condition to permit international travel, given limited global access and inequitable distribution of COVID-19 vaccines.
The experts had previously said that requiring proof of vaccination deepens inequities and promotes unequal freedom of movement.
Poorer countries with less access to vaccinations could face exclusion if such measures are put into place, some health experts have said.
The European Union earlier this month launched its digital COVID certificate system designed to help citizens travel more freely across the 27-nation bloc and open up summer tourism",2021-08-31,Yahoo Finance,https://finance.yahoo.com/news/1-panel-advises-against-covid-133331849.html
semiconductor,china,Chip Shortage’s Latest Toll: A Shortage of Work Trucks,"WSJ Jobs Summit. Oct.62021. 12:30 PM - 2:00 PM EDT. The Future Of Health · 
ADD TO CALENDAR. Back to Top. Edition. English, 中文 (Chinese), 日本語 
(Japanese) ",2021-08-31,The Wall Street Journal,https://www.wsj.com/articles/chip-shortage-makes-work-trucks-scarce-for-businesses-facing-booming-demand-11626091201
semiconductor,china,Online Language Training Market Value in APAC to increase ...,"Online Language Training Market in APAC 2021-2025: SegmentationOnline Language Training Market in APAC is segmented as below:ProductCoursesSupport SolutionsAppsEnd-userIndividual LearnersInstitutional LearnersLanguageEnglishChineseGermanOthersTo learn more about the global trends impacting the future of market research,download a free sample: https://www.technavio.com/talk-to-us?report=IRTNTR44903Online Language Training Market in APAC 2021-2025: Vendor Analysis and ScopeTo help businesses improve their market position, the online language training market in APAC provides a detailed analysis of around 25 vendors operating in the market.
The report also covers the following areas:Online Language Training Market in APAC sizeOnline Language Training Market in APAC trendsOnline Language Training Market in APAC industry analysisFlexibility in language learning is likely to emerge as one of the primary drivers of the market.
Technavio's SUBSCRIPTION platformBacked with competitive intelligence and benchmarking, our research report on the online language training market in APAC is designed to provide entry support, customer profile & M&As as well as go-to-market strategy support.
Related Reports on Consumer Discretionary Include:English Language Training Market in China - English language training market in China is segmented by end-user (institutional learners and individual learners) and product (classroom-based, online, and blended).
Download Exclusive Free Sample ReportGlobal Online Language Learning Market - Global online language learning market is segmented by language (English, Mandarin, Spanish, and others), product (courses, solutions, and apps), and geography (APAC, Europe, North America, South America, and MEA)",2021-08-31,PR Newswire,https://www.prnewswire.com/news-releases/online-language-training-market-value-in-apac-to-increase-by--13-37-billion-during-2021-2025--discover-company-insights-in-technavio-301327446.html
semiconductor,china,Should I buy NIO shares at the current price?,"NIO (NYSE: NIO) had an incredible 2020, with the share price rising nearly 1,200% last year.
However, the beginning of 2021 saw a decline in the share price, leading me to buy NIO shares earlier this year for a fraction of the $67 all-time high reached in January 2021.
Having fallen over 25% in the last six months, is now a good time for me to buy more NIO shares?
First, I need to look at why the NIO share price has taken a hit this year.
NIO shares riskA risk, however, is that the current price is very high",2021-08-31,The Motley Fool,https://www.fool.co.uk/investing/2021/07/14/should-i-buy-nio-shares-at-the-current-price/
semiconductor,china,North American auto loss estimates top 1mn,"illuminating the markets®Notice: By accessing this site you agree that you will not copy or reproduce any part of its contents (including, but not limited to, single prices, graphs or news content) in any form or for any purpose whatsoever without the prior written consent of the publisher",2021-08-31,Argus Media,https://www.argusmedia.com/en/news/2233907-north-american-auto-loss-estimates-top-1mn
semiconductor,china,Lumen mulls $5bn sale of consumer biz to Apollo Global ...,"According to reports from Bloomberg, Apollo Global Management is in discussions to acquire a selection of consumer business assets from Lumen Technologies in a transaction that could be worth around $5 billion.
This rumour, if proved true, would not come as too much of a surprise…According to reports from Bloomberg, Apollo Global Management is in discussions to acquire a selection of consumer business assets from Lumen Technologies in a transaction that could be worth around $5 billion.
In total, the company’s fibre network spans around 724,000km globally, with customersThis is not the first time Lumen has considered divesting of its consumer business.
In 2019, the company initiated a strategic review of its consumer business, but this ultimately did not result in a deal being made.
For investment firm Apollo, this would be the latest in a string of investments related to the telecoms sector",2021-08-31,Total Telecom,https://www.totaltele.com/510321/Lumen-mulls-5bn-sale-of-consumer-biz-to-Apollo-Global-Management
semiconductor,china,GPS at risk: Those signals are more vulnerable than you realize,"The GPS signals near the airport were unreliable, and smoke in the area made for poor visibility.
GPS signals reach more than 4 billion military and civilian users worldwide, according to the Space Force.
Those timing signals get translated into location data when a receiver syncs up signals from multiple satellites.
""Wide adoption [of GPS signals] means their vulnerabilities pose a near-existential threat.""
The Russians have jammed or spoofed GPS signals in Scandinavia, Ukraine and Syria",2021-08-31,CNET,https://www.cnet.com/news/gps-at-risk-those-signals-are-more-vulnerable-than-you-realize/
semiconductor,china,"Halbleiter: Was Sie über Mikrochips wissen müssen – und wie Sie sie zu Geld 
machen","Denn sie sind in allen Geräten, die wir im Alltag brauchen: Kreditkarte, Handy, Auto, medizinische Geräte, Flugzeug-Cockpit und und und.
BILD erklärt alles, was Sie als Anleger über Mikrochips wissen müssen: Welche Unternehmen Sie kennen und auf welche Risiken Sie achten müssen.
Die unabhängige Inselrepublik ist China seit ihrer Gründung ein Dorn im Auge – und ist zuletzt zu DEM Weltzentrum für Mikrochips aufgestiegen.
Eine Berechnung des Chip-Riesen Intel ergab: Hätte sich die Automobilproduktion so entwickelt wie die Chip-Herstellung, würde ein Pkw heute 0,04 Cent kosten (Quelle: Handelsblatt).
EUV steht für „Extreme Ultra Violet“ und ist das Licht mit den bisher kürzesten Wellenlängen (13,5 Nanometer)",2021-08-31,BILD.de,https://www.bild.de/geld/wirtschaft/wirtschaft/halbleiter-was-sie-ueber-mikrochips-wissen-muessen-und-wie-sie-sie-zu-geld-mache-76269916.bild.html
semiconductor,china,Mehlman adds former Cantwell deputy chief - POLITICO,"Mehlman adds former Cantwell deputy chiefWith Daniel LippmanFIRST IN PI — MEHLMAN CASTAGNETTI ADDS LONGTIME SENATE HAND: Rosemary Gutierrez, who left the Hill last year after two decades, is joining Mehlman Castagnetti Rosen & Thomas as a principal.
Before that, she spent six years as deputy chief of staff and legislative director to Senate Commerce Chair Maria Cantwell (D-Wash.), coming off 19 years working for former Iowa Sen. Tom Harkin.
AMAZON LOBBIES TO PRESERVE R&D TAX BREAK: “As Amazon publicly embraced President Joe Biden’s plan to raise the corporate tax rate across the board, it has also lobbied Congress to preserve a prized tax break that’s helped it lower its corporate tax bill,” our Theo Meyer reports.
“The retail giant’s founder Jeff Bezos earned plaudits earlier this year when he announced that Amazon would back ‘a rise in the corporate tax rate’ to help pay for Biden’s infrastructure package.
— “The subsidiary backing the initiative is Taqnia ETS, a company that focuses on engineering and technological services for Saudi Arabia",2021-08-31,Politico,https://www.politico.com/newsletters/politico-influence/2021/07/08/mehlman-adds-former-cantwell-deputy-chief-796378
semiconductor,china,"S&amp;P 500 Trickles From Record as Energy, Financials Weigh","By Yasin EbrahimInvesting.com – The S&P 500 eased from fresh record highs Wednesday as an Apple-led rally in tech was offset by weakness in energy and financials as bond yields slipped on dovish remarks from Federal Reserve Chairman Powell.
The S&P 500 rose 0.1%, though eased from its intraday record of 4,392.60 The Dow Jones Industrial Average gained 0.1%, or 7 points, the Nasdaq was down 0.1%.
The remarks arrived on signs that price pressures continue to build as producer inflation surprised to the upside.
The news overshadowed positive data for energy prices showing that weekly U.S. crude supplies fell by 7.9 barrels last week.
The brighter outlook for iPhone demand sparked a bid in the suppliers tied to iPhone supply chain including Taiwan Semiconductor Manufacturing (NYSE:TSM), Jabil Circuit (NYSE:JBL) and Micron Technology (NASDAQ:MU)",2021-08-31,Yahoo Finance,https://finance.yahoo.com/news/p-500-trickles-record-energy-133744794.html
semiconductor,china,Google's Sundar Pichai warns about threats to internet freedom in countries,"New Delhi: Chief Executive Officer of Google Sundar Pichai has warned about threats to the free and open internet in several countries where the flow of information is being restricted.In an interview with BBC on Monday, Google's boss said that ""many countries are restricting the flow of information, and the model is often taken for granted.""
He also addressed controversies around tax, privacy, and data and argued that ""artificial intelligence is more profound than fire, electricity or the internet.
""Referring to different laws being followed in countries relating to online content which makes ""different internets"" for different countries,""... it is more a step back...
I think a free and open internet is a tremendous force for good and we take it for granted a bit...,"" he said in response to a question about ""different internets"" - a reference to countries having increasingly disparate laws about online content and what kind is ""offensive"".
""I'm an American citizen but India is deeply within me",2021-08-31,ET Telecom,https://telecom.economictimes.indiatimes.com/news/googles-sundar-pichai-warns-about-threats-to-internet-freedom-in-countries/84370813
semiconductor,china,Sierra Wireless welcomes new president and CEO,"Sierra Wireless welcomes new president and CEO15 July 2021 | Melanie MingasThe former EVP of Veritas Technologies, Phil Brace, starts a new role in less than two weeks as president and CEO of Sierra Wireless.
He said: “The global IoT solutions market is growing rapidly and Sierra Wireless is well positioned to lead with its strong portfolio of connectivity services, gateways, and embedded modules.
I am very excited to join the company and look forward to making a major impact to drive growth and profitability,”Robin Abrams, chair of the Sierra Wireless board of directors added: “I am thrilled to welcome Phil to Sierra Wireless.
“The Industrial IoT market is in the early stages of digitizing all its assets and Sierra Wireless is growing with the key leaders in this market.
Further growth is coming from 5G and the strong market acceptance of Sierra Wireless new 5G gateways",2021-08-31,Capacity Media,https://www.capacitymedia.com/articles/3829123/sierra-wireless-welcomes-new-president-and-ceo
semiconductor,china,EverCommerce Acquires Medical Design Technologies For Undisclosed Sum,"TipRanksEvery investor wants to buy into a stock that’s primed for growth.
The trick in successful investing is finding those stocks.
What makes this difficult is the truth of the old market cliché, that past performance will not guarantee future returns.
Indeed, past performance may not be a guarantee of a bright future, but it is the dataset investors have available, and it’s natural to consult it.
And when stocks show a record of strong share price appreciation, sustained over an extended period, it",2021-08-31,Yahoo Finance,https://finance.yahoo.com/news/evercommerce-acquires-medical-design-technologies-102012274.html
semiconductor,china,BIT Mining Announces US$50 Million Private Placement,"SHENZHEN, China, July 12, 2021 /PRNewswire/ -- BIT Mining Limited (NYSE: BTCM) (""BIT Mining"" or the ""Company""), today announced that it has entered into securities purchase agreements with certain institutional and accredited investors (""the Investors"") to raise US$50 million in a private placement.
The closing of the private placement is expected to occur on or about July 16, 2021, subject to satisfaction of customary closing conditions.
About BIT MiningBIT Mining (NYSE: BTCM) is a leading cryptocurrency mining company, with a long-term strategy to create value across the cryptocurrency industry.
Its business covers cryptocurrency mining, mining pool, and data center operation.
Important factors that could cause BIT Mining's actual results to differ materially from those indicated in the forward-looking statements include, among others: the completion of the private placement; the satisfaction of customary closing conditions related to the private placement and the intended use of net proceeds from the private placement",2021-08-31,PR Newswire,https://www.prnewswire.com/news-releases/bit-mining-announces-us50-million-private-placement-301331504.html
semiconductor,china,Ford Offering $100 Amazon Gift Card To F-Series Buyers Experiencing Delays,"Ford sent out a bulletin to dealers providing them with a letter template to send to F-Series customers, offering those who are experiencing delays a $100 Amazon e-gift card as compensation for lengthy production delays.
“The Ford F-Series Team is providing a letter template for select customers who are experiencing an extended delay on Retail Orders due to the global semiconductor shortage,” writes Ford in the Bulletin seen by Cars Direct.
Although all automakers are struggling with semiconductor supply shortages, GM and Stellantis have seen sales increase by 19.8% and 17% so far this year, while Ford’s sales have risen just 4.9%.
To help combat the supply shortages, Ford has tried this kind of thing before.
“We’re prioritizing building our customers’ vehicles that were assembled without certain parts due to the industry-wide semiconductor shortage,” a spokesperson told us yesterday",2021-08-31,Carscoops,https://www.carscoops.com/2021/07/ford-offering-100-amazon-gift-card-to-f-series-buyers-experiencing-delays/
semiconductor,china,Waaree Energy Storage System announces partnership with Zypp Electric,"New Delhi: Waaree Energy Storage System has partnered with Zypp Electric to supply lithium batteries to strengthen the latter's two-wheeler category.
This partnership will mobilize clean energy technology with innovative high-tech battery management to build an environment friendly logistics ecosystem, a company statement said.
""We believe this partnership will yield greater penetration of clean energy among industries and propel the growth of reliable electric two-wheelers for last-mile delivery,"" Shiv Nath, MD, Waaree ESS Pvt Ltd said in the statement.Akash Gupta, CEO of Zypp Electric said in the statement, ""With proven expertise in electric mobility solutions, our partnership with Waaree ESS will enable us to fast-track our growth and expand our e-scooter fleet by 10x by 2023.
""Waaree ESS has been a pioneer in addressing the demands of lithium batteries to contribute to the country's ambitious green energy development plan.Zypp Electric is a leading last-mile delivery EV startup, founded in 2017.
The company currently delivers groceries, medicines, food, and packages through their fully automated IoT and AI-enabled scooters",2021-08-31,ETEnergyworld,https://energy.economictimes.indiatimes.com/news/power/waaree-energy-storage-system-announces-partnership-with-zypp-electric/84404829
semiconductor,china,Gotion High-tech Will Provide Products &amp; Technical Support of ...,"HEFEI, China, July 13, 2021 /CNW/ -- On July 12, Gotion High-tech and 
Volkswagen Group reached a strategic cooperation framework agreement ",2021-08-31,CNW Group,https://www.newswire.ca/news-releases/gotion-high-tech-will-provide-products-amp-technical-support-of-unified-cells-for-volkswagen-877681801.html
semiconductor,china,"TSMC dice que nadie desea una guerra por Taiwán, ya que interrumpiría el 
suministro de ""chips""","FOTO DE ARCHIVO: Un logotipo de Taiwan Semiconductor Manufacturing Co (TSMC) se ve en su sede en Hsinchu, Taiwán, el 31 de agosto de 2018.
REUTERS/Tyrone SiuTAIPÉI, 15 jul (Reuters) - Nadie quiere que se desate una guerra por Taiwán porque nadie quiere interrumpir la crucial cadena de suministro mundial de semiconductores, dijo el jueves el presidente del importante fabricante de chips TSMC, en unos comentarios excepcionalmente directos sobre geopolítica.
""En cuanto a una invasión por parte de China, permítanme decirles que todo el mundo quiere tener un Estrecho de Taiwán en paz.
Porque beneficia a todos los países, pero también por la cadena de suministro de semiconductores en Taiwán: nadie quiere interrumpirla"".
(Reporte de Ben Blanchard y Yimou Lee; edición de Muralikumar Anantharaman; traducción de Flora Gómez en la redacción de Gdansk)",2021-08-31,Infobae,https://www.infobae.com/america/agencias/2021/07/15/tsmc-dice-que-nadie-desea-una-guerra-por-taiwan-ya-que-interrumpiria-el-suministro-de-chips/
semiconductor,china,"Augmenting its quantum technology offerings, Rohde ...","The company has over 100 employees at its Zurich headquarters and regional 
offices in China, the U.S., France, South Korea, Japan, and Italy",2021-08-31,Laser Focus World,https://www.laserfocusworld.com/photonics-business/article/14206509/augmenting-its-quantum-technology-offerings-rohde-schwarz-acquires-zurich-instruments
semiconductor,china,7 Most Undervalued Stocks in the Market Right Now,7 Most Undervalued Stocks in the Market Right Now,2021-08-31,InvestorPlace,https://investorplace.com/2021/07/7-most-undervalued-stocks-in-market-right-now/
semiconductor,china,Las ventas de semiconductores alcanzaron un nuevo récord ...,"Según las cifras publicadas por la Asociación de la Industria de Semiconductores (SIA), las ventas alcanzaron unos 43.600 millones de dólares, un 4,1% con respecto al exitoso mes anterior (41.900 millones).
John Neuffer, presidente y director ejecutivo de SIA, explica en su comunicado que “la demanda mundial de semiconductores se mantuvo alta en mayo, ya que las ventas aumentaron tanto de año a año como de mes a mes en todos los principales mercados regionales.
La industria envió más unidades en mayo en una base móvil de tres meses que durante cualquier mes anterior en la historia del mercado, lo que indica que la producción de semiconductores ha aumentado significativamente para abordar la creciente demanda”.
Analizando el mercado por regiones, el mayor incremento interanual se ha producido en Europa, donde las ventas han aumentado un impresionante 31,2% con respecto a mayo de 2020.
En cuanto al crecimiento mensual, las ventas aumentaron más en América (5,9%), seguida de China (5,4%), Japón (3,1%), Asia Pacífico/Resto de países (2,6%) y Europa (1,1%)",2021-08-31,Almacenamiento IT,https://almacenamientoit.ituser.es/noticias-y-actualidad/2021/07/las-ventas-de-semiconductores-alcanzaron-un-nuevo-record-en-el-mes-de-mayo
semiconductor,china,"Cybercriminals took advantage of WFH to target financial services 
companies, say financial bods","Criminals targeted security gaps at financial services firms as their staff moved to working from home, according to a report issued by the international Financial Stability Board (FSB) on Tuesday.
“Working from home (WFH) arrangements propelled the adoption of new technologies and accelerated digitalization in financial services,” the report states.
These crimes grew from fewer than 5000 per week to more than 200,000 per week between February 2020 and April 2021.
FSB suggests institutions accordingly adjust their cyber risk management processes, incident reporting, response and recovery activities, and how they manage cloud and other third-party services.
The report [PDF] is a preliminary take on the pandemic’s impact on financial stability",2021-08-31,The Register,https://www.theregister.com/2021/07/14/financial_stability_board_pandemic_report/
semiconductor,china,Global PC shipments lag after pandemic peaked demand,"Worldwide shipments of PCs grew just 4.6 per cent in comparison to the second quarter in 2020, after the pandemic peaked demand, according to research and advisory firm Gartner.
The shipments totalled 71.6m units in the second quarter of this year and while the growth appears minor, it remains above pre-pandemic levels.
After a year of “extremely strong” PC demand, Europe, Middle East and Africa (EMEA) PC shipments tumbled 1.9 per cent year on year.
“This past quarter saw the market readjusting to new norms in shipments, inventory and demand after an unprecedented peak in 2020,” research director, Mikako Kitagawa said.
However, HP’s worldwide PC shipments shrank 11.3 per cent in the second quarter of 2021 compared to a year ago",2021-08-31,City AM,https://www.cityam.com/global-pc-shipments-lag-after-pandemic-peaked-demand/
semiconductor,china,Pelliconi Group signed the investment agreement to build high ...,"CND continues to promote exchanges and partnerships with Italian companies with a focus on leveraging resources across channels to seek opportunities in different industry fields.
CND is quite well-known among Italian companies as one of China's most attractive investment destinations for its strategic geographical location, comprehensive infrastructure, large talent pool and business-friendly environment.
With its mature business concept and advanced manufacturing technologies, Pelliconi expects to accelerate its growth with the new Changzhou facility and the revenue that the facility is expected to generate for the group's global operations.
About Changzhou National Hi-Tech District (CND)Changzhou National Hi-Tech District (CND) is located in the heart of the Yangtze River Delta.
Related link: http://cznd.changzhou.gov.cn/SOURCE Changzhou National Hi-Tech DistrictRelated Linkswww.cznd.gov.cn",2021-08-31,PR Newswire,https://www.prnewswire.com/news-releases/pelliconi-group-signed-the-investment-agreement-to-build-high-end-packaging-materials-facility-in-changzhou-national-hi-tech-district-301334472.html
semiconductor,china,"Hon Hai, US partner in talks to make electric cars in Wisconsin",,2021-08-31,Focus Taiwan,https://focustaiwan.tw/business/202107090023
