query,region,title,excerpt,date,source,link
semiconductor,china,Intel to invest $20 billion in European chip plants,"As the jostling for global semiconductor production power intensifies, with China looking to play an increasingly influential role, Intel is spreading its wings and seeking to lay down roots in key areas of demand.
China is already globally proficient in 28nm chip technology and is absolutely determined to cash-in on 14nm semiconductors.
Hence the news that Intel is to invest US$20 billion over 10 years in constructing semiconductor fabrication plants (fabs) and other supporting facilities across Europe.
If successful, in due course, the building spree will continue, and the value of Intel’s investment could rise to $100 billion in the long-term.
Among the countries included in his tour were Belgium, France, Italy, Germany, Ireland, the Netherlands and the UK",2021-08-31,TelecomTV,https://www.telecomtv.com/content/digital-platforms-services/intel-to-invest-20-billion-in-european-chip-plants-41956/
semiconductor,china,Why US-China Rivalry Might Be Good for Singapore's ...,"It’s about diversifying global supply chains as geopolitical competition between the U.S. and China heats up.
As Caulfield notes, Taiwan has dominated semiconductor manufacturing for quite a while, with companies like TSCM being the main suppliers for Apple and other huge global brands.
Chartered Semiconductor was meant to help turn Singapore into a global manufacturing hub for semiconductors and computer components and for a while things were going pretty well.
It was a shrewd time to exit, as the electronic and computer component manufacturing industry in Singapore remained moribund for several more years.
I expect we will see more reshuffling of global supply chains like this in the future where countries like Singapore with the right infrastructure, regulatory architecture, and other factor endowments will stand to benefit significantly",2021-08-31,The Diplomat,https://thediplomat.com/2021/07/why-us-china-rivalry-might-be-good-for-singapores-semiconductor-industry/
semiconductor,china,U.K. Sold Off $42 Billion of Semiconductor Firms Before Review,"Why did this happen?
Please make sure your browser supports JavaScript and cookies and that you are not blocking them from loading.
For more information you can review our Terms of Service and Cookie Policy",2021-08-31,Bloomberg.com,https://www.bloomberg.com/news/articles/2021-07-11/u-k-sold-off-42-billion-of-semiconductor-firms-before-review
semiconductor,china,Tencent makes foray into semiconductor chip business,"Tencent's foray means that all three giants in China's digital economy - Baidu, Alibaba and Tencent, known as BAT - are now involved in the business.Search giant Baidu was the earliest entrant into the chip sector among the three.
It spun off its chip unit Kunlun as an independent company with a valuation of 13 billion yuan ($2 billion).
Kunlun chips are designed to optimize AI workloads and improve cloud computing's cost structure.Alibaba launched its Pingtouge chip division in 2018.
The next year, it came out with its first AI chip, called Hanguang 800, intended for use in its own cloud computing system.
The competition has recently intensified amid a global shortage of chips and US restrictions on chip supplies, analysts said",2021-08-31,Global Times,https://www.globaltimes.cn/page/202107/1228798.shtml
semiconductor,china,What is semiconductor sovereignty worth?,"For the EU and US, this growth is a means to reach semiconductor sovereignty, while Asia pushes to continue its current dominance in chip manufacturing and advance its chip technology.
Taiwan dominates advanced semiconductor manufacturing as home of the world’s largest chip foundry, TSMC.
China imports USD 300 billion worth of semiconductors and is experiencing ongoing pushback in its chip manufacturing.
This alliance has the potential to bring companies together to fund the efforts to increase EU semiconductor market share to 20% by 2030 (it currently holds 10% of the market).
Reports state that USD 42 billion worth of the UK's semiconductor business has been sold since 2010.The worldwide reliance on chip manufacturing continues to grow as consumer demand increases amid advancements in technology",2021-08-31,Evertiq,https://evertiq.com/news/50318
semiconductor,china,"TSMC, Foxconn say they are in process of signing deal for ...","TAIPEI (Reuters) -- Taiwan's TSMC and Foxconn said on Sunday they were in the middle of the contract signing process to buy COVID-19 vaccines from Germany's BioNTech SE, part of a drawn out and highly politicized process for Taiwan to access the shot.
We are in the middle of the contract signing process.
We will make announcements once the process is completed,"" TSMC said a statement.
The BioNTech vaccine drama has transfixed Taiwan and dominated headlines.
Germany's government has also been involved, saying it has been helping in the direct talks between Taiwan and BioNTech",2021-08-31,Nikkei Asia,https://asia.nikkei.com/Spotlight/Coronavirus/COVID-vaccines/TSMC-Foxconn-say-they-are-in-process-of-signing-deal-for-BioNTech-vaccines
semiconductor,china,Chinese semiconductor giant Tsinghua Unigroup faces ...,"Chinese semiconductor giant Tsinghua Unigroup faces bankruptcy. But the 
business is expected to survive thanks to its crucial role in China's 
semiconductor ",2021-08-31,Data Center Dynamics,https://www.datacenterdynamics.com/en/news/chinese-semiconductor-giant-tsinghua-unigroup-faces-bankruptcy/
semiconductor,china,China’s semiconductor imports surge in June amid global shortage,"China imported more than 310 billion semiconductor devices in the first half of this year, up 29 per cent from a year ago.
Photo: Shutterstock",2021-08-31,South China Morning Post,https://www.scmp.com/tech/big-tech/article/3140960/chinas-chip-imports-soar-june-manufacturers-build-supply-amid-global
semiconductor,china,China's automobiles sales drop amid shortage of car chips,"The historic chip shortage has crimped production for automakers around the world, including some in China, the group said.
Japanese carmakers were among the hardest hit by the chip shortage last month.
Nissan Motor Co.'s China sales were down 16 per cent in June from a year earlier, while Honda Motor Co.'s were off 17 per cent.
Nikkie Asia reported that until now, the global chip crunch had only a limited impact on the Chinese auto market.
However, the global chip shortage persisted longer than predicted, and the impact is starting to creep into Chinese automaking",2021-08-31,ANI News,https://www.aninews.in/news/world/asia/chinas-automobiles-sales-drop-amid-shortage-of-car-chips20210710125217
semiconductor,china,TSMC chairman says nobody wants war over Taiwan as chip ...,"The logo of Taiwan Semiconductor Manufacturing Co (TSMC) is pictured at its headquarters, in Hsinchu, Taiwan, Jan. 19, 2021.
REUTERS/Ann WangTAIPEI, July 15 (Reuters) - Nobody wants to see a war over Taiwan because nobody wants to disrupt the crucial global supply chain of semiconductors, the chairman of major chipmaker TSMC (2330.TW), said on Thursday, in unusually direct comments about geopolitics.
Mark Liu, Taiwan Semiconductor Manufacturing Co Ltd's chairman, told an earnings call that the COVID-19 pandemic has already been disruptive enough for the global economy and no country wants to see instability around Taiwan.
""As to an invasion by China, let me tell you everybody wants to have a peaceful Taiwan Strait.
Because it is to every country's benefit, but also because of the semiconductor supply chain in Taiwan - no one wants to disrupt it.""",2021-08-31,Reuters,https://www.reuters.com/world/asia-pacific/tsmc-chairman-says-nobody-wants-war-over-taiwan-chip-supplies-too-valuable-2021-07-15/
semiconductor,china,Can The U.S. Compete For Chip Dominance?,"The Taiwan Semiconductor Manufacturing Company (TSMC) alone is ... which 
has long been a flash point for geopolitical tension between the U.S. and 
China",2021-08-31,Forbes,https://www.forbes.com/sites/randybrown/2021/07/14/can-the-us-compete-for-chip-dominance/
semiconductor,china,"BioNTech COVID-19 vaccines coming to Taiwan, Chinese ...","BioNTech, which developed the vaccine jointly with Pfizer (PFE.N), also did not immediately respond to a request for comment.
Gou and TSMC this month reached an initial agreement with a Fosun subsidiary for the vaccines, sources told Reuters previously.
read moreThe BioNTech vaccine drama has transfixed Taiwan and dominated headlines.
read moreChina's government has repeatedly said that if Taiwan wants the vaccine, it has to respect commercial rules and do it through Fosun.
Germany's government has also been involved, saying it has been helping in the direct talks between Taiwan and BioNTech",2021-08-31,Reuters,https://www.reuters.com/world/asia-pacific/tsmc-says-it-is-process-signing-deal-biontech-covid-19-vaccines-2021-07-11/
semiconductor,china,Semiconductor Industry: China's Tsinghua Unigroup Files for ...,,2021-08-31,Business Korea,http://www.businesskorea.co.kr/news/articleView.html?idxno=71678
semiconductor,china,TSMC says no further COVID cases found but testing to continue,"""The tests in the company's chip facilities are still ongoing, but from what we have learned so far, the results are all negative.
TSMC told Nikkei Asia that it is still conducting PCR tests for ""several hundred"" relevant employees and has not found any more confirmed cases.
The Tsai Ing-wen administration immediately dispatched a top member of its COVID response team to help TSMC control the situation.
The facilities involved are older chip facilities, dubbed Fab 5 and Fab 2.
The island's chip industry suffered its first serious chip industry COVID cluster in early June when a leading chip testing company, King Yuan, reported hundreds of cases at its factories and dormitories",2021-08-31,Nikkei Asia,https://asia.nikkei.com/Business/Tech/Semiconductors/TSMC-says-no-further-COVID-cases-found-but-testing-to-continue
semiconductor,china,"UPDATE 5-BioNTech COVID-19 vaccines coming to Taiwan, Chinese agent says","The Fosun statement referred to the ""Taiwan region"", terminology favoured by the Chinese government to assert its sovereignty claims rather than imply the island is a separate country.
Gou and TSMC this month reached an initial agreement with a Fosun subsidiary for the vaccines, sources told Reuters previously.
The BioNTech vaccine drama has transfixed Taiwan and dominated headlines.
China's government has repeatedly said that if Taiwan wants the vaccine, it has to respect commercial rules and do it through Fosun.
Germany's government has also been involved, saying it has been helping in the direct talks between Taiwan and BioNTech",2021-08-31,Yahoo Finance,https://finance.yahoo.com/news/1-tsmc-says-process-signing-022524611.html
semiconductor,china,"Everybody wants peace in Taiwan Strait because no one wants to disrupt 
semiconductor supply chain: TSMC chief","Amid tensions between the United States and China over Taiwan, chipmaker Taiwan Semiconductor Manufacturing Co Ltd(TSMC) chairman Mark Liu said ""everybody wants a peaceful Taiwan Strait"" since no one wants to disrupt the semiconductor supply chain in Taiwan.
TSMC is the world's largest chipmaker with a reported market capitalisation of $567 billion and is reportedly the eleventh most valuable listed company in the world.
Watch:""As to an invasion by China, let me tell you everybody wants to have a peaceful Taiwan Strait.
Because it is to every country's benefit, but also because of the semiconductor supply chain in Taiwan no one wants to disrupt it,"" Liu said during an earnings call.
Deputy Prime Minister Taro Aso had earlier said that his country would ""have to defend Taiwan"" if it is invaded by China",2021-08-31,WION,https://www.wionews.com/world/everybody-wants-peace-in-taiwan-strait-because-no-one-wants-to-disrupt-semiconductor-supply-chain-tsmc-chief-398294
semiconductor,china,Taiwan firms secured vaccine deals; Tsai Ing-wen can't wait to ...,"""Some netizens on Facebook urged Tsai to specify the so-called ""support"" of her government in the process, in a bid to expose her lies.
""If not for your interference, people could have accessed vaccines much earlier,"" a post commented.The DPP authorities have been fabricating lies recently in order to shirk responsibility for their missteps in preventing the epidemic.
They have once again exposed their ugly political nature by slandering the mainland over vaccine issues, the Taiwan Affairs Office of the State Council said in response on Wednesday.The Taiwan Affairs said that even up to now, DPP authorities have refused requests from some regions in Taiwan to negotiate with Fosun for vaccine purchase.
In the contract template, the media reports claimed, Fosun ""sought access to medical records"" in both regions.This groundless accusation was refuted by the Hong Kong government on Tuesday.
""The Tsai authority is just slapping their face until it's swollen in an effort to look imposing,"" Yang said.However, their tricks would probably end up with nothing, even making Taiwan residents more disappointed, if Tsai authority continues such farces, according to Yang",2021-08-31,Global Times,https://www.globaltimes.cn/page/202107/1228690.shtml
semiconductor,china,UPDATE 7-Taiwan finally getting BioNTech COVID vaccines in $350 mln deal,"Gou wrote on his Facebook page that he was ""gratified"" the deal had been completed, which will see Foxconn and TSMC each buy 5 million doses, to be donated to the government for distribution.
TAIWAN TRANSFIXEDThe BioNTech vaccine drama has transfixed Taiwan and dominated headlines.
BioNTech also confirmed the deal but referred to Taiwan as the ""Taiwan region"", using the wording preferred by China's government so as not to imply the island is a separate country.
Taiwan has millions of vaccines on order, mainly from AstraZeneca Plc and Moderna, while the United States and Japan have together donated almost five million doses to the island to help speed up vaccinations.
(Reporting by Ben Blanchard and Yimou Lee; Additional reporting by Beijing newsroom; Editing by Kim Coghill and Richard Pullin)",2021-08-31,Yahoo Finance,https://finance.yahoo.com/news/3-taiwans-foxconn-tsmc-confirm-001704401.html
semiconductor,china,Chip company faces debt crisis after fast expansion,"A worker checks semiconductors in an electronics factory in Dongguan, South China's Guangdong Province.
""Therefore, it is not reliable for Unigroup to acquire, and such expansion via acquisition needs to be cautious in the field,"" said Liang.This came as the chip company released a statement on Friday saying that it has received a notice from the Beijing No.
In recent years, the group has further enhanced its strength in chip design and development, as well as digital infrastructure, through acquisitions such as Spreadtrum and H3C.In April 2019, Tsinghua Unigroup also acquired Linxens Group, a French chipmaker, for 2.2 billion euros ($2.61 billion), marking the group's largest announced overseas acquisition at the time.The group company also looked to acquire the industry tycoon Taiwan Semiconductor Manufacturing and MediaTek, but none of those deals came through.After large-scale mergers and acquisitions, in 2019, Tsinghua Unigroup's overseas debt reportedly experienced abnormal fluctuations.
But the company soon issued an emergency statement saying that there was no default event at home and abroad, and the company has sufficient cash and sound fund liquidity, media reports.Acquisitions are expensive and often do not deliver a return on investment over the short term, especially for semiconductor industry that requests long-term capital investment, adding up the potential risks of defaults, experts said.While this is not the first time in the semiconductor industry, experts said that what has happened to Tsinghua Unigroup is not an isolated incident.
""In an industry in which global competition is so fierce, and the US' blockade, companies have to expand and become strong in order to survive,"" Ma Jihua, an industry veteran told the Global Times on Monday.Ma noted that for many semiconductor companies, the only way out is to take a risk.Tsinghua Unigroup's debt issue would not create any substantive damage to the company nor the industry since the chip industry is still in an attractive spot for the social capitals and the company itself has its potential for growth, experts said.But Ma would still advise companies to do a good risk assessment before engaging in acquisitions or expansion",2021-08-31,Global Times,https://www.globaltimes.cn/page/202107/1228435.shtml
semiconductor,china,Chinese chipmakers prioritize domestic orders as capacity ...,"Workers make chips at Anhui Dongke Semiconductor Co in East China's Anhui Province on Saturday.
The company is located in the Anhui Ma'anshan Economic and Technological Development Zone, and it is mainly engaged in the design, production and sales of green power chips.
""We set up a research team to deal with the matter recently,"" said the person, declining to give details because he was not authorized to discuss the matter.Since the beginning of this year, the global semiconductor chip shortage has intensified due to multiple factors, including the rebound of the automobile industry and the popularization of 5G technology.Experts said that when global wafer production capacity is insufficient, companies often have to decide whose orders to fill.
""Channeling limited production capacity to meet the demand of domestic buyers may cause some loss of interest among foreign clients in the short term.
""With rising opportunities amid a call to use domestic wafer substitutes, we will put more focus on building domestic partnerships for reliable, sustainable growth,"" said Wang.Wang said that 60-70 percent of the clients are domestic companies and there will be more.China's integrated circuit (IC) market exceeded $143.4 billion in 2020, accounting for 36.24 percent of the global market, while domestic ICs accounted for less than 20 percent, statistics from IC Insight showed.China is the world's largest consumer of semiconductors, but there is a big gap between local IC production capacity and semiconductor supply, Qiu Kai, a researcher of Huashang Fund said, indicating broad scope for the localization of the chip sector",2021-08-31,Global Times,https://www.globaltimes.cn/page/202107/1228559.shtml
semiconductor,china,UK credibility on China inward M&amp;A gets wafer-thin,"A worker adjusts the British and Chinese national flags in Beijing, China, September 21, 2015.
The sale of chipmaker Newport Wafer Fab, announced on Monday, is admittedly not an open and shut case.
In Italy, Prime Minister Mario Draghi’s government blocked a Chinese takeover in March of LPE, a small semiconductor firm.
- Nexperia is a customer of the semiconductor foundry services offered by Newport Wafer Fab and became its second-largest shareholder in 2019.
The National Security Adviser is reviewing this case and we will not hesitate to take further action if needed,” a UK government spokesperson told Breakingviews",2021-08-31,Reuters,https://www.reuters.com/breakingviews/uk-credibility-china-inward-ma-gets-wafer-thin-2021-07-08/
semiconductor,china,Owner of China's Only 3D NAND Maker Faces Bankruptcy,"As of mid-2020, Tsinghua Unigroup owed approximately $31 billion and had $8 billion in cash and cash equivalents, according to Reuters.
Tsinghua Unigroup is the owner of numerous Chinese semiconductor companies, including YMTC, the country's only 3D NAND maker, and Unisoc, a mobile SoC designer.
As of mid-2020, Tsinghua Unigroup owed approximately $31 billion and had $8 billion in cash and cash equivalents, according to Reuters.
Over the years, Tsinghua Unigroup has attempted to make really big overseas acquisitions to gain technologies and receive international recognition.
""Tsinghua Group itself may undergo a court-led restructuring, but any effect on how group companies are run would be limited.""",2021-08-31,Tom's Hardware,https://www.tomshardware.com/news/tsinghua-unigroup-faces-bankruptcy
semiconductor,china,TSMC expects auto-chip shortage to abate this quarter,"That shortfall should be greatly reduced for TSMC customers in the current quarter, Mr. Wei said.
Mr. Wei said he expects chip demand from the auto sector to increase as more cars become electric and automated.
Mr. Wei, the CEO, said he expects the overall contract chip-making industry to grow 20% in 2021 and that he is confident TSMC can outperform that forecast.
The investment in new facilities and advanced technology, along with more expensive raw materials will add to costs for TSMC’s clients, Mr. Wei said.
We expect our business from China will increase in all market sectors,"" Mr. Wei said",2021-08-31,Mint,https://www.livemint.com/companies/news/tsmc-expects-auto-chip-shortage-to-abate-this-quarter-11626367625072.html
semiconductor,china,China chip imports surges in June as firms stock up amid ...,"Semiconductor imports in China have maintained its growth momentum in June 
2021. The region noted high imports to meet the massive demand of 
integrated ",2021-08-31,Gizmochina,https://www.gizmochina.com/2021/07/14/china-chip-import-surge-june-global-shortage/
semiconductor,china,'Insolvent' Tsinghua Unigroup Aims to Restructure,"//php echo do_shortcode('[responsivevoice_button voice=""US English Male"" buttontext=""Listen to Post""]') ?>With debts exceeding its assets, Tsinghua Unigroup has acknowledged it is insolvent.
Tsinghua Unigroup has been one of the most prominent investors financing the buildup of China’s semiconductor industry in recent years.
Tsinghua Unigroup is 51% owned by China’s Tsinghua University and headed by former real estate tycoon Zhao Weiguo.
Tsinghua Unigroup didn’t provide details on its restructuring plan.
Another Tsinghua Unigroup holding, Unisoc, designs chips for 5G, Wi-Fi, Bluetooth, TV and satellite communications",2021-08-31,EE Times,https://www.eetimes.com/insolvent-tsinghua-unigroup-aims-to-restructure/
semiconductor,china,TSMC silent on Washington's request for cancelation of China ...,"TAIPEI (Taiwan News) — The U.S. government has pressed Taiwan Semiconductor Manufacturing Company (TSMC) to cancel a foundry expansion plan in Nanjing, China, and TSMC has so far refused to comment, UDN reported on Monday (July 12).
The company announced the US$2.8 billion investment in expanding the production capacity at the Nanjing foundry this April amid the global chip shortage.
TSMC, which is currently in a 10-day quiet period leading up the announcement of its financial statements, has so far made no comment on the American request.
Various countries have been fostering their semiconductor industries and jostling to cooperate with TSMC, as it is the world's leading contract chipmaker.
Meanwhile, a materials research and development center in Tsukuba, Ibaraki, Japan, is being built and is expected to be completed this year",2021-08-31,Taiwan News,https://www.taiwannews.com.tw/en/news/4246561
semiconductor,china,WISeKey Strengthens it Semiconductors NFC Brand Protection,"WISeKey Strengthens it Semiconductors NFC Brand Protection Related Patent Portfolio in ChinaWISeKey has been granted two fundamental patents about Semiconductors NFC tag design in China, which protect the company’s unique IP in the area of product authenticity verification and customer engagement.
The cryptographic functions of these WISeKey’s NFC chips, integrated with the complete WISeAuthentic ecosystem, offer an efficient way for brands to replace traditional non-secure QR code scanning or basic NFC tags.
To learn more about WISeKey’s Brand Protection Solutions, visit WISeKey’s Brand Protection.
Press and investor contacts:WISeKey International Holding LtdCompany Contact: Carlos MoreiraChairman & CEOTel: +41 22 594 3000info@wisekey.com WISeKey Investor Relations (US)Contact: Lena CatiThe Equity Group Inc.Tel: +1 212 836-9611lcati@equityny.comDisclaimer:This communication expressly or implicitly contains certain forward-looking statements concerning WISeKey International Holding Ltd and its business.
WISeKey International Holding Ltd is providing this communication as of this date and does not undertake to update any forward-looking statements contained herein as a result of new information, future events or otherwise",2021-08-31,GlobeNewswire,https://www.globenewswire.com/news-release/2021/07/13/2262248/0/en/WISeKey-Strengthens-it-Semiconductors-NFC-Brand-Protection-Related-Patent-Portfolio-in-China.html
semiconductor,china,Boris Johnson orders review of China takeover of British tech firm,"LONDON: British Prime Minister Boris Johnson has said his government will review the purchase of the UK's largest producer of semiconductors by a Chinese-owned manufacturer, a day after his government said it would not intervene.This comes after Chinese-owned firm Nexperia , on Monday, said it had acquired Britain's largest producer of silicon chips, Newport Wafer Fab.
""I do not want an anti-China spirit to lead to us trying to pitchfork away every investment from China into this country,"" he said.
""Tom Tugendhat, chairman of the UK foreign affairs select committee said that the government has to judge whether the product that the company (Newport Wafer Fab) is making, is of real intellectual property value and interest to China and whether there are real security implications.
""I think semiconductors are of huge importance to this country, one of the things I wanted to look at immediately was whether we could be more self-reliant.
We're thinking about what to do.""",2021-08-31,The Times of India,https://timesofindia.indiatimes.com/world/uk/boris-johnson-orders-review-of-china-takeover-of-british-tech-firm/articleshow/84232841.cms
