query,region,title,excerpt,date,source,link
semiconductor,china,Traders' body CAIT protests after Chinese JV bids for 44 Vande Bharat trains,"The tender is for procuring propulsion systems or electric traction kits for 44 trains to function as the Vande Bharat Express or Train 18.
The global tender worth around Rs 1500 crore was floated on December 22 last year by the Integral Coach Factory (ICF), Chennai, and was opened on Friday.
Floated under the Make in India initiative, the tender was for the supply of electrical equipment and other items for 44 train sets of 16 coaches each.
Major players like Bombardier, Alstom, Siemens, CAF, Talgo and Mitsubishi did not participate in the bids.
Also Read: Tesla CEO Elon Musk's net worth surpasses Warren Buffett'sAlso Read: Coronavirus impact: Zomato reinstates salaries; aims to make complete recovery in 3-6 months",2020-7-11,Business Today,https://www.businesstoday.in/latest/economy-politics/story/traders-body-cait-protests-after-chinese-jv-bids-for-44-vande-bharat-trains-263744-2020-07-11
semiconductor,china,China Likely to Remain Top International Patent Filer in 2020,"In 2019, China displaced the U.S. as top Patent Cooperation Treaty (PCT) user and looks likely to remain the top user in 2020.
For the first half of 2020, China, as receiving office (RO) for the PCT, received 29,548 international PCT applications.
Annualized, this would be 59,096 PCT applications for the full year.
Note, there are no main IP indicators for patent quality in the main indicators chart above.
The 14th 5-year plan is currently under consideration though so perhaps patent quality will be one of the future indicators",2020-7-11,National Law Review,https://www.natlawreview.com/article/china-2020-h1-patent-data-indicates-china-likely-to-remain-top-international-filer
semiconductor,china,China's Next Trillion-Dollar War Is Over 5G Manufacturing,"Why did this happen?
Please make sure your browser supports JavaScript and cookies and that you are not blocking them from loading.
For more information you can review our Terms of Service and Cookie Policy",2020-7-12,Bloomberg.com,https://www.bloomberg.com/opinion/articles/2020-07-12/china-s-next-trillion-dollar-war-is-over-5g-manufacturing
semiconductor,china,China's market euphoria trumps political risk in Hong Kong,"But Chinese investors and brokerages say they are increasingly drawn by Hong Kong shares, whose gains have been more modest.
“Buy more Hong Kong stocks.
New York-listed Alibaba 9988.HKBABA.N, which completed its Hong Kong listing last year, could get the greenlight to enter the benchmark Hang Seng Index .HSI next month.
Net mainland purchases of Hong Kong stocks under connect totaled HK$300 billion ($38.71 billion) during the first six months, exceeding last year’s total.
“We expect to see growing pricing power by mainland investors in the Hong Kong market.”($1 = 7.7500 Hong Kong dollars)",2020-7-8,Reuters,https://www.reuters.com/article/us-china-markets-hongkong-idUSKBN24A0ME
semiconductor,china,China's state chip fund to cut stakes in two more tech companies,"SHANGHAI (Reuters) - China’s largest state-backed semiconductor fund plans to reduce its holdings in two listed technology companies, a decision that comes following a torrid bull run in China’s stock market.
The stake reduction is part of a previously announced plan to cut holdings by 2% by Jan. 4, 2021, according to the statement.
NAURA Technology Group Co Ltd 002371.SZ also said in a filing that the 'Big Fund' will reduce 2% in the company over the next six months.
The fund currently holds 49,31,000 million shares in the company and is its third-largest shareholder.
The share sales follow similar ones on Friday, when Shenzhen Goodix Technology Co 603160.SS, Wuxi Taiji Industry Co 600667.SS and Beijing BDStar Navigation Co 002151.SZ said the 'Big Fund' would reduce its stake in the companies",2020-7-13,Reuters,https://www.reuters.com/article/us-china-fund-sharesale-idUSKCN24F08O
semiconductor,china,BASF weathers auto slump with better-than-expected earnings,"Ludwigshafen: BASF SE gave an early glimpse of second-quarter operating results that it says were better than investors expected despite the steep slump in demand from auto companies, its most important customer industry.Earnings before interest, taxes and some items for the period will be about 226 million euros ($255 million), the world’s biggest chemical maker said in a statement.
That’s better than analysts’ average estimate for 146 million euros, according to a consensus compiled by the company.BASF’s net loss will be worse than market expectations mainly because of a roughly 800 million-euro impairment at its Wintershall-DEA subsidiary related to slumping oil and gas prices.Europe’s auto industry is facing a historic slump with sales expected to contract a record 25% this year.
At BASF, demand from industries including nutrition and personal care are helping soften the blow, as is stable profit in its agricultural products business.BASF’s stock reversed earlier losses and traded 0.1% higher at 49.67 euros as of 4 p.m. Friday in Frankfurt.
It is down 26% this year, for a market value of 46 billion euros.
The company will publish a full set of second-quarter figures on July 29.Revenue in the three months through June fell about 12% to 12.7 billion euros, BASF said, beating the average estimate for 11.8 billion euros",2020-7-11,ET Auto,https://auto.economictimes.indiatimes.com/news/auto-components/basf-weathers-auto-slump-with-better-than-expected-earnings/76908572
semiconductor,china,Boris Johnson set to curb Huawei role in UK’s 5G networks,"Make informed decisions with the FTKeep abreast of significant corporate, financial and political developments around the world.
Stay informed and spot emerging risks and opportunities with independent global reporting, expert commentary and analysis you can trust",2020-7-12,Financial Times,https://www.ft.com/content/e4b7f816-00cc-4dc5-bb97-4e761200022a
semiconductor,china,Challenges facing Taiwan's semiconductor industry,"TAIPEI (Taiwan News) — Taiwan’s tech sector is well-positioned in the world post-coronavirus, but challenges lie ahead in terms of its reliance on both the U.S and China, according to an economist at Singapore-based DBS Bank.
Challenges remain, though, stemming from heightened nationalism and protectionism, manifested by U.S.-China tech tensions.
In May, Washington slapped new sanctions on Chinese tech giant Huawei, which require foreign semiconductor manufacturers to obtain approval from U.S. authorities before shipping semiconductors to the Chinese company for products that use Huawei designs and U.S. technology.
Due to the restrictions, TSMC was reported to have halted orders from Huawei, its second-largest client.
For the longer term, the economist cautions that Taiwan’s competitive advantage could be undermined as the world’s two largest economies compete to invest in their own semiconductor capacity",2020-7-8,Taiwan News,https://www.taiwannews.com.tw/en/news/3962573
semiconductor,china,"What goes up, and up and up Why SMIC is surging","T IMES SEEM tough for China’s chipmaking champion, the Semiconductor Manufacturing International Corporation ( SMIC ).
It has slapped export controls on SMIC ’s customers and enacted new rules which threaten to designate the firm as subservient to the People’s Liberation Army.
You might reasonably conclude that limp revenues and American ire would be a drag on SMIC ’s share price.
The answers lie in SMIC ’s status as China’s best hope of building a domestic semiconductor industry.
Investors who put assumptions about a company’s long-term success over its short-term performance may view the American government’s attention as a signal of SMIC ’s potential",2020-7-9,The Economist,https://www.economist.com/business/2020/07/09/why-smic-is-surging
semiconductor,china,"Nikkei drops on profit-taking, semiconductor stocks slump","TOKYO, July 14 (Reuters) - Japanese shares ended lower on Tuesday as investors booked profits after a sharp gain in the previous session, while semiconductor and other high-tech firms’ stocks took a hit following overnight weakness in U.S. peers on Nasdaq.
The benchmark Nikkei share average slipped 0.87% to close at 22,587.01, after hitting a one-month high in the previous session.
In the broader market, Topix fell 0.5% to 1,565.15, following a 2.46% jump in the previous session.
Advantest Corp slipped 2.43%, while Screen Holdings Co Ltd and Tokyo Electron Ltd fell 2.41% and 1.45%, respectively.
Sony Corp dropped 1.98%, after reaching its highest level since 2001 in the previous session",2020-7-13,Reuters,https://www.reuters.com/article/japan-stocks-close-idUSL3N2EL1KJ
semiconductor,china,Chinese officials bemoan ‘significant catch-up’ needed with US on chipmaking,"China is pursuing more independence in the supply of key technologies and components, including semiconductors.
Photo: Xinhua",2020-7-10,South China Morning Post,https://www.scmp.com/economy/china-economy/article/3092673/chinese-officials-bemoan-significant-catch-needed-us
semiconductor,china,"Imec &amp; GLOBALFOUNDRIES Partner Up And Announce Breakthroughs In AI Chip On 
IoT Devices","Imec & GlobalFoundries Bringing Deep Neural Network Calculations To IoT Edge DevicesBased on imec’s Analog in Memory Computing (AiMC) architecture utilizing GF’s 22FDX solution, the new chip is optimized to perform deep neural network calculations on in-memory computing hardware in the analog domain.
Achieving record-high energy efficiency up to 2,900 TOPS/W, the accelerator is a key enabler for inference-on-the-edge for low-power devices.
The resulting Analog Inference Accelerator (AnIA), built on GF’s 22FDX semiconductor platform, has exceptional energy efficiency.
GF’s 22FDX employs 22nm FD-SOI technology to deliver outstanding performance at extremely low power, with the ability to operate at 0.5 Volt ultralow-power and at 1 pico amp per micron for ultralow standby leakage.
22FDX with the new AiMC feature is in development at GF’s state-of-the-art 300mm production line at Fab 1 in Dresden, Germany",2020-7-11,Wccftech,https://wccftech.com/imec-globalfoundries-partner-up-announce-breakthroughs-in-ai-chip-on-iot-devices/
semiconductor,china,SMIC shares surge in Shanghai debut after $6.6 billion offering,"SHANGHAI (Reuters) - Shares in semiconductor Manufacturing International Corp (SMIC), China’s biggest chipmaker, more than tripled when they debuted on the Shanghai market on Thursday in one of the most anticipated listings of the year.
SMIC 688981.SS opened at 95 yuan, 246% higher than its offer price of 27.46 yuan.
The U.S. decision to prevent Huawei from receiving supplies or services from American companies also threatens Huawei’s suppliers such as TSMC and SMIC.
However, analysts said SMIC remains China’s best hope for developing a first-class chip fab, in spite of significant business hurdles given its size and progression.
Li Xinxie, a tech analyst with Shanxi Securities, said the enthusiasm for SMIC’s Shanghai stock reflected ongoing confidence for China’s tech self-sufficiency push",2020-7-15,Reuters,https://www.reuters.com/article/us-china-smic-debut-idUSKCN24H07R
semiconductor,china,Chinese $2.8bn memory chip project goes bust,"The project, supported by the Nanjing Economic and Technology Development Zone, was launched in 2016 and designated a major local investment project.
The plan included the creation of an 8-inch wafer fabrication plant and supporting producers throughout the entire business chain of chip production.
The Nanjing project was part of China's ambitious plan to produce 40% of the semiconductors it uses by 2020 and 70% by 2025.
The plan resulted in massive investment by the central government and spurred an enthusiastic response from private equity and venture capital investors.
But construction of the Tacoma project has been halted since March 2019 because of a capital crunch, according to Tacoma Chairman Li Ruiwei, also known as Joseph Lee",2020-7-14,Nikkei Asia,https://asia.nikkei.com/Spotlight/Caixin/Chinese-2.8bn-memory-chip-project-goes-bust
semiconductor,china,Analog Devices nears $20bn deal for chip rival Maxim,Pay based on useGet StartedPurchase a Team or Enterprise subscription for per weekYou will be billed per month after the trial ends,2020-7-12,Financial Times,https://www.ft.com/content/b6c7e192-1da9-454b-acd2-53058cae0662
semiconductor,china,"China steel futures rise on demand prospects, low stockpiles","MANILA: China's steel futures rose on Wednesday on optimism about demand prospects in the world's top metals consumer, while low domestic stockpiles also lent support.The most-traded construction steel rebar contract on the Shanghai Futures Exchange rose as much as 1.8% to 3,701 yuan ($527.29) a tonne, heading for a fifth straight session of gains.Hot-rolled coil, used in cars and home appliances, advanced 1.9% to 3,695 yuan a tonne, while stainless steel gained 2.0% to 13,680 yuan a tonne.Steel prices remained resilient despite the seasonal weakness in downstream demand, particularly for rebar, as flooding in southern China and heavy rains across the country slowed construction activities.
""The market sentiment remains bullish, dictated by strong stock prices,"" said Richard Lu, senior analyst at CRU consultancy in Beijing.China's stock markets have seen surging volumes and foreign inflows in recent days, pushing blue-chip shares to a more than five-year high, with retail investors rushing to join the bull market.
""It looks like market participants are still confident on macro-economic growth in the second half, and many think the short-term weather disruption will be compensated later,"" Lu said.China's steel inventories remain low despite the build-up seen over the last two weeks.
Rebar and hot-rolled coil stockpiles have fallen more than 40% from this year's peak, data from SteelHome consultancy showed",2020-7-8,ET Auto,https://auto.economictimes.indiatimes.com/news/auto-components/china-steel-futures-rise-on-demand-prospects-low-stockpiles/76849494
semiconductor,china,China's Chip Dreams at SMIC Cost Investors a Patriot's Premium,"Why did this happen?
Please make sure your browser supports JavaScript and cookies and that you are not blocking them from loading.
For more information you can review our Terms of Service and Cookie Policy",2020-7-9,Bloomberg.com,https://www.bloomberg.com/opinion/articles/2020-07-09/china-s-chip-dreams-at-smic-cost-investors-a-patriot-s-premium
semiconductor,china,"The US cannot compete with China if our military doesn't invest in R&amp;D | 
TheHill","The key to ensuring American success is for DOD and private industry to turbo-boost their collaboration.
DOD needs to incentivize private industry to invest its own resources into military-relevant R&D.
Private industry, in turn, will benefit from access to DOD capital, expertise and facilities.
When encountering challenges working with DOD, companies naturally diversify their revenue streams.
DOD should incentivize private industry to invest its own resources into defense-related manufacturing capabilities and R&D",2020-7-13,TheHill,https://thehill.com/opinion/national-security/506991-the-us-cannot-compete-with-china-if-our-military-doesnt-invest-in
semiconductor,china,China expert warns against total focus on self-reliance in chips,"Staff members work at a workshop of a semiconductor company in Shanghai, east China, Feb. 10, 2020.
Photo: Xinhua",2020-7-10,South China Morning Post,https://www.scmp.com/tech/innovation/article/3092649/china-chip-expert-warns-self-reliance-semiconductors-will-be-tough
semiconductor,china,Trump just wore a mask in public for the first time,"NEWA vastly improved search engine helps you find the latest on companies, business leaders, and news more easily",2020-7-11,Fortune,https://fortune.com/2020/07/11/trump-wears-mask-first-time-in-public-wearing-face-mask-walter-reed-photo-images/
semiconductor,china,China shares fall as Sino-U.S. tensions weigh on GDP beat,"** Chinese H-shares listed in Hong Kong fell 1.51% to 10,234.09, while the Hang Seng Index was down 1.17% at 25,183.08.
It needs a stronger stimulus to offset woes of Sino-U.S. tensions and trigger another round of bullishness, he added.
** Beijing warned of retaliatory sactions and summoned the U.S. ambassador to protest at the Hong Kong Autonomy Act passed by the U.S. Congress and signed by President Donald Trump.
** Around the region, MSCI’s Asia ex-Japan stock index was weaker by 1.20% while Japan’s Nikkei index was down 0.68%.
** Shares in semiconductor Manufacturing International Corp (SMIC), China’s biggest chipmaker, more than tripled on Thursday on their Shanghai market debut",2020-7-15,Reuters,https://www.reuters.com/article/china-stocks-midday-idUSL3N2EN19X
semiconductor,china,"As the U.S. and China spar on the world stage, Cold War 2.0 may already 
have begun","A Chinese official in turn blamed the U.S. Army, and the U.S. government accused China of trying to use hackers to steal vaccine technology.
These days, Trump and his Democratic rival, former Vice President Joe Biden, joust in campaign ads over who is tougher on China.
America's China policy, he added, ""is based on ill-informed strategic miscalculation and is fraught with emotions and whims and McCarthyist bigotry.""
Chinese tourists roam the world, and hundreds of thousands of Chinese students take up residence every year at U.S. and European universities.
In May, Biden accused Trump of failing to stand up to China on Hong Kong, saying Trump ""has enabled Xi Jinping's sense of impunity when it comes to stifling freedom.""",2020-7-14,NBC News,https://www.nbcnews.com/politics/national-security/u-s-china-spar-world-stage-cold-war-2-0-n1233815
semiconductor,china,Why China Isn’t Expected to Power a Global Recovery,"During the 2008-09 financial crisis, China's soaring demand for raw 
materials ... In South Korea, semiconductor-equipment maker YoungjinIND Co. 
has resumed ",2020-7-12,The Wall Street Journal,https://www.wsj.com/articles/why-china-isnt-expected-to-power-a-global-recovery-11594555200
semiconductor,china,Startup Funding: June 2020,"The startup focuses on superconducting quantum processors and co-design of quantum computing hardware and applications.
Investors include Hoxton Ventures, Village Global, Propagator Ventures, Luminous Ventures, FoundersX Ventures, and 7percent Ventures.
Horizon Quantum Computing raised $2.4M in seed-plus funding for its programming tools to simply software creating for quantum computers.
Founded in 2018, the Singapore-based startup aims to remove the need for prior quantum computing experience by automatically adapting programs written for conventional computing.
Banking and fintech rounds out the top three sectors with one startup, Pagaya Investments, drawing the bulk of the funding",2020-7-8,Semiconductor Engineering,https://semiengineering.com/startup-funding-june-2020/
semiconductor,china,ACM Research Starts Construction of New Facility in ...,"FREMONT, Calif., July 09, 2020 (GLOBE NEWSWIRE) -- ACM Research, Inc. (“ACM”) (NASDAQ:ACMR), a leading supplier of wafer cleaning technologies for advanced semiconductor devices, announced that its operating subsidiary ACM Research (Shanghai), Inc. (“ACM Shanghai”) has begun construction of its new development and production facility in the Lingang Special Area of China (Shanghai) Pilot Free Trade Zone.
ACM Shanghai held a groundbreaking ceremony on July 7, 2020, to mark the commencement of construction.
The facility site is located in the Lingang region of Shanghai, which is approximately 30 miles from ACM Shanghai’s headquarters in Zhangjiang.
Local government officials attended the ceremony, together with customers, suppliers, and ACM Shanghai’s board members and employees.
The ACM logo is a trademark of ACM Research, Inc. All rights reserved",2020-7-9,GlobeNewswire,https://www.globenewswire.com/en/news-release/2020/07/09/2060265/0/en/ACM-Research-Starts-Construction-of-New-Facility-in-Shanghai-s-Lingang-Special-Area.html
semiconductor,china,Analog buys Maxim for over $20bn,"Make informed decisions with the FTKeep abreast of significant corporate, financial and political developments around the world.
Stay informed and spot emerging risks and opportunities with independent global reporting, expert commentary and analysis you can trust",2020-7-13,Financial Times,https://www.ft.com/content/a25bc65d-5607-4081-9d78-e8f8641a928e
semiconductor,china,China’s patent filings back on track amid Covid-19 disruptions,China’s policy support for the domestic semiconductor industry helped usher in more intellectual property applications for integrated circuit design in the first half of this year,2020-7-10,South China Morning Post,https://www.scmp.com/tech/innovation/article/3092691/chinas-patent-filings-back-track-amid-covid-19-disruptions
semiconductor,china,"SMIC's Shanghai listing tests if money alone can bring chip dominance to 
China","REUTERS/Aly Song/File PhotoSemiconductor Manufacturing International Corp (SMIC) 0981.HK has found itself in the slipstream of a government drive to develop an independent chip industry.
Its Hong Kong stock price has surged three-fold since March as investors bought into sentiment accompanying its listing plans.
“The listing is a blessing and a curse,” said Mark Li, who tracks the semiconductor industry at Bernstein Research.
Of the 46.3 billion yuan ($6.6 billion) proceeds, SMIC plans to spend 40% building a plant making 12-inch silicon wafers to produce chips with 14 and 7 nanometre technology.
That would make it capable of taking high-end chip orders from the likes of Nvidia, Qualcomm and Huawei chip unit HiSilicon",2020-7-15,Reuters,https://www.reuters.com/article/us-smic-china-ipo-analysis-idUSKCN24G0PO
semiconductor,china,Could Trump Win the War on Huawei—and Is TikTok Next?,"Wray’s remarks marked the second act in what will ultimately be four speeches by the Trump administration’s national security and legal leaders about the threat posed by China’s ambitions.
After Washington and the West largely failed with carrots for two decades, the Trump administration has turned to geopolitical sticks—a strategy that was well underway before this spring’s novel coronavirus pandemic exacerbated Chinese-US tensions.
(As this article was published the British government announced that it had indeed decided to ban purchase of new 5G equipment from Huawei.)
But those were not the issues the British reportedly cited for considering a pullback from its deal with Huawei.
That, UK officials worry, would in turn force Huawei to use untrusted technology that could make security risks to Britain’s 5G network impossible to control",2020-7-14,WIRED,https://www.wired.com/story/could-trump-win-the-war-on-huawei-and-is-tiktok-next/
semiconductor,china,China Everbright Limited and Terminus Technologies Launch ...,"CEL AI Economy Fund focuses on the application of AIoT+ strategy and its ecology in the entire industry.
CEL AI Economy Fund opens the new chapter of Everbright Limited's investment strategy plans, enabling a smooth and flawless transition from new economy into AI economy.
The establishment of the CEL AI Economy Fund will accelerate the global deployment of Terminus' AI CITY network.
Victor Ai, founder and CEO of Terminus Technologies, said: ""CEL AI Economy Fund finds industrial development is the fostering land for its new economy mindset.
And CEL AI Economy Fund is another effective support for Terminus to achieve its global strategic layout of AI CITY",2020-7-12,PR Newswire,https://www.prnewswire.com/news-releases/china-everbright-limited-and-terminus-technologies-launch-a-10-billion-ai-economy-fund-301091987.html
semiconductor,china,Huawei still has no fix to being cut off from TSMC,"""This move may well force the global semiconductor industry to look away 
from ... including China itself,"" said Nelson Dong, a senior partner at US 
law firm ",2020-7-8,Light Reading,https://www.lightreading.com/5g/huawei-still-has-no-fix-to-being-cut-off-from-tsmc/d/d-id/762236
