query,region,title,excerpt,date,source,link
semiconductor,china,Microsoft's Xbox Space Jam collab controllers are now up for sale on Amazon,"Space Jam was a quirky 90s Looney Tunes movie featuring basketball legend Michael Jordan, battling aliens in a tournament to decide the fate of Earth.
The classic movie is getting a revival of sorts, with Space Jam: A New Legacy, starring LeBron James.
Microsoft has partnered up with the movie to offer an arcade-style tie-in beat 'em up, with exclusive early access through Xbox Game Pass Ultimate.
The game will hit general availability for free on July 15.
In addition, Microsoft is selling three custom controllers inspired by Space Jam: A New Legacy, at $70 apiece",2021-08-31,Windows Central,https://www.windowscentral.com/microsofts-xbox-space-jam-collab-controllers-are-now-sale-amazon
semiconductor,china,5 Best ETFs of Last Week,"Still, the reported data were way above the breakeven level of 50% (read: 3 Sector ETFs That Have More Room for Growth in Q3).
The U.S. economy added 850,000 jobs in June 2021 (after rising 559,000 in May), beating market expectations of a rise of 700,000 (read: 5 Sector ETFs to Play Robust June Jobs Data).
Against this mixed sentiment, the below-mentioned ETFs have gained last week.
The fund charges 75 bps in fees (read: 5 Niche ETFs Dominating the Current Market Rally).
Zacks’ free Fund Newsletter will brief you on top news and analysis, as well as top-performing ETFs, each week",2021-08-31,Nasdaq,https://www.nasdaq.com/articles/5-best-etfs-of-last-week-2021-07-12
semiconductor,china,"Seoul reasserts fruitful Korea-Japan summit as prerequisite for Moon's 
visit to Tokyo","Cheong Wa Dae reiterated Sunday that President Moon Jae-in's potential attendance at the opening ceremony of the upcoming Tokyo Olympic Games depends on whether the visit would guarantee a fruitful summit meeting with Prime Minister Yoshihide Suga.
Cheong Wa Dae has left the door open for Moon's possible attendance at the opening ceremony set for July 23 and a summit meeting.
The possibility of Moon's visit to Japan is reportedly getting slimmer, however, amid a wide gap of opinion between the two countries over the nature of the envisioned summit.
""So far, we have talked (with Japan) about two conditions for Moon's Japan visit, a summit meeting and (related) results,"" a Cheong Wa Dae official told Yonhap News Agency.
The report also said Japan excludes the possibility of consultation or negotiations in the envisioned Seoul-Tokyo summit, only considering the possible expression of its basic stance on major historical issues",2021-08-31,The Korea Times,https://www.koreatimes.co.kr/www/nation/2021/07/120_311980.html?fl
semiconductor,china,"Daily Markets: Investors Digesting Biden's Executive Orders, Delta Variant 
Spread","Among those new orders are ones expected to call on the FTC to craft new rules on Big Tech’s data collection and user surveillance practices.
Data DownloadInternational EconomyChina’s inflation rate slowed to 1.1% YoY in June from 1.3% in May, where it was expected to remain.
The nation’s Producer Price Index (PPI), another gauge of inflation, also declined, falling to 8.8% in June from 9.0% in May, as expected.
For the May quarter, digital accounted for 23% of total sales.
Shares of Chinese electric vehicle company Nio (NIO) are trading higher this morning following President Qin Lihong's announcement to launch 4,000 battery swapping stations globally in 2025, up from 700 targeted for the end of 2021",2021-08-31,Nasdaq,https://www.nasdaq.com/articles/daily-markets%3A-investors-digesting-bidens-executive-orders-delta-variant-spread-2021-07-09
semiconductor,china,Worldwide Chip Shortage Has Resulted In CPU Smugglers,"We begin our journey courtesy of the Chinese-language news site HKEPC (via 
... the global semiconductor shortage brought on by the COVID pandemic is a 
big ",2021-08-31,TheGamer,https://www.thegamer.com/worldwide-chip-shortage-cpu-smugglers/
semiconductor,china,Global Medical Gloves Market Report 2021: Malaysia is the ...,"DUBLIN, July 15, 2021 /PRNewswire/ -- The ""Medical Gloves - Global Market Trajectory & Analytics"" report has been added to ResearchAndMarkets.com's offering.
Global Medical Gloves Market to Reach $70 Billion by 2027Amid the COVID-19 crisis, the global market for Medical Gloves estimated at US$30.9 Billion in the year 2020, is projected to reach a revised size of US$70 Billion by 2027, growing at a CAGR of 12.4% over the period 2020-2027.
Examination Gloves, one of the segments analyzed in the report, is projected to record 11.2% CAGR and reach US$42.3 Billion by the end of the analysis period.
The U.S. Market is Estimated at $10.4 Billion, While China is Forecast to Grow at 14.6% CAGRThe Medical Gloves market in the U.S. is estimated at US$10.4 Billion in the year 2020.
GLOBAL MARKET PERSPECTIVEIII",2021-08-31,PR Newswire,https://www.prnewswire.com/news-releases/global-medical-gloves-market-report-2021-malaysia-is-the-dominant-producer---us-market-is-estimated-at-10-4-billion-while-china-is-forecast-to-grow-at-14-6-cagr-301334928.html
semiconductor,china,Taiwan Semiconductor Manufacturing is about to announce its ...,"On July 15, Taiwan Semiconductor Manufacturing is reporting Q2 earnings.
Analysts on Wall Street predict Taiwan Semiconductor Manufacturing will release earnings per share of $0.931.
Go here to track Taiwan Semiconductor Manufacturing stock price in real-time on Markets Insider.
Taiwan Semiconductor Manufacturing will report Q2 earnings on July 15.
Forecasts of 27 analysts expect earnings of $0.931 per share compared to earnings of $0.791 per share from the same quarter last year",2021-08-31,Markets Insider,https://markets.businessinsider.com/news/stocks/taiwan_semiconductor_manufacturing-stock-quarter-earnings-preview-q2-1030601602
semiconductor,china,"K pandemic hammered minorities, self-employed: report","People crowd the street after Major sectors of the UK society have reopened on Monday, May 17 in London, United Kingdom as coronavirus restrictions are further eased across England, Wales, and parts of Scotland.
Photo: VCGEthnic minorities, the self-employed and low-income families in Britain suffered greater deprivation levels during the coronavirus pandemic despite ""surprisingly positive"" living standards figures, a report published Thursday found.The Institute for Fiscal Studies [IFS] think tank's annual report on living standards, poverty and inequality identified these groups as the hardest-hit, even as unprecedented state support mitigated the worst effects of the crisis.The research also shows that Britain's ethnic minorities were more likely to suffer worse health and economic outcomes during the pandemic and less likely to accept vaccines.
""How fast and to what extent these groups recover as the economy reopens will be a key determinant of the pandemic's legacy,"" said report's co-author Tom Wernham.Some 15 percent of Britons from minority ethnic backgrounds were behind their household bills at the start of 2021, compared with 12 percent before the pandemic.The proportion of adults of Pakistani and Bangladeshi origin living in households where all adults were unemployed or furloughed remained 10 percentage points higher at the beginning of 2021 than pre-pandemic levels, as many of these households relied on one income earner.Household worklessness for black adults rose 2.4 percent, higher than the national average of 1.9, the report added.The share of self-employed workers who lost all work in the first lockdown in March 2020 and fell behind household bills is now 15 percent, up from 2 percent before the pandemic.Despite the government's flagship furlough scheme, which has paid millions of workers' wages since March 2020, 36 percent of self-employed workers were in fact ineligible from this scheme.Researchers also found that more families suffering from in-work poverty fell behind on bills during Britain's first lockdown from March 2020.One of the report's authors, Tom Waters, said the furlough scheme's success largely explained Britain's ""surprisingly positive"" deprivation and labor market statistics.But he added that people's ability to return to their old jobs or find new ones would be the key factor for living standards as support was withdrawn.The government initially paid 80 percent of employees' wages to prevent mass job losses but is to be phased out by the end of September.AFP",2021-08-31,Global Times,https://www.globaltimes.cn/page/202107/1228178.shtml
semiconductor,china,"Opinion: How PLI scheme for advanced chemistries will remove storage 
bottleneck for e-mobility ecosystem","Accept the updated privacy & cookie policyDear user,ET Auto privacy and cookie policy has been updated to align with the new data regulations in European Union.
Please review and accept these changes below to continue using the website.
You can see our privacy policy & our cookie policy.
We use cookies to ensure the best experience for you on our website.
If you choose to ignore this message, we'll assume that you are happy to receive all cookies on ET Auto",2021-08-31,ET Auto,https://auto.economictimes.indiatimes.com/news/auto-components/opinion-how-pli-scheme-for-advanced-chemistries-will-remove-storage-bottleneck-for-e-mobility-ecosystem/84341903
semiconductor,china,"ECB's Lagarde Sees Policy Change in July, Possible 2022 ...","The review also introduced climate-change considerations into policy, and officials said they’ll start taking account of the cost of owner-occupied housing.
Lagarde said she expects the ECB’s current 1.85 trillion-euro ($2.2 trillion) bond-buying plan to run “at least” until March 2022.
“We need to be very flexible and not start creating the anticipation that the exit is in the next few weeks, months,” Lagarde said.
U.S. Federal Reserve officials are already discussing when to start tapering their stimulus program as growth and inflation accelerate.
“We have to use the tools, and we have a big toolbox, to actually deliver that 2%,” she said",2021-08-31,BNN Bloomberg,https://www.bnnbloomberg.ca/ecb-s-lagarde-sees-policy-change-in-july-possible-2022-measures-1.1627685
semiconductor,china,Volvo Cars And Geely Holding to create powertrain joint venture Aurobay,"New Delhi: Volvo Cars and its parent company Geely Holding have agreed to create a joint venture under the name Aurobay for its powertrain operations, as the companies proceed with their earlier announced plans to merge these into a new standalone business.According to a media release, the new company will be a global supplier of complete powertrain solutions including next generation combustion engines, transmissions and hybrid solutions.Aurobay will initially be jointly owned by Volvo Cars and Geely Holding and as part of the creation of Aurobay, Volvo Cars will transfer all assets in its wholly-owned subsidiary Powertrain Engineering Sweden, including its Skövde, Sweden-based engine plant including the related R&D team, along with its engine plant in China and other relevant assets to the joint venture in coming months.As per the automaker, the creation of the stand-alone joint venture and the transfer of assets allows Volvo Cars to focus fully on the development of its new range of all-electric premium cars in coming years.
The company aims for 50 per cent of its global sales volume to consist of fully electric cars by 2025 while 50 per cent will be hybrids, with powertrains supplied by Aurobay.
By 2030, it plans every car it sells to be pure electric.“For Geely Holding, the new entity will benefit from the addition of a strong R&D team and technologically advanced and efficient combustion engines and hybrid powertrains for its portfolio of brands, creating a strong base for substantial operational, industrial and financial synergies,” said the company statement.“The new stand-alone business also has the ambition to supply customers outside of the Geely Holding Group, and aims to be a leading player in the supply of high-quality, low emission, cost-efficient powertrains solutions,” Volvo Cars added",2021-08-31,ET Auto,https://auto.economictimes.indiatimes.com/news/passenger-vehicle/cars/volvo-cars-and-geely-holding-to-create-powertrain-joint-venture-aurobay/84261583
semiconductor,china,Entegris Declares Quarterly Cash Dividend,"BILLERICA, Mass.--(BUSINESS WIRE)--Entegris, Inc. (Nasdaq: ENTG), today announced that its Board of Directors has authorized a quarterly cash dividend of $0.08 per share to be paid on August 18, 2021 to shareholders of record on the close of business on July 28, 2021.
ABOUT ENTEGRISEntegris is a world-class supplier of advanced materials and process solutions for the semiconductor and other high-tech industries.
Entegris is ISO 9001 certified and has manufacturing, customer service and/or research facilities in the United States, Canada, China, France, Germany, Israel, Japan, Malaysia, Singapore, South Korea and Taiwan.
Additional information can be found at www.entegris.com",2021-08-31,Business Wire,https://www.businesswire.com/news/home/20210714005100/en/Entegris-Declares-Quarterly-Cash-Dividend
semiconductor,china,Mass Exodus from China by Cryptocurrency Miners a Plus for ...,"NEW YORK, July 15, 2021 /PRNewswire/ -- There is little debate that the crackdown on cryptocurrency mining in China has significantly disrupted the markets and dampened sentiment towards digital currencies.
Ahead of the crackdown, 50-60% of all crypto mining activity transpired in China.
A top producer of greenhouse gas emissions, Chinese provinces are under directives to slash pollution, for which crypto mining is a contributor.
North America is forecast to become the largest cryptocurrency mining market following about 90% of China's mining capacity being eliminated.
With that type of payout, competition has become fierce, as demonstrated by a spike in hashrate, the industry term for the total amount of global computing power mining Bitcoin",2021-08-31,PR Newswire,https://www.prnewswire.com/news-releases/mass-exodus-from-china-by-cryptocurrency-miners-a-plus-for-us-companies-301334362.html
semiconductor,china,"European shares ease from peak; banks, miners boost UK stocks","Barclays, HSBC, and Lloyds Banking Group rose between 1.1% and 1.8% after the Bank of England scrapped pandemic-era restrictions on dividends from top lenders.
Among individual stocks, Finnish telecom equipment maker Nokia jumped 6.6% after it said it planned to raise its full-year outlook.
Swiss watchmaker Swatch Group rose 2.0% as it returned to profit in the first six months of 2021 and its sales jumped more than 50%.
Meanwhile, major U.S. banks, including JPMorgan and Goldman Sachs, will report earnings later in the day.
Miners like Rio Tinto, Anglo American and BHP Group got a boost from rising metal prices after better-than-expected trade data from top consumer China",2021-08-31,Reuters,https://www.reuters.com/article/us-europe-stocks-idUSKBN2EJ0KC
semiconductor,china,Investors need to prepare for the ‘Yotta Age’ of data,"Make informed decisions with the FTKeep abreast of significant corporate, financial and political developments around the world.
Stay informed and spot emerging risks and opportunities with independent global reporting, expert commentary and analysis you can trust",2021-08-31,Financial Times,https://www.ft.com/content/14c71b1c-f526-4278-b12a-3b0b188d0f0a
semiconductor,china,"TSMC Exploring On-Chip, Semiconductor-Integrated Watercooling","TSMC, at the VLSI symposium, recently presented its investigations into on-chip watercooling as a way to battle issues with heat dissipation.
And liquid submersion, while efficient and likely better for stacked dies, is expensive and difficult to deploy in professional scenarios that are already geared for air or traditional water cooling.
Image 1 of 6 Image Credits: TSMC (Image credit: TSMC) Image 2 of 6 (Image credit: TSMC) Image 3 of 6 (Image credit: TSMC) Image 4 of 6 (Image credit: TSMC) Image 5 of 6 (Image credit: TSMC) Image 6 of 6 (Image credit: TSMC)TSMC carried out testing on a dummy semicondutor - a Thermal Test Vehicle (TTV), which is essentially a heating element made out of copper - in controlled lab conditions.
TSMC reported that the best solution was by far the direct water cooling method, which could dissipate up to 2.6 kW of heat and offered a temperature delta of 63 ºC.
Image 1 of 4 Image Credit: TSMC (Image credit: TSMC) Image 2 of 4 (Image credit: TSMC) Image 3 of 4 (Image credit: TSMC) Image 4 of 4 (Image credit: TSMC)Of course, it will take years until such exotic cooling solutions are adopted in the mainstream",2021-08-31,Tom's Hardware,https://www.tomshardware.com/uk/news/tsmc-exploring-on-chip-semiconductor-integrated-watercooling
semiconductor,china,Melaka exco member says not true factory workers allowed to ...,"MELAKA: Workers under quarantine are not allowed to return to work, says Datuk Rahmad Mariman.
The Melaka Health and Anti-Drug Committee chairman debunked claims that workers wearing pink Covid-19 quarantine wristbands had returned to work at a semiconductor factory here.
Earlier, there was talk on social media that the factory had received special treatment as it made a huge donation to the Melaka government's Covid-19 relief fund.
Rahmad said this was not true and there was no such thing as allowing employees with pink wristbands to return to work as alleged by certain quarters.
Article type: metered User Type: anonymous web User Status: Campaign ID: 46 Cxense type: free User access status: 3Join our Telegram channel to get our Evening Alerts and breaking news highlights",2021-08-31,The Star,https://www.thestar.com.my/news/nation/2021/07/11/melaka-exco-says-not-true-factory-workers-allowed-to-work-while-wearing-pink-covid-19-wristbands
semiconductor,china,"PlayStation 5 exclusive 'Deathloop' will hit Xbox some time after September 
14, 2022","There has been some commentary about whether or not Deathloop is a permanent PlayStation exclusive, however.
Deathloop is an upcoming ""murder-puzzler"" from Microsoft's Arkane Studios, and is somewhat ironically a PlayStation 5 console exclusive.
At the end of the trailer, the card that showcases the fact it's coming to PlayStation 5 firmly states that it will be console exclusive ""until at least September 14, 2022.""
After that date, you can expect that Deathloop will hit Xbox consoles, most likely as part of Xbox Game Pass, honoring Microsoft's pledge to bring all first-party games into the service.
Either way, it's firmly part of our most anticipated upcoming Xbox games, that's for sure",2021-08-31,Windows Central,https://www.windowscentral.com/playstation-5-exclusive-deathloop-will-hit-xbox-some-time-after-september-14-2022
semiconductor,china,"Foreign Press: Nature is Treasure of Guizhou, China","From July 9 th to July 13 th , Huanqiu.com organized 2021 Eco Forum Global Guiyang Foreign Press Trip.
In the same spirit, Guizhou has taken active measures to improve the water quality of the Wu River.
The previously polluted Wu River has been a mecca for tourists from across China and the world, contributing to the province's burgeoning tourism economy.
According to him, ""Guizhou not only explores ecological civilization construction, but also benefits from the achievements of ecological civilization construction.
The ecological civilization construction of Guizhou is a microcosm of China's achievements in ecological civilization construction.""",2021-08-31,PR Newswire,https://www.prnewswire.com/news-releases/foreign-press-nature-is-treasure-of-guizhou-china-301333724.html
semiconductor,china,China Power Tools Market Analysis and Forecast 2021,"POWER TOOLS INDUSTRY ASSESSMENTSPower Tools Industry OverviewIndustry Structure and CompositionMarket SizeMarket Growth DriversLabor CostsMajor Producer Facility Locations and SalesMarket Share of Key ProducersPotential EntrantsMajor Foreign InvestmentsTechnology DevelopmentIV.
POWER TOOLS SALES VOLUMES AND FORECASTSOverviewPower Tools Sales Volumes and Forecasts (mil Yuan)Metal Cutting Power ToolsGrinding Power ToolsAssembling Power ToolsRailway Power ToolsPower Tools Imports and ExportsPricing TrendsV. POWER TOOLS MARKET OUTLOOKPower Tools Markets Outlook OverviewMetal Product MarketMetal Product Market OutlookPower Tools Demand in Metal Product MarketMotor Vehicles MarketMotor Vehicles Market OutlookPower Tools Demand in Motor Vehicles MarketIndustrial Equipment MarketIndustrial Equipment Market OutlookPower Tools Demand in Industrial Equipment MarketConstruction MarketConstruction Market OutlookPower Tools Demand in Construction MarketPower Tools Demand by RegionNortheastNorthSoutheastCentralSouthwestNorthwestVI.
POWER TOOLS INDUSTRY ASSESSMENTSMajor Producer Facility LocationsMajor Power Tools Producers' SalesMarket Share of Key ProducersMajor Foreign InvestmentsIV.
POWER TOOLS SALES VOLUMES AND FORECASTSOverviewPower Tools Sales Volumes and Forecasts (mil Yuan)Metal Cutting Power ToolsGrinding Power ToolsAssembling Power ToolsRailway Power ToolsPower Tools Imports and ExportsV. POWER TOOLS MARKET OUTLOOKPower Tools Markets Outlook OverviewMetal Product MarketMetal Product Market OutlookPower Tools Demand in Metal Product MarketMotor Vehicles MarketMotor Vehicles Market OutlookPower Tools Demand in Motor Vehicles MarketIndustrial Equipment MarketIndustrial Equipment Market OutlookPower Tools Demand in Industrial Equipment MarketConstruction MarketConstruction Market OutlookPower Tools Demand in Construction MarketPower Tools Demand by RegionNortheastNorthSoutheastCentralSouthwestNorthwestLIST OF CHARTSI.
POWER TOOLS SALES VOLUMES AND FORECASTSOverviewPower Tools Sales Volumes and Forecasts (mil Yuan)Metal Cutting Power ToolsGrinding Power ToolsAssembling Power ToolsOther Power ToolsPower Tools Imports and ExportsV. POWER TOOLS MARKET OUTLOOKPower Tools Markets Outlook OverviewMetal Product MarketMetal Product Market OutlookPower Tools Demand in Metal Product MarketMotor Vehicles MarketMotor Vehicles Market OutlookPower Tools Demand in Motor Vehicles MarketIndustrial Equipment MarketIndustrial Equipment Market OutlookPower Tools Demand in Industrial Equipment MarketConstruction MarketConstruction Market OutlookPower Tools Demand in Construction MarketPower Tools Demand by RegionNortheastNorthSoutheastCentralSouthwestNorthwestVI",2021-08-31,PR Newswire,https://www.prnewswire.com/news-releases/china-power-tools-market-analysis-and-forecast-2021-301334652.html
semiconductor,china,Biden competition adviser offers his take on the executive order,"Quick Fix— From the top: Tim Wu, President Joe Biden’s competition adviser on the National Economic Council, walked MT through the thinking behind the president’s recent executive order on competition.
Email [email protected].
Send details to [email protected].
— ‘Inconsistent and problematic’: That’s how ranking member Andy Biggs (R-Ariz.) will describe facial recognition technology, per prepared remarks shared with MT.
Send them along via email to our team: Bob King ([email protected]), Heidi Vogt ([email protected]), John Hendel ([email protected]), Alexandra S. Levine ([email protected]), Leah Nylen ([email protected]), Emily Birnbaum ([email protected]), and Benjamin Din ([email protected])",2021-08-31,Politico,https://www.politico.com/newsletters/morning-tech/2021/07/13/biden-competition-adviser-offers-his-take-on-the-executive-order-796453
semiconductor,china,"Pivot to Health Care, Chips Paid Off in Pandemic, Says Fujifilm","Why did this happen?
Please make sure your browser supports JavaScript and cookies and that you are not blocking them from loading.
For more information you can review our Terms of Service and Cookie Policy",2021-08-31,Bloomberg.com,https://www.bloomberg.com/news/articles/2021-07-08/pandemic-proof-fujifilm-s-pivot-to-health-care-chips-pays-off
semiconductor,china,"China markets boosted by liquidity release, while majority of APAC markets 
rise",,2021-08-31,Capital.com,https://capital.com/china-markets-boosted-by-liquidity-release-while-majority-of-apac-markets-rise
semiconductor,china,Broadband Breakfast Interview About the Future of 5G with ...,"In this interview with Samsung Electronic America’s Senior Vice President of Public Affairs John Godfrey, he and Broadband Breakfast Editor and Publisher Drew Clark discussed both the past and the future of 5G.
Broadband Breakfast Live Online hosted a six-part series, “A No-Nonsense Guide to 5G” in sponsorship with Samsung Electronics America.
“By this time next year, you will not even need to think about whether your carrier has a 5G network or your phone supports 5G,” he said.
But it will be extremely valuable in specific areas in the U.S. that have cleared mid-band spectrum for 5G use.
See “Robert Kubik, John Godfrey and Derek Johnston: After a Decade of Progress, What’s Next for 5G?,” Broadband Breakfast, June 8, 2021This Broadband Breakfast interview is sponsored by:Events in “A No-Nonsense Guide to 5G” include:",2021-08-31,Broadband Breakfast,https://broadbandbreakfast.com/2021/07/broadband-breakfast-interview-about-the-future-of-5g-with-john-godfrey-of-samsung/
