title,excerpt,source,date
Biden administration sounds the alarm on the semiconductor crisis,"Semiconductors, or computer chips, act as the brains that power our 
technological devices. These chips, now smaller than a stamp and thinner ...",Fortune,17 Jul 2021
Production localization new focus for Shanghai semiconductor ...,"A global supply crunch and US sanctions on China's leading chipmakers have 
accelerated the localization of semiconductor industry, ...",Global Times,18 Mar 2021
S'pore semiconductor firms boost capacity amid global chip ...,"Singapore Semiconductor Industry Association (SSIA) executive director Ang 
Wee Seng told The Straits Times that the high demand is forecast to ...",The Straits Times,4 Jun 2021
"White House Sets First Steps on Semiconductor, Mineral ...","On the semiconductors front, the White House said the government is ... the 
private sector in domestic semiconductor manufacturing and R&D.",MeriTalk,8 Jun 2021
China’s chip makers bought more new gear in 2020 than any other country,"US-China tech war: China becomes world's top semiconductor equipment market 
as Beijing pushes local chip industry. Taiwan was the second-largest ...",South China Morning Post,15 Apr 2021
Qualcomm warns global chip shortages are spreading,"Qualcomm Inc, the world's largest smartphone chip maker, warned it is 
struggling to meet demand, signalling that a global semiconductor ...",South China Morning Post,4 Feb 2021
"China is buying up chip firms in a push for semiconductor supremacy, says 
UK lawmaker","LONDON — A U.K. lawmaker believes China is using questionable methods to 
ensure it becomes a world leader in semiconductor technology.",CNBC,17 Jul 2021
2021 will be a calmer year for semiconductors and chips ...,"2021 will be a calmer year for semiconductors and chips (except for Intel). 
4 trends to watch for from VC funding of silicon startups to US- ...",TechCrunch,28 Dec 2020
China’s small semiconductor companies get boost from Washington hostility,"With TSMC, ASML and Intel nowhere to be seen, China's small semiconductor 
players take centre stage at industry expo. Small Chinese companies ...",South China Morning Post,7 May 2021
Tencent makes foray into semiconductor chip business,"New postings for semiconductor chips development jobs on the official 
website of Tencent have sparked speculation that the Chinese tech ...",Global Times,17 Jul 2021
Global chip and semiconductor industry heavily reliant on Asia,"Asia's stronghold on the global semiconductor market has grown so strong 
that sanctions on China's chip production have become a source of ...",Consultancy.asia,19 Apr 2021
"Semiconductors are in short supply. 3 experts weigh in on what to do about 
it","Semiconductors power almost any smart device you own. They're small, 
complex, and powerful pieces of hardware that are integral to the ...",Fortune,17 Jul 2021
Why Businesses Are Still On A Semiconductor Waiting List,"A lot of companies currently are hung up because production of the 
semiconductors that make them go is at a slowdown.",Forbes,17 Jul 2021
Semiconductor Self-Sufficiency: MIIT's Ambitions for 2021 and ...,"Semiconductors are a critical element of all electronic devices, including 
those used within communications, healthcare, computing, ...",China Business Review,20 May 2021
Valens Semiconductor Expects Revenue To Sprint At 48%,"This comes to mind in considering 15 year old Valens Semiconductor — a Hod 
Hasharon, Israel-based company — that merged with a SPAC last ...",Forbes,17 Jul 2021
Simply throwing money may not fulfill Europe's semiconductor ...,"The EU now has just 10 percent of global semiconductor production capacity, 
far behind the US and Asian economies. As the COVID-19 pandemic ...",Global Times,7 May 2021
"EU Weighs Deal With TSMC, Samsung for Semiconductor ...","The European Union is considering building an advanced semiconductor 
factory in Europe in an attempt to avoid relying on the U.S. and Asia ...",Bloomberg.com,10 Feb 2021
Malaysian Tycoons’ UWC Profit Nearly Doubles Amid Global Semiconductor Boom,"“Semiconductor orders remain very strong,” UWC added in the ... able to 
meet the robust global demand for semiconductors and help ease the ...",Forbes,16 Jun 2021
US-Japan chip alliance won't contain China's rise: analysts,"The importance of the semiconductor supply chain has been highlighted 
recently as several major global vehicle brands announced production 
halts ...",Global Times,6 Apr 2021
"Chip giants are making more money than ever as the semiconductor shortage 
rages","Around 57% of the world's chip foundry revenues in the last quarter were 
generated by one Taiwanese chipmaker: Taiwan Semiconductor ...",CNBC,1 Jun 2021
Arizona Becomes US Semiconductor Central,"Motorola and other early semiconductor companies established Arizona as a 
leader in semiconductor design and manufacturing in the 1950s.",Forbes,23 Mar 2021
15 Best Semiconductor Stocks to Buy Now,"Semiconductor chips have a soaring demand in today's world as they are used 
in almost all the smart devices that we use.",Yahoo Finance,17 Jul 2021
Chip Shortage 2021: Semiconductors Are Hard to Make and ...,"Shortages of semiconductors are battering automakers and tech giants ... 
years to build semiconductor fabrication facilities and billions of ...",Bloomberg.com,5 May 2021
"China semiconductor imports declined in April from all-time high amid 
global supply constraints","... The global semiconductor market continues to see strong growth, but 
shortages are expected to persist throughout the year.",South China Morning Post,7 May 2021
China’s memory makers are becoming new disruptive force in sector,"Chinese memory chip makers could add downwards price pressure on suppliers 
in the memory chip sector. Topic | Semiconductors.",South China Morning Post,2 Jun 2021
"McCaul And Cotton Ask Raimondo To Tighten Controls On Semiconductor 
Manufacturing Equipment","... on U.S. Commerce Secretary Gina Raimondo to tighten restriction on the 
sale of semiconductor manufacturing equipment (SME) to China.",Forbes,28 Apr 2021
Who really stands to win from the semiconductor explosion?,"The global semiconductor market is a $440bn industry and continues to ... 
in the world, Taiwan Semiconductor Manufacturing Company (TSMC), ...",Citywire Selector,4 Mar 2021
"China must drive chip assembly, packaging innovations, experts say","The landmark US Innovation and Competition Act identifies China as a major 
rival to America's technological dominance. Topic | Semiconductors.",South China Morning Post,9 Jun 2021
"China will ‘vigorously support’ semiconductor industry, IT minister says","China will 'vigorously support' semiconductor industry, IT ministry head 
says, as country seeks self-sufficiency in chip-making. The head of the ...",South China Morning Post,1 Mar 2021
Chinese chip foundry SMIC seeks to retain top talent with huge stock bonus,"... US$3.7 million in shares in effort to retain semiconductor talent ... 
self-sufficiency in semiconductors, but US sanctions and a talent ...",South China Morning Post,17 Jul 2021
Chinese semiconductor industry is speeding up advanced ...,"Some Chinese companies have shifted its 14nm chipset orders from the market 
leader Taiwan Semiconductor Manufacturing Company (TSMC) to China's ...",Total Telecom,22 Apr 2021
"Why Is There a Chip Shortage? Covid-19, Surging Demand ...","It's also catapulted Taiwan Semiconductor Manufacturing Co. and Samsung ... 
Overall demand for semiconductors of all stripes—from basic ...",Bloomberg.com,28 Mar 2021
When the Chips Are Down: Policy Priorities for Sustaining US ...,"Yet making semiconductors is complex and expensive. The semiconductor 
industry is among the most capital intensive in the world. A new foundry ...",War on the Rocks,14 May 2021
"The semiconductor shortage is here to stay, but it will affect chip 
companies differently","Semiconductors in the age of COVID-19: Extreme demand spike will keep chips 
in short supply for the foreseeable future, but different types ...",MarketWatch,17 Apr 2021
"A global semiconductor shortage highlights a troubling trend: A small and 
shrinking number of the world's computer chips are made in the US","Semiconductors are the logic and memory chips used in computers, phones, 
vehicles and appliances. The U.S. share of global semiconductor ...",The Conversation,9 Mar 2021
How Will the Global Semiconductor Crunch Impact South ...,"Semiconductors are as ubiquitous as they are crucial to the modern economy 
and yet they are in short supply this year.",The Diplomat,1 Apr 2021
"Taiwan uses ‘geopolitical heft’ to boost China investment, despite tensions","Global demand for semiconductors used in everything from computers to cars 
is proving a boon to Taiwanese manufacturers, who are ramping up ...",South China Morning Post,12 May 2021
Controversial Wuhan semiconductor maker dismisses all staff ...,"Chinese controversial semiconductor maker Wuhan Hongxin Semiconductor 
Manufacturing Co (HSMC) has reportedly issued a noticed to dismiss all ...",Global Times,28 Feb 2021
"This semiconductor stock could determine the chipmakers' next move, 
strategist says","Semiconductor stocks sat out the tech rally this week, and one strategist 
said a single chipmaker could point to their next move.",CNBC,11 Jun 2021
Taiwan Semiconductor's Earnings Raise Doubts Over Outlook,"Taiwan Semiconductor Manufacturing Co. had good news and bad news for tech 
investors. The company reported second-quarter revenue that was a ...",Barron's,17 Jul 2021
Infineon (IFX:GR) Hits Targets Helped by 'Booming ...,"German semiconductor manufacturer Infineon Technologies AG said about 2.5 
million cars won't be produced in the first half of 2021 due to ...",Bloomberg.com,3 May 2021
The Semiconductor Industry’s Competitive Dilemma,"TSMC is not a leading edge semiconductor foundry monopoly yet. However, we 
are seeing a glimpse of what the world may look like if TSMC is the ...",Forbes,4 Mar 2021
The 10 Hottest Semiconductor Startups Of 2021 (So Far),"These startups are taking on semiconductor heavyweights like Intel and 
Nvidia with new kinds of silicon solutions for compute, ...",CRN,16 Jun 2021
Tough road ahead for U.S. firms trying to cut reliance on Taiwan chipmakers,"Asian countries produce more than 70% of global semiconductors — Taiwan and 
South ... Taiwan Semiconductor Manufacturing Company (TSMC), ...",CNBC,13 Apr 2021
"Micron CEO sees semiconductor growth as cars become 'data centers on 
wheels' and 5G rolls out","Micron Technology sees immense growth for semiconductors in 5G and electric 
vehicles, CEO Sanjay Mehrotra told CNBC on Thursday.",CNBC,17 Jul 2021
China wants disruptive chip tech to prepare for Moore’s Law demise,"China seeks to boost its domestic chip-making capability amid a protracted 
tech war with the US. Topic | Semiconductors.",South China Morning Post,15 May 2021
Why Trailing Edge Semiconductor Manufacturing Matters,"The need for processors on larger nodes is also constrained as most of the 
major semiconductor fabs have opted to invest in leading edge ...",Forbes,13 May 2021
Semiconductor firms struggling to meet demand for chips amid ...,"Major Singapore semiconductor firms say they won't make enough chips to 
meet demand until at least next year, despite almost all factories ...",CNA,27 Mar 2021
Why you should pay attention to China's semiconductor industry,"As part of its Made in China 2025 plan, China aims to produce 70 per cent 
of all the semiconductors it requires by 2025, with a longer term ...",The Business Times,5 May 2021
TSMC considering first chip packaging plant in US,"TAIPEI --Taiwan Semiconductor Manufacturing Co. is considering building ... 
to integrate different types of semiconductors onto wafers.",Nikkei Asia,11 Jun 2021
Senate approves billions for US semiconductor manufacturing,"The bill invests billions into emerging technology industries like 
artificial intelligence, semiconductors, and quantum computing in the US.",The Verge,8 Jun 2021
How Wuhan’s dream chip project became a nightmare,"China's semiconductors: How Wuhan's challenger to Chinese chip champion 
SMIC turned from dream to nightmare. Hopes that the HSMC facility could ...",South China Morning Post,20 Mar 2021
"The Biden administration is working to help address global semiconductor 
chip shortage","The White House has pledged to help address the ongoing global 
semiconductor shortage, with President Joe Biden said to be signing an ...",The Verge,11 Feb 2021
TSMC's Japan project attracts over 20 participant companies,"... Taiwan Semiconductor Manufacturing Co. to develop cutting-edge ... 
which vertically layers semiconductors -- and to do so in Japan.",Nikkei Asia,31 May 2021
Renesas says fire-hit chip plant to resume full production in May,"The shortage of semiconductors has squeezed global automakers' output. ... 
including Taiwan Semiconductor Manufacturing Co.",Nikkei Asia,19 Apr 2021
Investors rush into semiconductor stocks amid global chip ...,"TOKYO -- Semiconductor and related companies -- hobbled by supply chain 
problems and unable to keep up with a deluge of orders from the ...",Nikkei Asia,18 Jan 2021
10 Hottest Semiconductor Companies To Watch In 2021,"A look at some of the hottest chip startups and semiconductor giants in 
2021 that are making big, bold moves and shaping the future of IT ...",CRN,29 Mar 2021
"Transparency Is Critical as Semiconductor Industry Works to Meet Surging 
Demand","As the semiconductor industry grapples with surging demand, transparency 
into the supply chain is critical, according to Mike Splinter, chairman ...",Nasdaq,17 Jul 2021
Taiwan’s foundry king says mainland China is not yet a competitor,"Chang, who established Taiwan Semiconductor Manufacturing Co (TSMC) in 
1987, is seen as the father of Taiwan's success in the foundry ...",South China Morning Post,22 Apr 2021
TSMC joins US chip coalition in a potential blow to China,"The Semiconductors in America Coalition (SIAC), which includes 65 major 
players along the semiconductor value chain, announced its formation on ...",South China Morning Post,12 May 2021
Defense Magazine Semiconductor Shortage Shines Light On ...,"Semiconductors are the foundation of the advanced technologies that regular 
citizens and military officials rely on — from cell phones and ...",National Defense Magazine,21 May 2021
How the Number One U.S. Semiconductor Company Stumbled,"On this episode, we speak with Stacy Rasgon, a semiconductor analyst at 
Bernstein Research on Intel and the general state of U.S. high-tech ...",Bloomberg.com,30 Nov 2020
Taiwan drought at 'most critical' phase for chip sector,"Taichung has suffered the worst of a dry spell that has emerged as a threat 
to Taiwan's semiconductor device production.",Nikkei Asia,28 Apr 2021
"CEO of largest U.S. chip foundry explains why semiconductor shortage could 
last through 2022","A shortage of semiconductor microchips is causing havoc around the world. 
GlobalFoundries, the third-largest foundry, is planning to invest ...",CNBC,2 Apr 2021
Geopolitics and the push for 'made in the USA' semiconductors,"Authors: Robyn Klingler-Vidra, KCL and Yu-Ching Kuo, Kaohsiung. US and 
Taiwanese semiconductor powerhouses Intel and TSMC have both recently ...",East Asia Forum,19 May 2021
"Chips Designed By AI Are The Future Of Semiconductor Evolution Beyond 
Moore's Law","We are currently in the midst of a global semiconductor shortage that is 
negatively impacting the entire technology supply chain.",Forbes,25 May 2021
Why the current semiconductor shortage won’t be the last,"Why the semiconductor shortage hitting cars and smartphones won't be the 
last. The last big supply chain shock was 10 years ago when the ...",South China Morning Post,22 Mar 2021
China’s top chip maker quadruples salary for senior Taiwanese executive,"Semiconductor giant SMIC rewards senior Taiwanese executive with hefty 
compensation as China builds up chip sector's hi-tech talent pool. SMIC ...",South China Morning Post,7 Apr 2021
"Semiconductor wafer producer SK Siltron CSS to invest $300M in US to boost 
EV supply chain","Wafers 101. A wafer is a thin slice of semiconductor that's used to make 
integrated circuits, which essentially help make semiconductor chips ...",TechCrunch,17 Jul 2021
Will a Chip Czar Guarantee China Success? It's a Moon Shot,"Semiconductor Manufacturing International Corp., the nation's flagbearer in 
manufacturing, is still around six years behind global leaders ...",Bloomberg.com,17 Jun 2021
Semiconductor-starved mainland China fuelling surge in exports from Taiwan,"Semiconductor-starved mainland China seen driving long-term surge in 
exports from Taiwan. Global chip shortage – caused by a glut in 
pandemic- ...",South China Morning Post,23 Apr 2021
"Yes, the global microchip shortage is COVID's fault. No, it won ...","Semiconductors are an essential component of electronic devices, ... They 
harness the conducting properties of semiconductor materials (such ...",GCN,8 Jun 2021
Chip working group won’t ease tensions but a seen as good start,"... However, trade tensions in the semiconductor sector would not be eased 
any time soon amid US-China rivalry, say analysts.",South China Morning Post,13 Mar 2021
On Semiconductor LED driver ICs support smart and ...,"Recent LED driver IC launches from On Semiconductor offer robust circuit 
protection while enabling visible light communications (VLC) and other ...",LEDs Magazine,17 Jul 2021
ON Semiconductor Reports First Quarter 2021 Results,"ON Semiconductor Reports First Quarter 2021 Results · Revenue of $1,481.7 
million increased 16 percent year-over-year · GAAP diluted earnings per ...",Business Wire,3 May 2021
ON Semiconductor Stock Rises By 26% In The Last 30 Days,"ON Semiconductor's Revenue. Year-on-year quarterly revenue growth grew by 
15.9%, now sitting on 5.46B for the twelve trailing months. Volatility.",Via News,16 Aug 2021
