title,excerpt,source,date
Daimler says semiconductor shortage to last into 2022,"LONDON, July 21 (Reuters) - Mercedes-Benz maker Daimler AG said on 
Wednesday that the global semiconductor shortage will last into 2022 and ...",Reuters,19 Jul 2021
The global chip shortage is starting to hit the smartphone industry,"Semiconductors have been in short supply this year, due to a number of ... 
Syed Alam, Accenture's global semiconductor lead, told CNBC.",CNBC,02 Aug 2021
Lattice Semiconductor Recognized for “Leading the Next ...,"--(BUSINESS WIRE)--Lattice Semiconductor Corporation (NASDAQ: LSCC), the 
low power programmable leader, today announced that the company was ...",Business Wire,19 Jul 2021
Semiconductor Market in East Asia to grow by USD 84.41 ...,"GigaDevice Semiconductor Inc., MediaTek Inc., Qualcomm Inc., Renesas 
Electronics Corp., Samsung Electronics Co. Ltd., Sharp Corp., SK HYNIX Inc.",PR Newswire,02 Aug 2021
Japan seeks new ways to strengthen semiconductor production,"When the COVID-19 pandemic disrupted semiconductor supply chains and 
triggered shortages worldwide, it laid bare just how much Japan relies 
on ...",NHK.JP,09 Aug 2021
Is Taiwan Semiconductor Manufacturing Co. (TSM) A Smart Long-Term Buy?,"In the Q2 2021 investor letter of Wedgewood Partners, the fund mentioned 
Taiwan Semiconductor Manufacturing Company Limited (NYSE: TSM), ...",Yahoo Finance,19 Jul 2021
Soaring Semiconductor Sales Could Be Super for ‘SMH’,"For technology investors in 2021, there's no escaping talk of the global 
semiconductor shortage, but for as onerous as that situation is, ...",Nasdaq,10 Aug 2021
German carmakers partially shut down amid semiconductor ...,"The German automotive industry is continuing to struggle with a severe 
supply shortage in semiconductors, while national and European ...",EURACTIV.com,02 Aug 2021
ON Semiconductor Corp. (ON) Beats Q2 Earnings and Revenue Estimates,"ON Semiconductor Corp. (ON) came out with quarterly earnings of $0.63 per 
share, beating the Zacks Consensus Estimate of $0.49 per share.",Yahoo Finance,02 Aug 2021
"China's push for semiconductor self-reliance will propel tech growth and 
competition: Moody's","China's (A1 stable) potential jump in investment to achieve a 70% 
self-sufficiency ratio in semiconductors by 2025 could boost its tech ...",IndiaInfoline,09 Aug 2021
2 Semiconductor-Service Growth Stocks to Own Now,"Compared to the iShares PHLX Semiconductor ETF, which trades at over 37 
times earnings, Cohu might represent an excellent value going forward. 2 ...",The Motley Fool,26 Jul 2021
BE Semiconductor beats Q2 revenue forecasts on higher ...,"Delays in shipments impacted revenues in the previous quarter. The 
Dutch-based maker of semiconductor assembly and packaging equipment added 
it ...",Reuters,26 Jul 2021
Intel and Micron among semiconductor decliners after cautious analyst note,"Semiconductor stock are underperforming the broader market today after a 
cautious note from Morgan Stanley forecast the coming end to the ...",Seeking Alpha,13 Aug 2021
The Industry-Academic Cultivation Program of High-level ...,"Taiwan's semiconductor industry is a key force in the global supply chain, 
... The Taiwanese government officially listed the semiconductor ...",Borneo Post Online,13 Aug 2021
"Upton, Meijer send letter to House leadership urging action on 
semiconductor shortage","Semiconductors are used for features like touchscreens, navigation systems 
... ""While the U.S. is a world leader in semiconductor design, ...",Holland Sentinel,02 Aug 2021
GlobalFoundries Announces New Semiconductor Fab in New ...,"A major semiconductor manufacturer is making a play to expand its U.S. 
manufacturing operations. GlobalFoundries Inc. announced July 19 it ...",IndustryWeek,19 Jul 2021
Intel vs. AMD: Which Semiconductor Stock Is a Better Pick?,"Semiconductors are proving to be the engines that drive the electronics 
world of today, as they are being used in different applications.",Yahoo Finance,02 Aug 2021
"Instead of EV Stocks, Consider These 3 Chip Stocks","But here's an alternative: semiconductor stocks. Semiconductors are the 
basic building blocks of all technology, and they're gobbling up ...",The Motley Fool,09 Aug 2021
"VC Company Autotech Skips Semiconductors, Backs Tesla-fying Dealerships","... dealership won't but the Tesla model will, the effects of Covid will 
outlive the pandemic and semiconductors are like toilet paper.",Forbes,13 Aug 2021
Dingell proposes $2 billion in federal semiconductor spending,"Debbie Dingell, D-Dearborn. The bill comes amid an ongoing semiconductor 
shortage that has forced shutdowns at auto plants and threatens to cut ...",Detroit News,02 Aug 2021
Power Semiconductor Market Research Report 2021 ...,"Power Semiconductor Market Research Report 2021 Elaborate Analysis With 
Growth Forecast To 2027 – Infineon, Texas Instruments, ON Semiconductor.",The Market Writeuo -,15 Aug 2021
"Miami builder has more homes coming near future Taiwan Semiconductor plant 
in north Phoenix","PHOENIX — Hundreds of homes are being planned near the Taiwan Semiconductor 
Manufacturing Co. Ltd.'s 1,128-acre manufacturing plant under ...",ABC15 Arizona,10 Aug 2021
Chart Support May Provide Circuit Breaker for Falling Chip Stocks,"Semiconductor stocks are trading near chart support despite facing a 
challenging outlook. The iShares Semiconductor ETF (SOXX) finds a ...",Investopedia,14 Aug 2021
"Car chip shortage to abate, smartphones could be next ...","July 23 (Reuters) - The semiconductor shortage that has gripped the world 
could last well into 2022 and hit smartphone production next, ...",Reuters,26 Jul 2021
Why AMD Stock Just Lit Up 4%,"Reports of the end of the semiconductor chip shortage may have been greatly 
exaggerated -- at least, according to one analyst.",The Motley Fool,14 Aug 2021
"Gallium Nitride Semiconductor Device Market Size, Analysis ...","Gallium Nitride Semiconductor Device Market Size, Analysis, Competitive 
Strategies and Forecasts to 2028. August 15, 2021. 6 Min Read.",The Market Writeuo -,16 Aug 2021
"Nissan 'cannot be optimistic' about the ongoing global chip shortage, CEO 
says","Uchida believes the chip shortage situation will improve but he warned 
there are “many complexities” surrounding semiconductor suppliers as ...",CNBC,02 Aug 2021
Patent Filings Roundup: Litigation Funding WAGs the Dog ...,"A big chunk of the PTAB action was against Ocean Semiconductor LLC by 
Applied Materials, Inc., who filed five against the litigation ...",IPWatchdog.com,12 Aug 2021
"From Ford trucks to Xbox, the chip shortage is still causing problems","When car demand returned and automakers needed semiconductors again, ... 
concluded a 100-day review of the US semiconductor supply chain, ...",Vox,09 Aug 2021
"Kyoto Semiconductor Co., Ltd. Launches New Photodiode ...","Kyoto Semiconductor Co., Ltd. Launches New Photodiode Demonstrating 
Superior Performance With Semtech's Linear Transimpedance Amplifier. 
KP-A ...",Business Wire,09 Aug 2021
"Semiconductor Capital Equipment Market Size, Share ...","Semiconductor Capital Equipment Market Size, Share, Analysis, Regional 
Outlook and Forecast 2021-2028. August 14, 2021. 6 Min Read.",The Market Writeuo -,15 Aug 2021
Low semiconductor supplies may not be the main reason for PS5 shortages,"Low semiconductor supplies may not be the main reason for PS5 shortages. 
Plans to make 14.8 million consoles this fiscal year may still fall ...",Ars Technica,09 Aug 2021
Behind the deal: Courting Taiwan Semiconductor took years ...,"Behind the deal: Courting Taiwan Semiconductor took years. Now, it's on a 
strict timeline ... “Who would have ever thought in my career I'd be ...",The Business Journals,19 Jul 2021
How Toyota kept making cars when the chips were down,"The unexpected spike in demand wasn't the only factor in the shortage: A 
series of unpredictable disasters also tangled the semiconductor supply ...",Fortune,02 Aug 2021
This Semiconductor Company Has A Better 1-Year Return ...,"This Semiconductor Company Has A Better 1-Year Return Than Amazon, Apple, 
Netflix And Microsoft. by Henry Khederian 1 min read.",Benzinga,14 Aug 2021
World’s semiconductor firms suffer poor week on bearish outlook,"Philadelphia Semiconductor Index on a six-day losing streak · Semiconductor 
stocks drag China down on Friday · KOSPI's worst week in six months.",Capital.com,14 Aug 2021
Semiconductor Equipment Manufacturer Plans Additional ...,"Semiconductor Equipment Manufacturer Plans Additional Hiring Growth in 
Chandler and Signs New Office Sublease. Open Audio Article Player. By ...",Signals AZ,11 Aug 2021
Inhibited nonradiative decay at all exciton densities in ...,"Even with the application of strain, the semiconductor remained ... The 
photophysics of these monolayer semiconductors as a function of Vg ...",Science,26 Jul 2021
Semiconductor crisis hits Maruti Suzuki; production partially impacted,"Automotive sector is not the biggest market for semiconductor makers, which 
is why supply was diverted to other areas.",Autocar India,09 Aug 2021
GM will cut truck production amid semiconductor shortage,"N) said Wednesday it will cut some truck production in North America 
because of the ongoing global semiconductor shortage.",Reuters,26 Jul 2021
"Fabs, Fabless and Indian Semiconductor Industry","While one can understand the frustrations of fabless semiconductor 
companies in getting predictable or preferential treatment by fabs, it 
is ...",Swarajya,26 Jul 2021
Tata Motors to redesign vehicles to reduce impact of semiconductor crisis,"Tata Motors to redesign vehicles to reduce impact of semiconductor crisis 
... crisis due to lack of supply of semiconductors in coming days.",Hindustan Times Auto News,26 Jul 2021
"Neo Semiconductor Claims It Can Deliver QLC Density, SLC ...","According to Neo Semiconductor, it's developed a method of building NAND 
that offers the performance of SLC and the density of QLC.",ExtremeTech,10 Aug 2021
"Semiconductor shortage will take 1-2 years to stabilize markets, Intel CEO 
says","The global shortage of semiconductors that has hobbled the auto industry 
and made some consumer electronics more expensive could last until ...",WRAL TechWire,26 Jul 2021
"Sale of semiconductor factory to Chinese-owned firm presents bigger UK risk 
than Huawei","Semiconductors allow electricity to flow through devices and are crucial 
components in medical equipment, smartphones, radios and TVs.",The Telegraph,26 Jul 2021
Tesla reveals its secret to surviving semiconductor shortages,"Tesla has been one company that has demonstrated an incredible response to 
the global semiconductor shortage, a challenge that has plagued ...",Teslarati.com,26 Jul 2021
US preps semiconductor factory plans amid shortage: EXCLUSIVE,"... semiconductor chip factories in the U.S. within 18 months of the date 
that Biden signs the Innovation and Competition Act into law.",Fox Business,26 Jul 2021
Intel Drops A Bomb On The Semiconductor Industry,"Investment Thesis. Moore's Law is the bread and butter of the semiconductor 
industry: a final silicon chip can only ever be as good as the ...",Seeking Alpha,26 Jul 2021
NXP Semiconductors NV (NXPI) Q2 2021 Earnings Call Transcript,"Welcome to the NXP Semiconductor's second quarter 2021 earnings call. With 
me on the call today is Kurt Sievers, NXP's President and CEO; ...",The Motley Fool,02 Aug 2021
Semiconductor Supply Shortages To Ease In 2-3 Quarters: Report,"Semiconductors in particular and electronics in general are the few 
remaining areas of localization in the Indian Automotive supply chain. 
With ...",Goodreturns,26 Jul 2021
Semiconductor supply company moving to larger space in Chandler,"PHOENIX – A company based in the Netherlands that supplies products and 
support to semiconductor manufacturers is increasing its presence in ...",KTAR News,26 Jul 2021
"State of Texas: Lawmakers seek solutions for semiconductor shortages to 
improve national security","AUSTIN (Nexstar) — America needs to think differently when it comes to 
boosting manufacturing of semiconductor chips, according to one Texas ...",KXAN Austin,26 Jul 2021
Everything you need to know about the global semiconductor shortage,"Beyond consumer electronics, the tight supply has begun to impact China's 
giant home appliance manufacturing sector. Topic | Semiconductors.",South China Morning Post,12 May 2021
IBM Chips In To Drive 2 Nanometer Semiconductor Manufacturing,"First, the company continued to do fundamental research in semiconductor 
technologies at its facilities in New York, usually in conjunction ...",The Next Platform,6 May 2021
Commentary: There is a global semiconductor famine and it ...,"Semiconductors, responsible for microchips that power everything from 
computers to cars has been hit with a global shortage thanks to the ...",CNA,9 Mar 2021
Why US-China Rivalry Might Be Good for Singapore's ...,"Chartered Semiconductor was meant to help turn Singapore into a global 
manufacturing hub for semiconductors and computer components and for a ...",The Diplomat,17 Jul 2021
Semiconductor cycle out of balance after customers stock up,"In an industry as cyclical as semiconductors, there is always either too 
much or too little supply. For the companies that design and use ...",Financial Times,15 Feb 2021
Will The US Let The Chips Fall On Semiconductor Policy?,"There is bipartisan, bicameral support in Congress for the Creating Helpful 
Incentives to Produce Semiconductors for America Act (CHIPS for ...",Forbes,31 May 2021
Stocks That Benefit As U.S. Reshores Semiconductor Production,"Moreover, demand for semiconductor fabrication equipment is also likely to 
grow, as the U.S. government has been taking steps to protect its ...",Forbes,17 Jul 2021
South Korea to spend $451 billion on becoming a ...,"“The entire semiconductor industry is facing a watershed moment and now is 
the time to chart out a plan for long-term strategy and investment,” ...",Data Center Dynamics,14 May 2021
The EU must play a long game for semiconductor success,"Sign up to myFT Daily Digest to be the first to know about Semiconductors 
news. The writer is chief executive of Intel. Technology has never ...",Financial Times,28 Apr 2021
Fire destroys 5% of Renesas semiconductor cleanroom,"Renesas Electronics Corporation, one of the world's largest semiconductor 
manufacturers, has reported the occurrence of a fire on 19 March ...",Cleanroom Technology,24 Mar 2021
Why semiconductors are as scarce as gold,"Chips production starts with wafers. A wafer (slice of semiconductor) acts 
as a substrate for microelectronic devices. Many so-called integrated ...",ING Think,8 Apr 2021
Japan puts all chips on the table to lure semiconductor makers,"TOKYO -- Japan will pull out every policy stop to court overseas 
semiconductor companies, including offering generous financial 
incentives, ...",Nikkei Asia,3 Jun 2021
How the world ran out of semiconductors,"There's a global shortage in semiconductors, and it's becoming increasingly 
serious. The US is currently reviewing its supply of the ...",The Conversation,5 Mar 2021
New Chinese chip firms have tripled in 2021 amid self-sufficiency push,"As China pursues self-sufficiency in semiconductors, Washington is seeking 
to counter Beijing with a new bill funding domestic fabrication.",South China Morning Post,9 Jun 2021
China chases semiconductor self-sufficiency,"Huawei's Kirin chipsets are made by Taiwan Semiconductor Manufacturing 
Company (TSMC) using US technology and equipment. The technological gap ...",East Asia Forum,22 Feb 2021
Is the world too dependent on Asia’s semiconductor industry?,"The Asia Pacific is also the world's biggest market for semiconductors, 
accounting for 60% of global semiconductor sales, with China alone ...",Tech Wire Asia,26 Mar 2021
China Turns Semiconductors Into The ‘New Oil’ While GM Runs Out Of Chips,"China Turns Semiconductors Into The 'New Oil' While GM Runs Out Of Chips · 
China International Semiconductor Expo. Visitors look at 5G chips at ...",Forbes,7 Feb 2021
China’s semiconductor output hits all-time high amid global shortage,"China's semiconductor output in May hits all-time high amid chip shortage 
and tech war with US. China's IC output in May surged 37.6 per cent ...",South China Morning Post,16 Jun 2021
"U.S. chipmaker invests $4 billion in Singapore, even as Congress tries to 
lure manufacturers home","“GlobalFoundries is meeting the challenge of the global semiconductor 
shortage by accelerating our investments around the world,” CEO Tom ...",Fortune,17 Jul 2021
Boom quarter for top 10 semiconductor companies,"Samsung, with total growth of 25 per cent, is catching up on Intel which 
while the largest supplier was the only major semiconductor company to ...",eeNews Europe,25 May 2021
Envisioning the Indian Semiconductor Ecosystem to be at Par ...,"To dive deep into the semiconductor market of India and the growth 
prospects of setting up Fabless manufacturing units in India, ELE 
Times's ...",ELE Times,17 Jul 2021
China's progress in advanced semiconductor technology slows,"SHANGHAI -- China is facing delays in miniaturizing semiconductors. In a 
Nikkei survey, most of the seven major Chinese semiconductor ...",Nikkei Asia,9 May 2021
China’s universities rush to set up new semiconductor programmes,"China's Ministry of Education has made semiconductor science and 
engineering a priority academic programme; That has encouraged more ...",South China Morning Post,17 Jul 2021
China's semiconductor IP sector accelerates drive for self ...,"The semiconductor intellectual property (IP) sector in China is growing 
rapidly by the day, with tens of thousands of chip design companies ...",Global Times,19 May 2021
"US to lead world again, Biden tells CEOs at semiconductor ...","Heads of 19 companies, including Taiwan Semiconductor Manufacturing Co., 
Samsung's Device Solutions Division, Intel, Medtronic and Micron, are ...",Nikkei Asia,13 Apr 2021
Why semiconductors are important in the US-China tech war,"A semiconductor is a substance that conducts electricity under some 
conditions but not others, making it a good medium to control electrical ...",South China Morning Post,29 Oct 2020
Lagging but motivated: The state of China's semiconductor ...,"Every year, China imports more than $300 billion of semiconductors, and 
most, though not all, major American semiconductor companies pull in at ...",Brookings Institution,7 Jan 2021
Why We're in the Midst of a Global Semiconductor Shortage ...,"Business and financial media have detailed how the shortage of 
semiconductors has caused production cutbacks in the automotive industry: 
Ford, ...",Harvard Business Review,26 Feb 2021
Japan Seeks to Revive Stalled Semiconductor Industry ...,"Both nations have launched aggressive funding measures to revive their 
local semiconductor industries. And if Japan refuses to invest due to 
its ...",Supply Chain Digital,17 Jul 2021
Semiconductors and the Indian Predicament,"According to the India Electronics and Semiconductor Association (IESA), 
semiconductors in India were consumed worth US$21 billion in 2019, ...",ELE Times,17 Jul 2021
Rising Revenues And Margins Could Drive ON Semiconductor Stock To $45,"Up around 3.5x from its low in March 2020, at the current price of $38 per 
share, we believe ON Semiconductor stock (NASDAQ: ON) has further ...",Forbes,7 Jun 2021
Semiconductor equipment sales to hit US$100bn,"The global semiconductor equipment market is forecast to expand to a 
record-high US$100 billion next year, up 4.93 percent from US$95.3 
billion ...",Taipei Times,17 Jul 2021
Why the semiconductor shortage won't end soon | Penn Today,"Morris A. Cohen of the Wharton School explains the impact of the shortage 
of semiconductors that is currently affecting economies around the ...",Penn Today,19 Mar 2021
"Semiconductors: Chinese takeover of UK's leading chipmaker doesn't need a 
security review – here's why","Chinese state-backed conglomerate Wingtech Technology is taking full 
control of the UK's largest semiconductor foundry, Newport Wafer Fab ...",The Conversation,17 Jul 2021
"Governments are deploying 'wartime-like' efforts to win the global 
semiconductor race","These clever semiconductors make our internet-connected world go round. ... 
Through the so-called “K-Semiconductor Strategy,” the South ...",CNBC,17 May 2021
U.K. Sold Off $42 Billion of Semiconductor Firms Before Review,"The U.K. was once the leading semiconductor innovator in Europe, producing 
the likes of Arm Ltd., whose technology is found in 90% of all ...",Bloomberg.com,17 Jul 2021
Taiwan pledges to boost semiconductor supply to Europe ...,"Taiwan's high-tech chip manufacturing plants are among the largest and most 
advanced in the world, with the Taiwan Semiconductor Manufacturing ...",The Straits Times,11 May 2021
"US, China to set up working group to ease tension in global chips industry","to ease a global shortage of chips, a move that could help Chinese firms, 
from Huawei Technologies to Shanghai-based Semiconductor ...",South China Morning Post,11 Mar 2021
China’s semiconductor output hits record in June with support from Beijing,"China's semiconductor output hits record high as Beijing boosts local 
production amid intensifying US-China tech war · China's integrated 
circuit ...",South China Morning Post,17 Jul 2021
15 Biggest Semiconductor Companies in the World,"Semiconductors may be pure elements, such as silicon or germanium, or 
compounds such as gallium arsenide or cadmium selenide. Semiconductors 
are ...",Yahoo Finance,6 Jan 2021
Chinese-owned firm acquires UK’s largest semiconductor manufacturer,"The UK's largest producer of semiconductors has been acquired by the 
Chinese-owned manufacturer Nexperia, prompting a senior Tory MP to call ...",The Guardian,17 Jul 2021
Could the Geopolitical Climate Hamper the Semiconductor ...,"While historically China has been an important supplier in the chip 
industry, increasing U.S.-China tensions threaten the semiconductor 
supply ...",IoT World Today,15 Jun 2021
China to waive import taxes for semiconductor companies until 2030,"Chinese chip makers, including top player Semiconductor Manufacturing 
International Corporation (SMIC), rely heavily on foreign technologies.",South China Morning Post,30 Mar 2021
The World Is Dangerously Dependent on Taiwan for ...,"That's mostly down to Taiwan Semiconductor Manufacturing Co., ... it was 
able to cut off the supply of semiconductors from TSMC and other ...",Bloomberg.com,25 Jan 2021
Q&A: Electronics and Semiconductor Industry in Vietnam,"Businesses investing in the semiconductor industry are eligible for 
preferential incentives such as zero percent corporate income tax for 
the ...",Vietnam Briefing,17 Jul 2021
Breakthrough in chips materials could push back the ‘end’ of Moore’s Law,"US-China tech war: TSMC helps make breakthrough in semiconductor ... of 
semiconductors in a race to own a key piece future technology.",South China Morning Post,19 May 2021
"Semiconductor investment frenzy ramps up in Asia amid chip shortages, tech 
war","This came days after it was reported by Nikkei Asia that Taiwan 
Semiconductor Manufacturing Co (TSMC), the world's largest contract chip 
maker, ...",South China Morning Post,17 Jul 2021
China's semiconductor revolution: From crisis to self-sufficiency,"We spoke to Hui He, Associate Director and Head of China Semiconductor 
Research at Omdia, about the severity of the ongoing semiconductor 
supply ...",Total Telecom,15 Jun 2021
US senators propose 25per cent tax credit for semiconductor ...,"The tax credit could benefit Taiwan Semiconductor Manufacturing Co (TSMC) , 
which is building a US$12 billion semiconductor factory in Arizona, ...",CNA,18 Jun 2021
Chip tools become latest victim of global semiconductor crunch,"But you won't be able to get them -- because of the shortage of chips. This 
conundrum is the latest sign of how the global semiconductor supply ...",Nikkei Asia,15 Apr 2021
How Semiconductor Shortages Have Taken A Chip Out Of The Global Supply Chain,"While news reports on the semiconductor shortage has focused on the 
automotive industry, most consumer electronics and hi-tech companies will 
be ...",Forbes,17 Jul 2021
"Why the World Is Short of Computer Chips, and Why It Matters","... a similar cause: an abrupt and cascading shortage of semiconductors. 
... two Asian powerhouses — Taiwan Semiconductor Manufacturing Co.",Bloomberg.com,17 Feb 2021
"When the chips are down, can 007 save the semiconductor?","Some will argue that, after years of what has often been fairly incoherent 
US-China trade skirmishing, semiconductors provide the arena in which ...",Financial Times,25 Apr 2021
"SkyWater CEO: America Is Losing the War for Semiconductors to Asian 
Manufacturers. National Security Is at Risk.","About the author: Thomas Sonderman is president and CEO of SkyWater 
(ticker: SKYT), a U.S.-based semiconductor foundry.",Barron's,17 Jul 2021
"Why there's a chip shortage that's hurting everything from the PlayStation 
5 to the Chevy Malibu","Semiconductors are in short supply because of strong demand for 
electronics, shifting business models in the semiconductor world that 
created a ...",CNBC,10 Feb 2021
Investment outlook for semiconductors amid rising global chip ...,"Semiconductor companies may not be as headline-grabbing as their big tech 
counterparts such as Apple, Google and Facebook.",CNA,7 Apr 2021
What’s behind the semiconductor shortage and how long could it last?,"A global shortage of semiconductors has created serious anxiety in some 
industries and even caused automakers to halt production in several ...",Brookings Institution,24 May 2021
