query,region,title,excerpt,date,source,link
semiconductor,GB,"iShares PHLX Semiconductor ETF Is Expensive, But Long-Term Growth Outlook 
Appears To Be Favorable","Semiconductor components are essential electronic components that consumers 
need in everyday lives. The industry is set to continue to grow at a fast 
pace, ...",2020-1-23,Seeking Alpha,https://seekingalpha.com/article/4318639-ishares-phlx-semiconductor-etf-is-expensive-long-term-growth-outlook-appears-to-be-favorable
semiconductor,GB,"Galaxy Fold's bendable screen is still flawed. Is diamond glass the 
solution?","Akhan Semiconductor isn't the only company working toward a stronger 
material for foldable phones. Gorilla Glass-maker Corning showed CNET glass 
that's thin ...",2020-1-22,CNET,https://www.cnet.com/tech/mobile/galaxy-fold-bendable-screen-still-flawed-is-diamond-glass-solution/
semiconductor,GB,2D and 3D combo could keep Moore's Law going,"“Thickness scaling of common semiconductor materials, such as Si, ... the 
2D semiconductors exhibit reasonably high mobilities and immunity against 
surface ...",2020-1-6,GCN,https://gcn.com/articles/2020/01/06/2d-3d-integrated-circuits.aspx
semiconductor,GB,How Does Samsung Make Money?,"Semiconductor Revenues grew from about $38 billion in 2015 to $73 billion 
in 2018, driven by strong DRAM and NAND pricing, they are likely to decline 
to under ...",2020-1-2,Forbes,https://www.forbes.com/sites/greatspeculations/2020/01/02/how-does-samsung-make-money/
semiconductor,GB,Top 3 ETFs For Investing In Asia,"Taiwan Semiconductor Manufacturing; Public Bank. Next is the iShares MSCI 
All Country Asia ex Japan ETF (AAXJ). This is an Asia focused ETF providing 
exposure ...",2020-1-24,Nasdaq,https://www.nasdaq.com/articles/top-3-etfs-for-investing-in-asia-2020-01-24
semiconductor,GB,New Report: China's Memory Ambitions,"“China found that its semiconductor imports exceeded even its petroleum 
imports, motivating this cash-rich nation to seek self-sufficiency,” said 
Jim Handy, ...",2020-1-23,Electronic Design,https://www.electronicdesign.com/technologies/embedded-revolution/article/21121263/objective-analysis-new-report-chinas-memory-ambitions
semiconductor,GB,3 “Strong Buy” Stocks for the 5G Revolution in 2020,"Investors in Tower Semiconductor stock can expect to see ""low double-digit"" 
organic growth in 2020, says Needham analyst Rajvindra Gill. And while that 
may not ...",2020-1-17,Nasdaq,https://www.nasdaq.com/articles/3-strong-buy-stocks-for-the-5g-revolution-in-2020-2020-01-17
semiconductor,GB,Intel recaptures title of world's largest semiconductor vendor by revenue,"In brief: Worldwide semiconductor revenue dipped significantly in 2019 due 
to the global downturn in the memory market. As a result, Intel was able to 
slide ...",2020-1-16,TechSpot,https://www.techspot.com/news/83583-intel-recaptures-title-world-largest-semiconductor-vendor-revenue.html
semiconductor,GB,Uk team takes next step towards III-V memory - News,"Compound Semiconductor would like to notify you of new and interesting 
articles! Don't Allow. Allow.",2020-1-15,Compound Semiconductor,https://compoundsemiconductor.net/article/110000/Uk_Team_Takes_Next_Step_Towards_III-V_Memory
semiconductor,GB,Silanna Semiconductor's Active Clamp Flyback Controllers ...,"Silanna Semiconductor's Active Clamp Flyback Controllers Combine Four ACF 
Subsystems · The SZ1101 (33W) and SZ1105 (65W) incorporate four key ACF 
subsystems to ...",2020-1-16,All About Circuits,https://www.allaboutcircuits.com/news/silanna-semiconductors-active-clamp-flyback-controllers-combine-four-acf-subsystems/
semiconductor,GB,TSMC Hires Ex-Intel Lobbyist to Deal With U.S.-China Tensions,"Taiwan Semiconductor Manufacturing Co., a major chipmaker to Apple Inc. and 
Huawei Technologies Co., has recruited rival Intel Corp.'s former top 
lobbyist ...",2020-1-13,Bloomberg.com,https://www.bloomberg.com/news/articles/2020-01-13/tsmc-hires-ex-intel-lobbyist-to-deal-with-u-s-china-tensions
semiconductor,GB,Kioxia takeout gets cool response,"Lenders see Kioxia as a riskier proposition given the sluggish performance 
of the semiconductor industry. Kioxia lifted sales and narrowed losses in 
the ...",2020-1-17,Reuters,https://www.reuters.com/article/kioxia-takeout-gets-cool-response-idUSL4N29M255
semiconductor,GB,Imec shows Scalable III-V and III-N Devices on Silicon - News,"Compound Semiconductor would like to notify you of new and interesting 
articles! Don't Allow. Allow. This website requires JavaScript.",2020-1-10,Compound Semiconductor,https://compoundsemiconductor.net/article/109922/Imec_Shows_Scalable_III-V_And_III-N_Devices_On_Silicon
semiconductor,GB,New LED from Osram enables ultra-slim headlights - News,"Osram Opto Semiconductors has announced the Oslon Boost HM LED for 
ultra-slim headlamp designs in vehicles. In addition to adding features 
such as adaptive ...",2020-1-22,Compound Semiconductor,https://compoundsemiconductor.net/article/110079/New_LED_From_Osram_Enables_Ultra-slim_Headlights
semiconductor,GB,Addressing Risk in the Era of US-China “Great Power ...,"According to a report by C4ADS, CSR Corporation's (now China Railway 
Rolling Stock Corporation, or CRRC) acquisition of UK-based Dynex 
Semiconductor facilitated ...",2020-1-13,China Business Review,https://www.chinabusinessreview.com/addressing-risk-in-the-era-of-us-china-great-power-competition/
semiconductor,GB,"Amtech exits solar, names new CEO","... its Tempress solar business, thus exiting the photovoltaic (PV) segment 
and putting a clear focus on the semiconductor and silicon carbide 
businesses.",2020-1-29,Renewables Now,https://renewablesnow.com/news/amtech-exits-solar-names-new-ceo-685238/
semiconductor,GB,Micron Stock Is Jumping After an Upgrade Tied to 5G Phone Memory Demand,"The chip maker is a leader in the DRAM and NAND semiconductor markets. 
DRAM, or dynamic random-access memory, is used in desktop computers, mobile 
phones ...",2020-1-7,Barron's,https://www.barrons.com/articles/micron-stock-upgrade-5g-phone-memory-demand-dram-nand-chip-51578410015
semiconductor,GB,4 Chip Stocks to Gain From China's Reliance on US Tech,"Semiconductor Stocks at the Forefront. This dependence on prominent U.S. 
chipmakers naturally brings semiconductor stocks to investors' watch list.",2020-1-2,Nasdaq,https://www.nasdaq.com/articles/4-chip-stocks-to-gain-from-chinas-reliance-on-us-tech-2020-01-02
semiconductor,GB,"Big Growth Areas: Connectivity, AI, Reliability - SemiEngineering","“Semiconductor and equipment vendors have been introducing a range of chips 
and equipment for WiFi 6,” says Jo Jones, technology communications manager 
for ...",2020-1-14,Semiconductor Engineering,https://semiengineering.com/big-growth-areas-connectivity-ai-reliability/
semiconductor,GB,Marvell Shows Off ‘The New Marvell’ At Its First Industry Analyst Event,"Few end customers allow semiconductor companies to say they are inside, but 
Marvell disclosed a few, big wins: · Samsung: the company has a 
longstanding and ...",2020-1-21,Forbes,https://www.forbes.com/sites/moorinsights/2020/01/21/marvell-shows-off-the-new-marvell-at-its-first-industry-analyst-event/
semiconductor,GB,ROHM Group Company SiCrystal and STMicroelectronics ...,"ST is a global semiconductor leader delivering intelligent and 
energy-efficient products ... Founded in 1958, ROHM provides LSI and 
discrete semiconductors ...",2020-1-15,GlobeNewswire,https://www.globenewswire.com/news-release/2020/01/15/1971079/0/en/ROHM-Group-Company-SiCrystal-and-STMicroelectronics-Announce-Multi-Year-Silicon-Carbide-Wafer-Supply-Agreement.html
semiconductor,GB,ASML is too convenient a target for the US – Bits&amp;Chips,"ASML shouldn't be singled out as the only semiconductor company to be 
restricted. If the US wants to cut off China, at the very least, ban 
American ...",2020-1-9,Bits-chips,https://bits-chips.nl/artikel/asml-is-too-convenient-a-target-for-the-us/
semiconductor,GB,Why Samsung Plans To Double Down On The $170 Billion ...,"On the other hand, the logic chip and foundry space could enable the 
company to post more stable semiconductor revenues and profits. In this 
analysis, we take a ...",2020-1-17,Trefis,https://www.trefis.com/stock/ssnlf/articles/480598/why-samsung-plans-to-double-down-on-the-170-billion-logic-chip-market/2020-01-17
semiconductor,GB,Apple Boosts Chip Orders From Main Foundry Supplier TSMC,"Data source: Taiwan Semiconductor. Chart by author. Figures shown in New 
Taiwan dollars. The iPhone 11, which is more affordable and has fewer bells 
and ...",2020-1-23,The Motley Fool,https://www.fool.com/investing/2020/01/23/apple-boosts-chip-orders-from-main-foundry-supplie.aspx
semiconductor,GB,ST readies for SiC take-off - News,"Without a doubt, automotive markets are a huge draw for any wide bandgap 
semiconductor player. In the last two to three years, auto-manufacturer 
investments ...",2020-1-14,Compound Semiconductor,https://compoundsemiconductor.net/article/109960/ST_Readies_For_SiC_Take-off
semiconductor,GB,The Great U.S.-China Tech Divide,"China is hastening to make semiconductors and consumer electronics without 
... Semiconductor manufacturers, in particular, have a lot to lose in the 
dust-up ...",2020-1-20,The Wall Street Journal,https://www.wsj.com/articles/the-great-u-s-china-tech-divide-11579542441
semiconductor,GB,Advantest to Showcase Semiconductor Test Solutions for 5G ...,"Leading semiconductor test equipment supplier Advantest Corporation will 
feature its newest test solutions for advanced ICs at SEMICON Korea on 
February 5-7 ...",2020-6-17,AiThority.com,https://aithority.com/internet-of-things/5g-technology/advantest-to-showcase-latest-semiconductor-test-solutions-for-5g-automotive-and-iot-applications-at-semicon-korea-2020/
semiconductor,GB,The Global ASIC Chip Market size is expected to reach $24.7 ...,"Therefore, growth in the semiconductor industry combined with an increase 
in ... Xilinx, Inc., Taiwan Semiconductor Manufacturing Company Limited 
(TSMC), ...",2020-1-15,GlobeNewswire,https://www.globenewswire.com/news-release/2020/01/15/1970691/0/en/The-Global-ASIC-Chip-Market-size-is-expected-to-reach-24-7-billion-by-2025-rising-at-a-market-growth-of-8-2-CAGR-during-the-forecast-period.html
semiconductor,GB,Stable lithium could lead to new class of neutron detectors,"“People have imagined semiconductor neutron detectors for a long time,” 
said ... “Or you can find stable lithium compounds that are not good 
semiconductors.",2020-1-17,The Engineer,https://www.theengineer.co.uk/lithium-neutron-detectors/
semiconductor,GB,Nowi Energy Harvesting Technology Enables ...,"LAS VEGAS--(BUSINESS WIRE)--Dutch semiconductor firm Nowi and Swiss 
smartwatch module company MMT (Manufacture Modules Technologies SA) 
announce commercial ...",2020-1-6,Business Wire,https://www.businesswire.com/news/home/20200106005110/en/Nowi-Energy-Harvesting-Technology-Enables-Groundbreaking-Hybrid-Smart-Watch-Module-for-MMT
semiconductor,GB,Chicken Droppings Can Make Graphene More Catalytic,"AerospaceArtificial IntelligenceBiomedicalComputingConsumer 
ElectronicsEnergyHistory of 
TechnologyRoboticsSemiconductorsSensorsTelecommunications ...",2020-1-27,IEEE Spectrum,https://spectrum.ieee.org/graphene-doping-catalyst-materials-research-news
semiconductor,GB,Patterned sapphire silica substrate for ultraviolet light-emitting ...,"Semiconductor Today Logo ... Mike Cooke is a freelance technology 
journalist who has worked in the semiconductor and advanced technology 
sectors since 1997.",2020-1-30,Semiconductor Today,http://www.semiconductor-today.com/news_items/2020/jan/wuhan-300120.shtml
semiconductor,GB,Chip Market Rebounds in 2020 as Economic Woes Linger,"The global semiconductor market is expected to rebound this year by as much 
as 7.9 percent, but the ghosts of 2019 haven't vanished.",2020-1-29,EPS NEWS,https://epsnews.com/2020/01/29/chip-market-rebounds-in-2020-as-economic-woes-linger/
semiconductor,GB,CyberOptics Introduces New In-Line Particle Sensor™ (IPS ...,"Process and equipment engineers in semiconductor fabs can speed equipment 
qualification with real-time, 24-7 monitoring, compare past and present 
data, as well ...",2020-1-30,Business Wire,https://www.businesswire.com/news/home/20200130005090/en/CyberOptics-Introduces-New-In-Line-Particle-Sensor%E2%84%A2-IPS%E2%84%A2-as-an-Extension-of-the-Industry-Leading-Particle-Sensing-Technology-at-SPIE
semiconductor,GB,Election Security At The Chip Level,"The obvious comparison for voting machines would be ATM machines, but not 
necessarily, argue a number of experts interviewed by Semiconductor 
Engineering.",2020-1-2,Semiconductor Engineering,https://semiengineering.com/how-secure-are-electronic-voting-machines/
semiconductor,GB,Schilling Engineering reveals contract win with Plansee,"Components for semiconductor production are manufactured in the 400 sqm 
CleanCell4.0 of ISO Class 6. A new 400 sqm ISO Class 6 cleanroom has 
started ...",2020-1-15,Cleanroom Technology,https://cleanroomtechnology.com/news/article_page/Schilling_Engineering_reveals_contract_win_with_Plansee/161408
semiconductor,GB,AI Chip Market Is Booming,"AI processors are reinvigorating the global semiconductor industry, 
prompting at least one market tracker to predict a three-fold increase in 
AI chip ...",2020-1-31,HPCwire,https://www.hpcwire.com/2020/01/31/ai-chip-market-is-booming/
semiconductor,GB,Is Himax Technologies Stock a Buy?,"Himax Technologies (NASDAQ:HIMX) is a fabless semiconductor solutions 
provider. The company is a worldwide market leader in display driver ICs 
(integrated ...",2020-1-6,The Motley Fool,https://www.fool.com/investing/2020/01/06/is-himax-technologies-stock-a-buy.aspx
semiconductor,GB,Synthetic Biology Market is Expected to Reach $19.58 Billion ...,"Semiconductor sequencing is a type of next generation sequencing that 
enables reading DNA sequences electronically. For example, in 2014, DNA 
Electronics Ltd ( ...",2020-1-3,PR Newswire,https://www.prnewswire.com/news-releases/synthetic-biology-market-is-expected-to-reach-19-58-billion-by-2022--300980778.html
semiconductor,GB,Silicon Mobility Names Rainer Kallenbach as CEO,"... utilizing its OLEA Field Programmable Control Unit semiconductors, ... 
an automotive semiconductor control solution with the potential of 
extending up ...",2020-1-14,Business Wire,https://www.businesswire.com/news/home/20200113005288/en/Silicon-Mobility-Names-Rainer-Kallenbach-as-CEO
semiconductor,GB,"The next iPhone will have an advanced camera that can scan 3-D objects, 
Barclays says","Barclays semiconductor analysts said on Thursday that Apple's new iPhones 
will have a new FaceID sensor, which is used for facial recognition.",2020-1-16,CNBC,https://www.cnbc.com/2020/01/16/new-iphones-will-have-refreshed-face-id-and-3d-camera-barclays.html
semiconductor,GB,"After Dropping In 2019, Can Texas Instruments’ Revenue Cross $15 Billion By 
2021?","Texas Instruments' Analog Semiconductors division, which sells analog ... 
This segment includes revenue from TI's smaller semiconductor product lines 
and ...",2020-1-28,Forbes,https://www.forbes.com/sites/greatspeculations/2020/01/28/after-dropping-in-2019-can-texas-instruments-revenue-cross-15-billion-by-2021/
semiconductor,GB,Samsung Pioneers 5G-Based Mobility with Launch of Digital ...,"... semiconductors and displays with HARMAN's automotive expertise. ... a 
semiconductor for vehicle electronics, and Android 10, which allow for 
several ...",2020-1-11,Samsung Global Newsroom,https://news.samsung.com/za/samsung-pioneers-5g-based-mobility-with-launch-of-digital-cockpit-2020
semiconductor,GB,Samsung Electronics Announces Fourth Quarter and FY 2019 ...,"The Semiconductor businesses posted KRW 16.79 trillion in consolidated 
revenue and KRW 3.45 trillion in operating profit in the fourth quarter. 
The Memory ...",2020-1-30,Samsung Newsroom,https://news.samsung.com/global/samsung-electronics-announces-fourth-quarter-and-fy-2019-results
semiconductor,GB,Intel delivers a strong Q4 in spite of challenges,"The semiconductor giant continues to face production challenges and renewed 
competition, but it fared better than expected in 2019 and foresees a 
strong ...",2020-1-23,ZDNet,https://www.zdnet.com/article/intel-delivers-a-strong-q4-in-spite-of-challenges/
semiconductor,GB,Making 3D Structures And Packages More Reliable,"“Non-contact and non-destructive optical imaging always has been very 
important for inspection of semiconductor processes. However, with many 
advanced ...",2020-1-14,Semiconductor Engineering,https://semiengineering.com/making-3d-structures-and-packages-more-reliable/
semiconductor,GB,Inside Samsung's 5G Factory for AT&amp;T,"""Semiconductor facilities are inherently complex and automated,"" said Derek 
Johnston, head of marketing at Samsung Networks. He described the 
company's ...",2020-1-30,Light Reading,https://www.lightreading.com/private-networks/inside-samsungs-5g-factory-for-atandt/d/d-id/757178
semiconductor,GB,Report: Global IoT chip market likely to grow to $38.61 billion ...,"Gartner's report from July had already predicted a worldwide decline in 
semiconductor revenue in 2019 – albeit the forecast figure was at 9.6% from 
2018.",2020-1-16,IoT Tech News,https://iottechnews.com/news/2020/jan/16/report-global-iot-chip-market-likely-grow-3861-billion-end-decade/
semiconductor,GB,Broadcom Wins Contracts to Supply Wireless Components to ...,"Semiconductor analyst Harlan Sur estimated that Apple would buy about $10 
worth of Broadcom parts per iPhone in 2018. Broadcom sells Bluetooth and 
WiFi chips ...",2020-1-25,Electronic Design,https://www.electronicdesign.com/technologies/analog/article/21121362/broadcom-wins-contracts-to-supply-wireless-components-to-apple
semiconductor,GB,"Singapore beat expectations, attracted $15.2b of investments ...","This was driven by large manufacturing investments from semiconductor as 
well as energy and chemical companies, the Economic Development Board (EDB) 
shared ...",2020-1-16,The Straits Times,https://www.straitstimes.com/business/economy/singapore-beats-expectations-attracts-152b-of-investments-in-2019
semiconductor,GB,Nitride Semi Wins Patent Lawsuit against RayVio - News,"Nitride Semiconductor, a Japanese UV-LED firm, has won a patent 
infringement lawsuit against RayVio Corporation, a California UV-LED 
company.",2020-1-27,Compound Semiconductor,https://compoundsemiconductor.net/article/110096/Nitride_Semi_Wins_Patent_Lawsuit_Against_RayVio%7BfeatureExtra%7D
semiconductor,GB,TSMC Posts Record 2019 on Bigger Demand for Chips,"Taiwan Semiconductor Manufacturing Company (TSMC) (NYSE:TSM 115.7 -0.25%) 
reported a 15% increase in monthly revenues between November and December 
2019 and ...",2020-1-11,Wccftech,https://wccftech.com/tsmc-posts-record-2019-on-bigger-demand-for-chips/
semiconductor,GB,Worst is over for KESM — CEO,"Commenting on prospects for the automotive semiconductor industry, he said 
much depends on how fast the growth of change, in particular the 5G 
network, ...",2020-1-9,The Edge Markets,https://www.theedgemarkets.com/article/worst-over-kesm-%E2%80%94-ceo
semiconductor,GB,Renesas' Power Management IC Adopted in Google Coral AI ...,"Renesas Electronics Corporation, a premier supplier of advanced 
semiconductor solutions, announced its ISL91301B Power Management IC (PMIC) 
is designed into ...",2020-1-13,EE Times Asia,https://www.eetasia.com/renesas-power-management-ic-adopted-in-google-coral-ai-products/
semiconductor,GB,"Moore's Law, Supply Chains And Security","“As more semiconductor companies look for alternatives to Moore's Law 
scaling and begin to fully realize the benefits of modern-day 
multi-chip/chiplet packaging ...",2020-1-16,Semiconductor Engineering,https://semiengineering.com/moores-law-supply-chains-and-security/
semiconductor,GB,Want to invest in electric vehicles? Start with their parts,"When it comes to EV investing, there are pure plays like electric-vehicle 
maker Tesla (TSLA). But there are also opportunities to invest in 
semiconductor makers ...",2020-1-6,USA Today,https://www.usatoday.com/story/money/2020/01/06/electric-cars-race-heres-how-start-investing-evs/2803607001/
semiconductor,GB,Samsung Electronics now No. 2 in chip sales,"1 semiconductor maker, with Intel taking the lead in 2019. The change in 
the rankings is largely due to the downturn in the memory market.",2020-1-15,Korea JoongAng Daily,https://koreajoongangdaily.joins.com/2020/01/15/industry/Samsung-Electronics-now-No-2-in-chip-sales/3072693.html
semiconductor,GB,Inside Samsung's Silicon Valley Office - Samsung US ...,"Media Contact. Strategy &amp; Innovation Center and Samsung Catalyst Fund. 
ssic.communications@ssi.samsung.com. Semiconductors, Display Panels and LED 
Solutions.",2020-1-21,Samsung Newsroom,https://news.samsung.com/us/inside-samsung-silicon-valley-office/
semiconductor,GB,RoboSense announces world's first test of vehicle equipped ...,"Wade Appelman, Vice President of ISG, SensL Division, ON Semiconductor, 
said, “The combo of RoboSense LiDAR with the ON Semiconductor RD Series 
SiPM family ...",2020-1-8,Geospatial World,https://www.geospatialworld.net/news/robosense-smart-lidar-sensor/
semiconductor,GB,Top Tech Trends To Watch In 2020,"Two new semiconductor technologies are driving change in the electric 
vehicle battery market. Historically, EV batteries have been costly, large 
and ...",2020-1-23,Forbes,https://www.forbes.com/sites/mergermarket/2020/01/23/top-tech-trends-to-watch-in-2020/
semiconductor,GB,"Virtual Reality (VR) in the Global Power Sector, 2019 and ...","Semiconductor; Components; Headsets; Platforms; Applications and content. 
COMPANIES POWER COMPANIES GLOSSARY Companies Mentioned.",2020-1-13,PR Newswire,https://www.prnewswire.com/news-releases/virtual-reality-vr-in-the-global-power-sector-2019-and-beyond---semiconductors-components-headsets-platforms-applications--content-300985775.html
semiconductor,GB,Assuring Taiwan's Innovation Future,"All semiconductor firms at the time were vertically integrated, with both 
chip design and manufacturing conducted in-house. The foundry model proved 
to be a ...",2020-1-29,Carnegie Endowment for International Peace,https://carnegieendowment.org/2020/01/29/assuring-taiwan-s-innovation-future-pub-80920
semiconductor,GB,"How Important Is Cost Of Sales To Micron’s Expenses And Overall 
Profitability?","Research &amp; Development (R&amp;D) Expenses increased from $1.82 billion in 2017 
to about $2.44 billion in 2019 due to continuous spending on advanced 
semiconductor ...",2020-1-7,Forbes,https://www.forbes.com/sites/greatspeculations/2020/01/07/how-important-is-cost-of-sales-to-microns-expenses-and-overall-profitability/
semiconductor,GB,Nano-silicon samurai: Surface engineered sponges to clean ...,"In addition to being an important element in living organisms, silicon is 
by far the most widely used of all semiconductor materials.",2020-1-10,Advanced Science News,https://www.advancedsciencenews.com/nano-silicon-samurai-surface-engineered-sponges-to-clean-up-oil/
semiconductor,GB,Shin-Etsu licenses Qromis' GaN substrate technology,"... as silicon-on-insulator (SOI) wafers and GaN-on-silicon wafers besides 
its usual line of silicon wafers for power and high-frequency 
semiconductors.",2020-1-23,Semiconductor Today,http://www.semiconductor-today.com/news_items/2020/jan/shinetsu-230120.shtml
semiconductor,GB,Kneron raises $40 million to grow edge AI chip design operations,"The funding will be used to grow algorithms made specifically for on-device 
machine learning and semiconductor design operations. Kneron released the 
KL520, ...",2020-1-23,VentureBeat,https://venturebeat.com/2020/01/23/kneron-raises-40-million-to-grow-edge-ai-chip-design-operations/
semiconductor,GB,China is slowly moving up the microprocessing value chain,"Selling equipment to industry giants like Applied Materials in America 
makes it a small success for the semiconductor supply chain. Much of the 
rest of the ...",2020-1-2,The Economist,https://www.economist.com/technology-quarterly/2020/01/02/china-is-slowly-moving-up-the-microprocessing-value-chain
semiconductor,GB,The Houston Astros cheating scandal shows how tech is upending baseball,"The semiconductor industry has an upbeat outlook for 2020, even after 
revenue shrunk last year, according to a KPMG survey of executives in the 
industry.",2020-1-16,Fortune,https://fortune.com/2020/01/16/the-houston-astros-cheating-scandal-shows-how-tech-is-upending-baseball/
semiconductor,GB,China Only Region to Register Pure-Play Foundry Market ...,"Among the semiconductor industry data included in the new 400+ page report 
is an in-depth analysis of the IC foundry market and its suppliers.",2020-1-9,Design And Reuse,https://www.design-reuse.com/news/47354/china-pure-play-foundry-market-growth-in-2019.html
semiconductor,GB,Japan logs trade deficit for second year amid weak demand ...,"Overall shipments of semiconductor-making equipment rose 25.8 percent, much 
better than the average double-digit declines of April-September.",2020-1-23,The Japan Times,https://www.japantimes.co.jp/news/2020/01/23/business/japan-trade-deficit-second-year-china/
semiconductor,GB,Broadcom strikes $15 billion deal with Apple to sell it iPhone parts,"Stick with semiconductors, says Oppenheimer's Ari Wald. Trading Nation. 
Broadcom is currently looking to sell a wireless chip division focusing 
on ...",2020-1-23,CNBC,https://www.cnbc.com/2020/01/23/broadcom-will-sell-apple-wireless-parts-for-three-years-as-5g-launches.html
semiconductor,GB,"Dow jumps 300 points to start 2020, continuing last year's big rally","Semiconductor stocks are coming off a strong performance in 2019. The 
VanEck Vectors Semiconductor ETF (SMH) surged 62% in 2019, its best 
one-year ...",2020-1-2,CNBC,https://www.cnbc.com/2020/01/02/dow-futures-point-to-a-higher-open.html
