query,region,title,excerpt,date,source,link
semiconductor,united+states,"China is buying up chip firms in a push for semiconductor supremacy, says 
UK lawmaker","Former Work and Pensions Secretary Iain Duncan Smith gives a speech at the 'Vote Leave' campaign headquarters on May 10, 2016 in London, England.
LONDON — A U.K. lawmaker believes China is using questionable methods to ensure it becomes a world leader in semiconductor technology.
China is ""busy stealing technology, getting other people's intellectual property rights, and buying up companies,"" Duncan Smith said.
""Some politicians have never produced any evidence for their repeated allegations about China's 'theft of intellectual property,"" Pengyu said in a statement share with CNBC.
Earlier this year, China imposed sanctions on a number of British organizations and individuals, including Duncan Smith who is a vocal critic of China",2021-08-26,CNBC,https://www.cnbc.com/2021/07/16/chinas-bid-for-newport-wafer-fab-condemned-by-mp-iain-duncan-smith.html
semiconductor,united+states,Biden Calls for $50 Billion to Boost U.S. Chip Industry,"Officials cite need to counter threat from China, but opponents say 
industry can succeed without tax dollars. President Biden, here with a 
semiconductor chip in ",2021-3-31,Wall Street Journal,https://www.wsj.com/articles/biden-urges-50-billion-to-boost-chip-manufacturing-in-u-s-11617211570
semiconductor,united+states,TSMC says 2021 output of key auto chip component up 60% vs last year,"TAIPEI (Reuters) - Taiwan Semiconductor Manufacturing Co Ltd (TSMC) said on Friday that it has increased its 2021 output for a key component for automotive semiconductors by 60% compared with last year, amid a global chip shortage.
FILE PHOTO: A logo of Taiwan Semiconductor Manufacturing Co (TSMC) is seen at its headquarters in Hsinchu, Taiwan August 31, 2018.
“With a fixed short-term capacity, TSMC managed to increase 2021 output for MCUs (microcontrollers), one of the key components in automotive semiconductor products, by 60% over the 2020 level,” it said.
The global chip shortage, which started last year, has shuttered some auto production lines and is impacting consumer electronics as well.
U.S. Commerce Secretary Gina Raimondo said Thursday she held meetings with three dozen senior industry leaders on a semiconductor chip shortage and said the United States could help boost transparency in the market",2021-5-20,Reuters,https://www.reuters.com/article/us-tsmc-semiconductors-idUSKCN2D20A0
semiconductor,united+states,"GM hit by chip shortage, to cut production at four plants","DETROIT (Reuters) - General Motors Co became the latest automaker hit by the global shortage of semiconductor chips as the U.S. automaker said on Wednesday it will take down production next week at four assembly plants.
“Despite our mitigation efforts, the semiconductor shortage will impact GM production in 2021,” GM spokesman David Barnas told Reuters in a statement.
The chip shortage has led several automakers, including Volkswagen AG, Ford Motor Co, Subaru Corp, Toyota Motor Corp, Nissan Motor Co and Stellantis NV, to cut vehicle production.
The chip shortage is expected to cause production in the global auto sector to be 672,000 vehicles lower than anticipated in the first quarter, IHS Markit said on Wednesday.
On Tuesday, 15 U.S. senators, including some from key automotive states like Michigan, Ohio, Tennessee, Illinois, Indiana and South Carolina, urged the White House to work with Congress to address the chip shortage",2021-2-3,Reuters,https://www.reuters.com/article/us-gm-semiconductors-exclusive-idUSKBN2A32LL
semiconductor,united+states,"Intel's build-in-America emphasis is about more than profits — it's also 
about national security","Beijing’s communist masters have long viewed Taiwan as part of China, and have vowed for years to seize it—by force if necessary.
National security concernsIntel’s announcement that it would continue to make chips in the U.S. apparently wasn’t made with these geostrategic fears in mind.
Yet long-term fiduciary responsibility to shareholders—not to mention U.S. national security and patriotism—are damn good reasons to do so.
But this could soon change, thanks to a U.S. government program designed to boost semiconductor manufacturing on American soil.
U.S. makes few chipsAmericans might not realize how much the United States has ceded control of the world’s semiconductor manufacturing to others",2021-1-28,MarketWatch,https://www.marketwatch.com/story/intels-build-in-america-emphasis-is-about-more-than-profits-its-also-about-national-security-11611790350
semiconductor,united+states,"Intel Plans A $20bn Fab Factory In Europe As EU Aims To Produce 20% Of 
World’s Semiconductors by 2030","As of August 26th, 2021 Yahoo India will no longer be publishing content.
Your Yahoo Account Mail and Search experiences will not be affected in any way and will operate as usual.
We thank you for your support and readership.
For more information on Yahoo India, please visit the FAQ",2021-08-26,Yahoo News India,https://in.news.yahoo.com/intel-plans-20bn-fab-factory-051742143.html
semiconductor,united+states,Supply chains critical to Taiwan's security,"That has made the United States worried about what would happen if Taiwan were to fall under Chinese control.
Given how US companies and the US military depend on TSMC, it is natural for the United States to worry about the security of its microelectronics supply chains.
Geoeconomic trends will enhance deterrence by raising the likelihood of US intervention in Taiwan’s defence without introducing the risks associated with strategic clarity.
Geoeconomic trends do not require the United States to adopt a new Taiwan policy.
There is no need for the United States to announce a new strategic posture or a new position on Taiwan’s political status",2021-3-10,East Asia Forum,https://www.eastasiaforum.org/2021/03/10/geoeconomics-and-the-security-of-taiwan/
semiconductor,united+states,Press Release | Press Releases | Newsroom | US Senator ...,"9906, including the National Semiconductor Technology Center (NSTC), National Advanced Packaging Manufacturing Program, and other R&D programs authorized in Sec.
Technology hubs would carry out workforce development activities, business and entrepreneur development activities, technology maturation activities, and infrastructure activities related to the technology development.
Innovation and Competition Act would be catalytic in growing the high-tech economy at the Western New York Science & Technology Advanced Manufacturing Park (STAMP) and all across upstate New York.""
“The Council of Industry thanks Senator Schumer for his tireless leadership in securing passage of the bipartisan U.S. Competition and Innovation Act.
We thank Senator Schumer for championing the bipartisan U.S. Competition and Innovation Act, which will be a vital investment in our already growing science and technology field",2021-6-9,Senator Schumer,https://www.schumer.senate.gov/newsroom/press-releases/schumer-announces-senate-passage-of-us-innovation-and-competition-act-250-billion-bipartisan-bill-will-be-blueprint-to-make-ny-global-tech-and-semiconductor-hub-schumers-bill-includes-52b-for-us-semiconductor-industry_10b-for-regional-tech-hubs-to-create-jobs-in-upstate-ny--put-ny-on-the-frontlines-of-the-greatest-race-of-the-century
semiconductor,united+states,Readout of White House CEO Summit on Semiconductor and ...,"The semiconductor shortage, which is impacting American workers and families right now, is a top and immediate priority for the President and his senior most advisors on economic and national security.
The White House heard directly from industry leaders on the impact of the chip shortage and discussed short and long-term approaches to address it.
Participants emphasized the importance of improving transparency in the semiconductor supply chain to help mitigate current shortages and improving demand forecasting across the supply chain to help mitigate future challenges.
They also discussed the importance of encouraging additional semiconductor manufacturing capacity in the United States to make sure we never again face shortages.
Finally, they discussed how the President’s infrastructure investments in the American Jobs Plan strengthen America’s competitiveness and national security by building the infrastructure of tomorrow and strengthening supply chain resilience — ensuring that the United States remains a global leader in critical technologies and the transition to a clean energy future",2021-4-12,The White House,https://www.whitehouse.gov/briefing-room/statements-releases/2021/04/12/readout-of-white-house-ceo-summit-on-semiconductor-and-supply-chain-resilience/
semiconductor,united+states,Samsung's Semiconductor Sites Awarded Industry's First ...,"All of Samsung’s global semiconductor manufacturing facilities certified for reducing carbon emissions, water use and waste dischargeSamsung Electronics, a world leader in advanced semiconductor technology, today announced that it received the industry’s first Triple Standard for carbon, water and waste by Carbon Trust.
This is a huge feat, considering that it is extremely challenging for semiconductor manufacturing companies to meet all three qualifications at once.
“For decades, Samsung has been striving to incorporate environmental sustainability into every aspect of the semiconductor manufacturing process,” said Seong-dai Jang, senior vice president and head of DS Corporate Sustainability Management Office at Samsung Electronics.
The company has also reduced water usage utilizing its wastewater filtration technology—known as the ‘membrane process’ —to reuse water and optimize manufacturing processes.
Through all these efforts, Samsung reduced a total of 35,752 tons6 of waste discharged in 2020",2021-6-3,Samsung Newsroom,https://news.samsung.com/global/samsungs-semiconductor-sites-awarded-industrys-first-triple-standard-by-carbon-trust
semiconductor,united+states,Commentary: Taiwan's national security depends on a highly ...,"SAN DIEGO, California: Tensions are rising in the Taiwan Strait.
The United States needs a viable long-term strategy for keeping the peace in the Taiwan Strait.
One company, the Taiwan Semiconductor Manufacturing Company (TSMC), holds 50 per cent of the world market share in contract chip-making.
That has made the United States worried about what would happen if Taiwan were to fall under Chinese control.
Given how US companies and the US military depend on TSMC, it is natural for the United States to worry about the security of its microelectronics supply chains",2021-3-11,CNA,https://www.channelnewsasia.com/commentary/taiwan-china-us-semiconductor-chip-trade-war-defence-security-318161
semiconductor,united+states,Rare Earth Metals at the Heart of China's Rivalry with US ...,"In 2019, the United States imported 80 percent of its rare earth minerals 
from China, the U.S. ... Post-pandemic and in the midst of a semiconductor 
crisis, ",2021-6-14,IndustryWeek,https://www.industryweek.com/supply-chain/article/21166849/rare-earth-metals-at-the-heart-of-chinas-rivalry-with-us-europe
semiconductor,united+states,The Missing Chips,"During the COVID-19 pandemic, demand for semiconductor chips, a key component of all electronics, skyrocketed as many jobs and crucial services moved online and workers upgraded their home offices.
Long the obscure concern of experts in the technology sector, semiconductor supply chains have now been thrust into the spotlight.
Modern semiconductor manufacturing is a fragmented process, and even the chips developed by U.S. companies are often not made in the United States.
Making matters worse, Chinese buyers, fearful of the ever-tightening U.S. export controls, hoarded chips, thus contributing to the global shortage.
In fact, Japan developed one in the 1970s, as did South Korea, Taiwan, and the United States shortly thereafter",2021-08-26,Foreign Affairs,https://www.foreignaffairs.com/articles/2021-07-06/missing-chips
semiconductor,united+states,Biden administration sounds the alarm on the semiconductor crisis,"States are running out of ICU beds.
See where COVID cases are rising the fastest",2021-08-26,Fortune,https://fortune.com/2021/07/16/biden-administration-sounds-the-alarm-on-the-semiconductor-crisis/
semiconductor,united+states,US Senate Majority Leader Charles E. Schumer to Speak,"Akoustis plans to service the fast growing multi-billion-dollar RF filter market using its integrated device manufacturer (IDM) business model.
Forward-looking statements are neither historical facts nor assurances of future results, performance, events or circumstances.
Instead, these forward-looking statements are based on management’s current beliefs, expectations and assumptions and are subject to risks and uncertainties.
Considering these risks, uncertainties and assumptions, the forward-looking statements regarding future events and circumstances discussed in this document may not occur, and actual results could differ materially and adversely from those anticipated or implied in the forward-looking statements.
You should not rely upon forward-looking statements as predictions of future events",2021-6-2,GlobeNewswire,https://www.globenewswire.com/news-release/2021/06/02/2240741/0/en/U-S-Senate-Majority-Leader-Charles-E-Schumer-to-Speak-Today-at-Akoustis-Technologies-Semiconductor-Wafer-Fab-in-Upstate-New-York.html
semiconductor,united+states,Taiwan tech firms fear fallout after US raises supply chain alarm,"""Even a minor conflict or embargo could have immediate major disruptions to the United States and long-term implications for U.S. supply chain resilience,"" it said.
Some see the report as a sign that the pendulum is swinging toward more government involvement in tech manufacturing.
""In the past several decades, the U.S. government took a hands-off approach to the market, which partly resulted in the flow of tech manufacturing to the East,"" one supply chain executive said.
The report said the U.S. will need to make a ""whole-of-country"" effort to strengthen its manufacturing ecosystem and build a secure and resilient semiconductor supply chain.
The Biden administration said it will also support domestic production of critical medicines, another area covered in the supply chain report",2021-6-15,Nikkei Asia,https://asia.nikkei.com/Business/Tech/Semiconductors/Taiwan-tech-firms-fear-fallout-after-US-raises-supply-chain-alarm
semiconductor,united+states,Intel seeks $10 bln in subsidies for European chip plant,"An Intel Tiger Lake chip is displayed at an Intel news conference during the 2020 CES in Las Vegas, Nevada, U.S. January 6, 2020.
Politico cited Gelsinger saying that he was seeking roughly 8 billion euros in subsidies.
Gelsinger, on his first European tour since taking charge, met European Commissioner Thierry Breton in Brussels on Friday.
The visit followed the launch of a plan for Intel to invest $20 billion in chip production in the United States.
Breton's drive to attract a major foreign chipmaker has unnerved home-grown players, and he is also discussing the creation of a European semiconductor alliance that would bundle their interests",2021-4-30,Reuters,https://www.reuters.com/technology/intel-seeks-8-bln-euros-subsidies-european-chip-plant-politico-2021-04-30/
semiconductor,united+states,"U.S. trade war pushing China to steal tech, talent, Taiwan says","TAIPEI (Reuters) - The China-U.S. trade war is pushing Beijing to step up its efforts to steal technology and poach talent from Taiwan to boost China’s semiconductor industry’s self-sufficiency, the government of the tech-powerhouse island said on Wednesday.
Chinese-claimed Taiwan is home to a thriving and world-leading chip industry, and the government has long worried about China’s efforts to copy that success, through fair means or foul.
“Affected by the U.S.-China technology war, the development of mainland China’s semiconductor industry has been obstructed, but they are still committed to the industry’s development,” she said.
China’s Taiwan Affairs Office did not immediately respond to a request for comment.
Hu Mu-yuan, deputy head of Taiwan’s National Security Bureau, said China’s efforts were a threat to not just Taiwan, but also Japan and South Korea, threatening global trade and fair competition",2021-3-30,Reuters,https://www.reuters.com/article/us-taiwan-china-tech-idUSKBN2BN0II
semiconductor,united+states,How the world ran out of semiconductors,"Even highly experienced tech companies such as Nvidia and Microsoft are struggling to provide a steady stock of graphics cards and Xboxes respectively.
The concentration problemWhile it is easy to blame the COVID-19 pandemic for this situation, the truth is that the global semiconductor supply chain had this coming for some time.
As much as 70% of the world’s semiconductors are manufactured by just two companies, Taiwan Semiconductor (TSMC) and Samsung.
At the same time, President Trump’s trade war with China led to new rules that made it harder for Chinese companies to source semiconductors from TSMC and Samsung.
This increased the demand for the graphics processing units that are traditionally used in mining the digital currency, exacerbating the semiconductor supply issues further",2021-3-5,The Conversation,https://theconversation.com/how-the-world-ran-out-of-semiconductors-156532
semiconductor,united+states,The Semiconductor Industry’s Competitive Dilemma,"Therefore, the US government's only options to support US-based 
semiconductor manufacturing are Intel and Global Foundries. Intel has a new 
CEO in Pat Gelsinger ",2021-3-4,Forbes,https://www.forbes.com/sites/timbajarin/2021/03/04/the-semiconductor-industrys-competitive-dilemma/
semiconductor,united+states,The U.S. Innovation and Competition Act: Senate Passes ...,"Select Your Edition and Language PreferenceThis website uses cookies.
Analytical cookies help us improve our website by providing insight on how visitors interact with our site, and necessary cookies which the website needs to function properly.
Necessary CookiesThe website cannot function properly without these necessary cookies, and they can only be disabled by changing your browser preferences.
To learn more about these cookies, how we use them on our website, and how to revise your cookie settings, please view our cookie policy",2021-6-16,Sidley Austin LLP,https://www.sidley.com/en/insights/newsupdates/2021/06/an-overview-of-the-united-states-innovation-and-competition-act
semiconductor,united+states,U.S. Takes Strategic Step to Onshore Electronics Manufacturing,"IEEE websites place cookies on your device to give you the best user experience.
By using our websites, you agree to the placement of these cookies.
To learn more, read our Privacy Policy",2021-1-6,IEEE Spectrum,https://spectrum.ieee.org/us-takes-strategic-step-to-onshore-electronics-manufacturing
semiconductor,united+states,Intel's CEO Says They Don't Need Subsidies; the Government ...,,2021-3-26,Cato Institute,https://www.cato.org/blog/intels-ceo-says-they-dont-need-subsidies-government-should-take-him-word
semiconductor,united+states,What the U.S. Is Doing About Semiconductor Shortages ...,"Global semiconductor supply chain woes have been dragging on for months as demand for these chips continues to exceed what the domestic manufacturing sector can deliver.
China is another factor in the semiconductor supply crunch in the United States, particularly in the chip equipment market.
As is the case across many industries, China competes with the United States in semiconductor manufacturing.
Still, China’s semiconductor manufacturing capacity increased by 50 percent from 2015 to 2019, compared to a decline of approximately 15 percent in North American manufacturing capacity during that same time.
In June, Intel Corp. CEO Pat Gelsinger told Bloomberg: “I don’t expect the chip industry is back to a health supply-demand situation until ’23",2021-08-26,Built In,https://builtin.com/operations/semiconductor-shortage
semiconductor,united+states,U.S. Attempting to Ban Exports of Semiconductor ...,,2021-4-13,Business Korea,http://www.businesskorea.co.kr/news/articleView.html?idxno=64606
semiconductor,united+states,Biden orders 100-day review of US supply chains for ...,"According to one key White House official, the Biden administration is ""going to get out of the business of reacting to supply chain crises as they arise and get into the business of preventing future supply chain problems"".
Recent news reports indicate that the Biden administration intends to let the ICTS review process take effect on 22 March 2021, alongside the new Biden supply chain EO review.
100-day reviews for semiconductors, batteries, critical minerals and APIsEach of the initial four key product sectors (ie, semiconductors, large capacity batteries, critical minerals and APIs) will undergo 100-day reviews to assess vulnerabilities, strengths and improvement areas.
One-year reviews for energy, transport and agricultureThe six industrial sectors listed above (ie, the defence industrial base, the public health and biological preparedness base, the ICT industrial base (currently under review by the Department of Commerce), the energy sector base, the transport industrial base and the agricultural commodities and food production base) will undergo a separate year-long review.
Critical mineralsThe EO mandates close evaluation of critical minerals supply chains and reinvigorates efforts to respond to vulnerabilities in current global supply chains, initially highlighted by the Trump administration",2021-3-5,Lexology,https://www.lexology.com/commentary/international-trade/usa/arent-fox-llp/biden-orders-100-day-review-of-us-supply-chains-for-semiconductors-batteries-critical-minerals-and-apis
semiconductor,united+states,Why US-China Rivalry Might Be Good for Singapore's ...,"It’s about diversifying global supply chains as geopolitical competition between the U.S. and China heats up.
As Caulfield notes, Taiwan has dominated semiconductor manufacturing for quite a while, with companies like TSCM being the main suppliers for Apple and other huge global brands.
Chartered Semiconductor was meant to help turn Singapore into a global manufacturing hub for semiconductors and computer components and for a while things were going pretty well.
It was a shrewd time to exit, as the electronic and computer component manufacturing industry in Singapore remained moribund for several more years.
I expect we will see more reshuffling of global supply chains like this in the future where countries like Singapore with the right infrastructure, regulatory architecture, and other factor endowments will stand to benefit significantly",2021-08-26,The Diplomat,https://thediplomat.com/2021/07/why-us-china-rivalry-might-be-good-for-singapores-semiconductor-industry/
semiconductor,united+states,Arizona is 'building back better' by reshoring critical technology | TheHill,"That has been the dire situation of the automobile and electronics industries, which have been scrambling for semiconductor chips that power their products since mid-January of this year.
Intel CEO Pat Gelsinger noted Asia supplies 80 percent of the world’s semiconductor chips.
Starting with Apple’s data center in 2015, several technology companies have chosen locations outside of California in favor of Arizona.
In the 90’s America was a leader in chip manufacturing with over 37 percent of chips manufactured in the world being manufactured in the U.S.
In a decade's time, as America builds back better through states like Arizona, it could finally become great again",2021-6-21,TheHill,https://thehill.com/opinion/technology/559389-arizona-is-building-back-better-by-reshoring-critical-technology
semiconductor,united+states,The US Needs to Get Back in the Business of Making Chips,"Only 12 percent of chips sold worldwide were made in the US in 2019, down from 37 percent in 1990.
US companies were world leaders in designing cutting-edge chips, the most valuable and important part of the process.
“There is not a single entrepreneur here, or large company, who can do what they do without semiconductors,” Raimondo said.
A new crop of so-called fabless semiconductor companies emerged, including Qualcomm, Broadcom, and Nvidia, which designed chips but did not produce them.
At the same time, companies known as foundries arose to specialize in making chips",2021-08-26,WIRED,https://www.wired.com/story/us-needs-back-business-making-chips/
semiconductor,united+states,"‘Chip Wars’: US, China and the battle for semiconductor supremacy","“The chip industry can no longer do business like they could in the past when nations were ‘open’ to one another.
While closing the semiconductor technology gap is one of Beijing’s top priorities, significant obstacles remain.
Chinese chip manufacturers received $50 billion in subsidies over the past two decades, attached with preferential loans and procurement incentives.
China’s semiconductor exports hit $101 billion in 2019, a 20 percent increase from the previous year.
And once China has developed its own advanced chip industry, it can take big steps geopolitically,” says Prakash",2021-3-16,TRT World,https://www.trtworld.com/magazine/chip-wars-us-china-and-the-battle-for-semiconductor-supremacy-45052
