query,region,title,excerpt,date,source,link
semiconductor,united+states,How Asia came to dominate chipmaking and what the U.S. wants to do about it,"The two Asian firms combined control more than 70% of the semiconductor manufacturing market.
The U.S., which was once a leader, lags behind in this space after monumental shifts in the business models in the semiconductor industry.
In February, Biden signed an executive order which involves a review of the semiconductor supply chain to identify risks.
As part of a $2 trillion economic stimulus package, $50 billion was earmarked for semiconductor manufacturing and research.
The semiconductor supply shortage ""has probably made the U.S. administration realise they aren't in control of their own destiny,"" according to Mirabaud Securities' Campling",2021-4-11,CNBC,https://www.cnbc.com/2021/04/12/us-semiconductor-policy-looks-to-cut-out-china-secure-supply-chain.html
semiconductor,united+states,"Biden meets with CEOs on semiconductor shortage, says US must invest","President Joe Biden met virtually Monday with leading CEOs for a summit on the semiconductor shortage as he works to build support for his infrastructure bill.
""We led the world in the middle of the 20th century,"" Biden said.
""We led the world toward the end of the century, we're going to lead the world again.""
Policymakers are focused on building additional semiconductor capacity in the United States, but experts say there are limited remedies in the near-term.
Biden also pointed to the semiconductor shortage as he seeks to build a case for a $2 trillion infrastructure package",2021-4-13,Mint,https://www.livemint.com/companies/news/biden-meets-with-ceos-on-semiconductor-shortage-says-us-must-invest-11618273427256.html
semiconductor,united+states,Biden meets CEOs on semiconductor shortage; Intel pledges ...,"During the meeting, Biden said he has bipartisan support for legislation to fund the semiconductor industry.
Intel last month announced plans to vastly scale up chips manufacturing for outsiders as it builds new factories in the United States and Europe.
It was also attended by White House national security adviser Jake Sullivan, National Economic Council Director Brian Deese and Commerce Secretary Gina Raimondo.
White House Press Secretary Jen Psaki told reporters that no immediate decision or announcement on alleviating the chips shortage was likely to come from the meeting.
""Trying to address supply chains on a crisis-by-crisis basis creates critical national security vulnerabilities,"" national security adviser Sullivan said in a statement",2021-4-13,The Straits Times,https://www.straitstimes.com/world/united-states/biden-meets-with-ceos-on-semiconductor-shortage-intel-promises-help-for-hurting
semiconductor,united+states,"Biden To Order Review Of US Semiconductor, IT Supply Chains","President Joe Biden is expected to sign an executive order Wednesday calling for a supply chain review of semiconductors and IT technologies, the former of which is being done to address chip shortages that are impacting multiple industries.
The White House acknowledged an underinvestment in semiconductor production that has caused to manufacturing to shift overseas — a key issue highlighted by the U.S. semiconductor executives in their recent letter to Biden.
“The United States is the birthplace of this technology, and has always been a leader in semiconductor development,” the White House said.
Beyond the 100-day review, the executive order will call for a one-year review of a “broader set of U.S. supply chains” that includes information and communications technology and other key sectors such as the defense, energy and agriculture.
As part of this one-year review, federal agencies will be directed to review risks to these supply chains and identify key manufacturing locations, the availability of substitute materials, the state of workforce skills and the role of transportation in facilitating such supply chains",2021-2-24,CRN,https://www.crn.com/news/components-peripherals/biden-to-order-review-of-u-s-semiconductor-it-supply-chains
semiconductor,united+states,Biden to press for $37 billion to boost chip manufacturing amid shortfall,"WASHINGTON (Reuters) - President Joe Biden said on Wednesday he would seek $37 billion in funding for legislation to supercharge chip manufacturing in the United States as a shortfall of semiconductors has forced U.S. automakers and other manufacturers to cut production.
“I’m directing senior officials in my administration to work with industrial leaders to identify solutions to the semiconductor shortfall,” Biden said on Wednesday.
The chip industry has pressed the Biden administration and Congress to take action to fund the provisions of the law.
“We urge the president and Congress to invest ambitiously in domestic chip manufacturing and research,” the Semiconductor Industry Association (SIA) said earlier on Wednesday.
“I strongly urge Biden administration to prioritize protecting emerging and critical technologies, like semiconductors, from the grasp of the CCP (Chinese Communist Party),” McCaul said in a recent letter",2021-2-24,Reuters,https://www.reuters.com/article/us-usa-biden-supply-chains-idUSKBN2AO13D
semiconductor,united+states,Growing computer-chip shortage alarms Biden and Congress,"Morales said there are no short-term solutions to alleviate the shortages.
Countries such as South Korea and Taiwan saw massive government investment in chip manufacturing that took decades to build.
“Maybe we still have bleeding-edge R&D in the U.S.,” he said, referring to the consensus that U.S. research and development for semiconductors is unequaled in the world.
“But it’s going to take a while to catch up” on semiconductor manufacturing, he said",2021-2-23,The Washington Post,https://www.washingtonpost.com/technology/2021/02/23/biden-semiconductor-shortage-meeting/
semiconductor,united+states,"U.S. panel recommends export 'choke points' to prevent Chinese dominance in 
semiconductors","FILE PHOTO: U.S. President Joe Biden delivers holds a semiconductor chip as he speaks prior to signing an executive order, aimed at addressing a global semiconductor chip shortage, in the State Dining Room at the White House in Washington, U.S., February 24, 2021.
REUTERS/Jonathan Ernst(Reuters) - A U.S. national security commission on Monday recommended Congress tighten up “choke points” on chipmaking technology to prevent China from overtaking the United States in semiconductors in the coming years.
The report recommends that the United States coordinate with those countries to create a policy of “presumptive denial” in each country for export licenses of advanced chipmaking tools to China.
The report also recommends formalizing into U.S. policy a longstanding regulatory practice of limiting China’s semiconductor industry to two generations behind the United States.
1 ‘protect’ strategy is to run faster” than China’s chip industry, the NSCAI official said",2021-3-1,Reuters,https://www.reuters.com/article/us-usa-china-semiconductors-idUSKCN2AT39H
semiconductor,united+states,FACT SHEET: Biden-Harris Administration Announces Supply ...,"Secure an end-to-end domestic supply chain for advanced batteriesThe Department of Energy (DOE) will release a National Blueprint for Lithium Batteries.
LPO will leverage full statutory authority to finance key strategic areas of development and fill deficits in the domestic supply chain capacity.
14017 process, ensuring that investments that support supply chain resilience and uphold international standards of environmental and social performance.
To address these challenges, the Administration will:Establish a whole-of-government effort to monitor and address transitory supply chain challengesThe Administration will establish new Supply Chain Disruptions Task Force to provide a whole-of-government response to address near-term supply chain challenges to the economic recovery.
Establish a new Supply Chain Resilience Program: We recommend Congress enact a Supply Chain Resilience Program at DOC to create a focal point within the government to monitor and address supply chain challenges",2021-6-8,The White House,https://www.whitehouse.gov/briefing-room/statements-releases/2021/06/08/fact-sheet-biden-harris-administration-announces-supply-chain-disruptions-task-force-to-address-short-term-supply-chain-discontinuities/
semiconductor,united+states,Senate China Bill to Add $52 Billion for U.S. Chip Making,"Why did this happen?
Please make sure your browser supports JavaScript and cookies and that you are not blocking them from loading.
For more information you can review our Terms of Service and Cookie Policy",2021-5-18,Bloomberg.com,https://www.bloomberg.com/news/articles/2021-05-18/china-bill-to-include-52-billion-for-u-s-chip-manufacturing
semiconductor,united+states,"The U.S. must put the vital semiconductor industry above Wall Street's 
interests","Compounding these woes is a recent, global shortage of semiconductor chips.
Reliance on overseas semiconductor producers has put the United States in an especially precarious position.
Unfortunately, that won’t happen if America’s chip industry keeps focusing on quarterly profits rather than long-term stability.
Tax break won’t do itEven as America’s chip makers keep losing ground, however, they remain destructively preoccupied with shareholder return.
America’s semiconductor equipment makers and electronic design companies must be prevented from selling to entities tied to the Chinese military",2021-4-2,MarketWatch,https://www.marketwatch.com/story/the-u-s-must-put-the-vital-semiconductor-industry-above-wall-streets-interests-11617368220
semiconductor,united+states,"In $20bn push, Intel hopes to make US chip-making great again","Intel shares rose 7.5 percent after the company disclosed its new strategy and full-year financial guidance for 2021.
Some investors such as Third Point LLC had previously urged Intel to consider spinning off its costly chip manufacturing operations.
He said on a webcast on Tuesday that Amazon.com Inc, Cisco Systems Inc, Qualcomm Inc and Microsoft Corp support its efforts to offer chip manufacturing services.
Gelsinger said Intel will aim to change the global chip manufacturing balance by embracing the foundry business where it historically has been a minor player.
Intel also announced plans for a new research collaboration with IBM focused on computing chip and packaging technology",2021-3-24,Al Jazeera,https://www.aljazeera.com/economy/2021/3/24/in-20bn-push-intel-hopes-to-make-us-chip-making-great-again
semiconductor,united+states,Intel to spend $20 billion on U.S. chip plants as CEO ...,"Some investors such as Third Point LLC had previously urged Intel to consider spinning off its costly chip manufacturing operations.
The company said it expects to spend $19 billion to $20 billion on capital expenditures.
1/2 An Intel Tiger Lake chip is displayed at an Intel news conference during the 2020 CES in Las Vegas, Nevada, U.S. January 6, 2020.
He did say on a webcast Tuesday that Amazon.com Inc (AMZN.O), Cisco Systems Inc (CSCO.O), Qualcomm Inc (QCOM.O) and Microsoft Corp (MSFT.O) support its efforts to offer chip manufacturing services.
Gelsinger said Intel will aim to change the global chip manufacturing balance by embracing the foundry business where it historically has been a minor player",2021-3-23,Reuters,https://www.reuters.com/world/asia-pacific/intel-doubles-down-chip-manufacturing-plans-20-billion-new-arizona-sites-2021-03-23/
semiconductor,united+states,Intel is spending $20 billion to build two new chip plants in Arizona,"Intel announced on Tuesday that it will spend $20 billion to build two new chip factories, called fabs, in Chandler, Arizona.
Intel stock rose as much as 5% on the news in extended trading on Tuesday.
The news comes during a global chip shortage that is snarling industries from automobiles to electronics and worries the U.S. is falling behind in semiconductor manufacturing.
Intel said its foundry division will be called Intel Foundry Services and will be led by Randhir Thakur, a current Intel senior vice president.
A slide displayed by Intel suggested that companies including Amazon, Google, Microsoft and Qualcomm could be customers for the business",2021-3-23,CNBC,https://www.cnbc.com/2021/03/23/intel-is-spending-20-billion-to-build-two-new-chip-plants-in-arizona.html
semiconductor,united+states,When the Chips Are Down: Policy Priorities for Sustaining US ...,"Key Industry DynamicsThe most important trends impacting the U.S. semiconductor industry include restoring U.S. leadership at the cutting edge of semiconductor production and increasing domestic semiconductor production.
In 2019, U.S.-headquartered enterprises’ market share of this $470 billion industry stood at 47 percent, according to the Semiconductor Industry Association’s annual assessment.
As a strategic industry, U.S. primacy in semiconductor manufacturing may dissipate if there are inadequate new facilities constructed to manufacture chips.
This is an area where Taiwan, principally through Taiwan Semiconductor Manufacturing Co., has emerged as a global leader in semiconductor fabrication.
Stephen is the author of two recent studies on the semiconductor industry, An Allied Approach to Semiconductor Leadership and Moore’s Law Under Attack: The Impact of China’s Policies on Global Semiconductor Innovation",2021-5-14,War on the Rocks,https://warontherocks.com/2021/05/when-the-chips-are-down-policy-priorities-for-sustaining-u-s-semiconductor-leadership/
semiconductor,united+states,U.S. senators propose 25% tax credit for semiconductor ...,"REUTERS/Steve Marcus/File PhotoWASHINGTON, June 17 (Reuters) - A bipartisan group of U.S. senators on Thursday proposed a 25% tax credit for investments in semiconductor manufacturing as Congress works to increase U.S. chip production.
The group did not immediately provide a cost estimate for the measure, which is on top of recent proposed semiconductor funding.
Last week, the Senate approved $52 billion for production and research on semiconductors and telecommunications equipment.
Raimondo anticipates government funding would generate ""$150 billion-plus"" in investment in chip production and research - including contributions from state and federal governments and private-sector firms.
The tax credit could benefit Taiwan Semiconductor Manufacturing Co (TSMC)  , which is building a $12 billion semiconductor factory in Arizona, and Dutch chipmaker NXP Semiconductors NV (NXPI.O) as well as U.S. firms such as Intel Corp (INTC.O) and Micron Technology Inc (MU.O)",2021-6-17,Reuters,https://www.reuters.com/world/us/us-senators-propose-new-25-tax-credit-semiconductor-manufacturing-2021-06-17/
semiconductor,united+states,US steps up talks with Taiwan to secure chip supply chain,"Washington wants to bring critical parts of the chip supply chain onto its own soil.
The AIT confirmed the meeting in a Facebook post highlighting Taiwan’s role in secure supply chains.
Washington has been urging a reshaping of global supply chains amid the ongoing tech war with Beijing and the global coronavirus pandemic.
Taiwan is playing an important role in supporting the U.S. campaign given the democratic-ruled island's advanced tech supply chains.
The AIT hosted its first public forum on supply chain restructuring in Taipei in September last year, together with EU, Canadian, and Japanese counterparts, to publicly advocate decoupling from China",2021-2-25,Nikkei Asia,https://asia.nikkei.com/Business/Tech/Semiconductors/US-steps-up-talks-with-Taiwan-to-secure-chip-supply-chain
semiconductor,united+states,"US, China to set up working group to ease tension in global chips industry","Engineers work at Xinguan Technology, a semiconductor high-tech enterprise in Dalian on April 1, 2019.
Photo: Xinhua",2021-3-11,South China Morning Post,https://www.scmp.com/tech/tech-war/article/3124962/us-and-china-set-working-group-semiconductor-restrictions-ease-export
semiconductor,united+states,Biden looks to techno-alliances to chip in on semiconductors,"Meanwhile, three East Asian semiconductor powerhouses — Japan, Taiwan and South Korea — contribute nearly 70 per cent of global semiconductor production.
The recent COVID-19 pandemic-induced chip shortage revealed long-standing vulnerabilities in US semiconductor supply chains.
In President Biden’s first economic dialogue with Taiwanese President Tsai Ing-wen, US–Taiwan collaboration on chip supply chains was at the top of the agenda.
A major issue in maintaining a US–Taiwan semiconductor alliance is the US desire to on-shore semiconductor production.
In May, the two countries announced an agreement to deepen cooperation across a range of industries, including semiconductor production",2021-08-26,East Asia Forum,https://www.eastasiaforum.org/2021/07/28/biden-looks-to-techno-alliances-to-chip-in-on-semiconductors/
semiconductor,united+states,"A global semiconductor shortage highlights a troubling trend: A small and 
shrinking number of the world's computer chips are made in the US","The U.S. share of global semiconductor fabrication is only 12%, down from 37% in 1990, according to the Semiconductor Industry Association.
It might not seem important that 88% of the semiconductor chips used by U.S. industries, including the automotive and defense industries, are fabricated outside the U.S.
Advances in semiconductor fabrication are based on the number of transistors, the smallest of a chip’s electronic components, per square millimeter.
Taiwan and Samsung in South Korea are developing 3 nanometer fabs while the U.S. does not yet have a 7 nanometer fab.
Biden’s executive order about supply chains is an important step in determining the investments needed to improve the prospects for the U.S. semiconductor industry",2021-3-9,The Conversation,https://theconversation.com/a-global-semiconductor-shortage-highlights-a-troubling-trend-a-small-and-shrinking-number-of-the-worlds-computer-chips-are-made-in-the-us-156700
semiconductor,united+states,Can The U.S. Compete For Chip Dominance?,"The Taiwan Semiconductor Manufacturing Company (TSMC) alone is responsible 
for 55% of production, and much of that happens in its home base Taiwan 
which has ",2021-08-26,Forbes,https://www.forbes.com/sites/randybrown/2021/07/14/can-the-us-compete-for-chip-dominance/
semiconductor,united+states,The World Is Dangerously Dependent on Taiwan for ...,"As China pushes the world to avoid official dealings with Taiwan, leaders across the globe are realizing just how dependent they’ve become on the island democracy.
Taiwan, which China regards as a province, is being courted for its capacity to make leading-edge computer chips.
That’s mostly down to Taiwan Semiconductor Manufacturing Co., the world’s largest foundry and go-to producer of chips for Apple Inc. smartphones, artificial intelligence and high-performance computing",2021-1-25,Bloomberg.com,https://www.bloomberg.com/news/features/2021-01-25/the-world-is-dangerously-dependent-on-taiwan-for-semiconductors
semiconductor,united+states,U.S. chip funding could result in seven to 10 new factories ...,"She said she expected states will compete for federal funding for chip facilities and that the Commerce department would have a transparent process for awarding funding.
Senator Mark Warner, a Democrat, said at Monday's event he thought the funds could result in ""seven to 10"" new fabrication plants.
Last week, Senate Democratic Leader Chuck Schumer unveiled revised bipartisan legislation to spend $52 billion for U.S. semiconductor chip production and research over five years.
Supporters of funding note the United States had a 37% share of semiconductors and microelectronics production in 1990; today just 12% of semiconductors are manufactured in the United States.
He said China had left the United States no option but to make such investments",2021-5-24,Reuters,https://www.reuters.com/technology/us-chip-funding-could-result-seven-10-new-factories-officials-2021-05-24/
semiconductor,united+states,"White House to hold another semiconductor summit with industry leaders as 
chip shortage worsens","“At its core, this is an issue that demonstrates the need not to offshore American jobs, and to bring back production of semiconductors and other auto supply parts to U.S. workers where as a nation we have more ability to respond to these demand issues,” the UAW said",2021-4-9,The Washington Post,https://www.washingtonpost.com/technology/2021/04/09/white-house-semiconductor-shortage-chips-autos/
semiconductor,united+states,Why We're in the Midst of a Global Semiconductor Shortage,"The chip shortages are expected to cause widespread shortages of everything, from electronics to medical devices to technology and networking equipment.
And in response to the shortages, Taiwan Semiconductor Manufacturing Company (TSMC), the world’s largest semiconductor manufacturer, has increased its 2021 capital spending budget to $28 billion.
To a great extent, the chip shortage has been a ticking time bomb, building since late last year due to a few (unrelated) supply-chain disruptions.
If they had monitored and mapped their supply chains, would that have alerted them sooner to the semiconductor shortages arising from the fire at a major lower-tier supplier in Japan?
The pandemic and the chip shortage have made one thing abundantly clear: A flexible, agile supply chain is crucial to navigating the changes and staying resilient",2021-2-26,Harvard Business Review,https://hbr.org/2021/02/why-were-in-the-midst-of-a-global-semiconductor-shortage
semiconductor,united+states,U.S. Commerce chief planning meeting on chip shortage ...,"Oliver Contreras/Pool via REUTERSWASHINGTON, May 10 (Reuters) - U.S. Commerce Secretary Gina Raimondo plans to hold a May 20 meeting with senior U.S. auto industry leaders and others on a semiconductor shortage that has cut production, two sources briefed on the matter said.
The meeting will include General Motors Co (GM.N), Ford Motor Co (F.N) and Stellantis NV (STLA.MI), the sources said.
She said the chip shortage was a factor in the loss of 27,000 auto sector jobs in April.
The Commerce Department did not immediately respond to a request for comment.
Reuters reported last week that the department was planning a new meeting with automakers on chips",2021-5-10,Reuters,https://www.reuters.com/technology/us-commerce-chief-planning-may-20-meeting-semiconductor-chip-shortage-sources-2021-05-10/
semiconductor,united+states,U.S. says promoting chip cooperation with Taiwan is a priority,"TAIPEI (Reuters) - The United States and Taiwan are natural partners when it comes to semiconductors and promoting this cooperation is a U.S. priority, the de facto U.S. ambassador in Taiwan said on Thursday.
FILE PHOTO: MediaTek chips are seen on a development board at the MediaTek booth during the 2015 Computex exhibition in Taipei, Taiwan, June 3, 2015.
REUTERS/Pichi ChuangWashington has increasingly viewed tech-powerhouse and democratically ruled Taiwan as a key part of its strategy to shift global supply chains away from China, especially when it comes to technology and chip companies.
Foreign governments and companies have also beseeched Taiwan to help resolve a shortage of auto chips which have idled factories around the world.
U.S. companies are not standing still either, and this week Intel Corp announced a $20 billion plan to expand its advanced chip manufacturing capacity",2021-3-24,Reuters,https://www.reuters.com/article/us-taiwan-usa-semiconductors-idUSKBN2BH0JY
semiconductor,united+states,U.S. Commerce Dept. presses Taiwan for more chips to ...,"The logo of Taiwan Semiconductor Manufacturing Co (TSMC) is pictured at its headquarters, in Hsinchu, Taiwan, Jan. 19, 2021.
REUTERS/Ann WangWASHINGTON, May 4 (Reuters) - The U.S. Commerce Department is pressing Taiwan Semiconductor Manufacturing Co Ltd (2330.TW) and other Taiwanese firms to prioritise the needs of U.S. automakers to ease chip shortages in the near term, Commerce Secretary Gina Raimondo said.
Wei expected the chip shortage for the firm's auto clients to be greatly reduced from the next quarter.
The Commerce Department plans a meeting with automakers next week on the chip shortage issue, said officials briefed on the matter.
On April 12, President Joe Biden convened semiconductor and auto industry executives to discuss solutions to the crisis",2021-5-4,Reuters,https://www.reuters.com/technology/us-commerce-dept-pressing-taiwan-supply-more-chips-us-automakers-2021-05-04/
semiconductor,united+states,"US Faces a National Security Chips Crisis, Raimondo Says","Why did this happen?
Please make sure your browser supports JavaScript and cookies and that you are not blocking them from loading.
For more information you can review our Terms of Service and Cookie Policy",2021-4-20,Bloomberg.com,https://www.bloomberg.com/news/articles/2021-04-20/u-s-faces-national-security-crisis-on-chips-raimondo-says
